w7900-perf/tunableop_results0.csv
Validator,PT_VERSION,2.6.0
Validator,ROCM_VERSION,6.3.1.0-40-ce2be3b
Validator,HIPBLASLT_VERSION,1000-b4e5042b
Validator,GCN_ARCH_NAME,gfx1100
Validator,ROCBLAS_VERSION,4.3.0-8ebd6c11
GemmTunableOp_Half_TN,tn_151552_23_4096,Gemm_Rocblas_1140853614,1.80138
GemmTunableOp_Half_TN,tn_151552_32_4096,Gemm_Rocblas_1140853599,1.82268
GemmTunableOp_Half_TN,tn_151552_37_4096,Gemm_Rocblas_1140853645,1.83588
GemmTunableOp_Half_TN,tn_151552_40_4096,Gemm_Rocblas_1140853645,1.84552
GemmTunableOp_Half_TN,tn_151552_41_4096,Gemm_Rocblas_1140853629,1.84817
GemmTunableOp_Half_TN,tn_151552_52_4096,Gemm_Rocblas_1140853648,1.87637
GemmTunableOp_Half_TN,tn_151552_62_4096,Gemm_Rocblas_1140853630,1.90156
GemmTunableOp_Half_TN,tn_151552_74_4096,Gemm_Hipblaslt_TN_148165,2.4326
GemmTunableOp_Half_TN,tn_151552_91_4096,Gemm_Hipblaslt_TN_148165,2.47907
GemmTunableOp_Half_TN,tn_151552_93_4096,Gemm_Hipblaslt_TN_148165,2.47789
GemmTunableOp_Half_TN,tn_151552_108_4096,Gemm_Rocblas_1140853619,2.5993
GemmTunableOp_Half_TN,tn_151552_117_4096,Gemm_Rocblas_1140853645,2.59398
GemmTunableOp_Half_TN,tn_151552_125_4096,Gemm_Rocblas_1140853645,2.58449
GemmTunableOp_Half_TN,tn_151552_164_4096,Gemm_Rocblas_1140853619,3.69724
GemmTunableOp_Half_TN,tn_151552_44_4096,Gemm_Rocblas_1140853645,1.85406
GemmTunableOp_Half_TN,tn_151552_167_4096,Gemm_Rocblas_1140853619,3.72179
GemmTunableOp_Half_TN,tn_151552_170_4096,Gemm_Rocblas_1140853619,3.74156
GemmTunableOp_Half_TN,tn_151552_177_4096,Gemm_Rocblas_1140853619,3.80476
GemmTunableOp_Half_TN,tn_151552_178_4096,Gemm_Rocblas_1140853619,3.82563
GemmTunableOp_Half_TN,tn_151552_180_4096,Gemm_Rocblas_1140853619,3.83601
GemmTunableOp_Half_TN,tn_151552_191_4096,Default,3.84759
GemmTunableOp_Half_TN,tn_151552_199_4096,Gemm_Rocblas_1140853638,4.62895
GemmTunableOp_Half_TN,tn_151552_210_4096,Gemm_Rocblas_1140853619,4.70541
GemmTunableOp_Half_TN,tn_151552_217_4096,Gemm_Rocblas_1140853638,4.70086
GemmTunableOp_Half_TN,tn_151552_222_4096,Gemm_Rocblas_1140853619,4.68373
GemmTunableOp_Half_TN,tn_151552_231_4096,Gemm_Rocblas_1140853619,4.76796
GemmTunableOp_Half_TN,tn_151552_234_4096,Gemm_Rocblas_1140853619,4.8161
GemmTunableOp_Half_TN,tn_151552_238_4096,Gemm_Rocblas_1140853627,4.83894
GemmTunableOp_Half_TN,tn_151552_242_4096,Gemm_Rocblas_1140853627,4.82588
GemmTunableOp_Half_TN,tn_151552_246_4096,Gemm_Rocblas_1140853627,4.89578
GemmTunableOp_Half_TN,tn_151552_247_4096,Gemm_Rocblas_1140853619,4.92616
GemmTunableOp_Half_TN,tn_151552_251_4096,Gemm_Rocblas_1140853627,4.93363
GemmTunableOp_Half_TN,tn_27392_511_4096,Gemm_Rocblas_1140853649,1.69767
GemmTunableOp_Half_TN,tn_4096_423_13696,Gemm_Rocblas_1140853557,0.696756
GemmTunableOp_Half_TN,tn_27392_423_4096,Gemm_Rocblas_1140853649,1.46692
GemmTunableOp_Half_TN,tn_4096_423_4096,Gemm_Rocblas_1140853648,0.205697
GemmTunableOp_Half_TN,tn_4096_570_13696,Gemm_Rocblas_1140853545,0.855485
GemmTunableOp_Half_TN,tn_27392_570_4096,Default,1.79839
GemmTunableOp_Half_TN,tn_4096_511_13696,Gemm_Rocblas_1140853557,0.718244
GemmTunableOp_Half_TN,tn_27392_529_4096,Default,1.81301
GemmTunableOp_Half_TN,tn_4096_529_4096,Gemm_Rocblas_1140853628,0.262066
GemmTunableOp_Half_TN,tn_27392_454_4096,Default,1.56928
GemmTunableOp_Half_TN,tn_4096_454_4096,Gemm_Rocblas_1140853587,0.224913
GemmTunableOp_Half_TN,tn_27392_442_4096,Default,1.53938
GemmTunableOp_Half_TN,tn_27392_571_4096,Default,1.83795
GemmTunableOp_Half_TN,tn_4096_571_4096,Gemm_Rocblas_1140853630,0.263577
GemmTunableOp_Half_TN,tn_4096_291_13696,Gemm_Rocblas_1140853550,0.504291
GemmTunableOp_Half_TN,tn_4096_291_4096,Gemm_Rocblas_1140853557,0.140177
GemmTunableOp_Half_TN,tn_27392_427_4096,Gemm_Rocblas_1140853649,1.48145
GemmTunableOp_Half_TN,tn_4096_427_4096,Gemm_Rocblas_1140853649,0.193185
GemmTunableOp_Half_TN,tn_4096_465_13696,Gemm_Rocblas_1140853557,0.709148
GemmTunableOp_Half_TN,tn_27392_465_4096,Default,1.59845
GemmTunableOp_Half_TN,tn_4096_465_4096,Gemm_Rocblas_1140853557,0.216401
GemmTunableOp_Half_TN,tn_4096_713_13696,Gemm_Rocblas_1140853576,0.907581
GemmTunableOp_Half_TN,tn_27392_713_4096,Default,2.34878
GemmTunableOp_Half_TN,tn_151552_154_4096,Gemm_Hipblaslt_TN_148174,3.63036
GemmTunableOp_Half_TN,tn_4096_713_4096,Gemm_Rocblas_1140853583,0.348538
GemmTunableOp_Half_TN,tn_27392_547_4096,Default,1.80903
GemmTunableOp_Half_TN,tn_4096_609_13696,Gemm_Rocblas_1140853545,0.855405
GemmTunableOp_Half_TN,tn_27392_609_4096,Default,2.10993
GemmTunableOp_Half_TN,tn_4096_425_13696,Gemm_Rocblas_1140853557,0.697644
GemmTunableOp_Half_TN,tn_4096_425_4096,Gemm_Rocblas_1140853645,0.202017
GemmTunableOp_Half_TN,tn_27392_300_4096,Gemm_Rocblas_1140853649,1.13791
GemmTunableOp_Half_TN,tn_4096_441_13696,Gemm_Rocblas_1140853580,0.699356
GemmTunableOp_Half_TN,tn_27392_441_4096,Gemm_Rocblas_1140853649,1.50293
GemmTunableOp_Half_TN,tn_4096_483_13696,Gemm_Rocblas_1140853557,0.712044
GemmTunableOp_Half_TN,tn_4096_483_4096,Gemm_Rocblas_1140853578,0.225209
GemmTunableOp_Half_TN,tn_4096_451_13696,Gemm_Rocblas_1140853557,0.703412
GemmTunableOp_Half_TN,tn_27392_451_4096,Gemm_Rocblas_1140853564,1.57685
GemmTunableOp_Half_TN,tn_4096_451_4096,Gemm_Rocblas_1140853587,0.220401
GemmTunableOp_Half_TN,tn_27392_614_4096,Default,2.13104
GemmTunableOp_Half_TN,tn_4096_374_13696,Gemm_Rocblas_1140853550,0.518795
GemmTunableOp_Half_TN,tn_4096_374_4096,Gemm_Rocblas_1140853557,0.151873
GemmTunableOp_Half_TN,tn_4096_373_4096,Gemm_Rocblas_1140853557,0.154817
GemmTunableOp_Half_TN,tn_4096_319_13696,Gemm_Rocblas_1140853580,0.505099
GemmTunableOp_Half_TN,tn_4096_319_4096,Gemm_Rocblas_1140853587,0.145649
GemmTunableOp_Half_TN,tn_4096_511_4096,Gemm_Rocblas_1140853587,0.232097
GemmTunableOp_Half_TN,tn_4096_512_13696,Gemm_Rocblas_1140853578,0.718076
GemmTunableOp_Half_TN,tn_4096_512_4096,Gemm_Rocblas_1140853557,0.228457
GemmTunableOp_Half_TN,tn_4096_294_13696,Gemm_Rocblas_1140853550,0.507347
GemmTunableOp_Half_TN,tn_27392_524_4096,Default,1.75238
GemmTunableOp_Half_TN,tn_4096_582_13696,Gemm_Rocblas_1140853545,0.843741
GemmTunableOp_Half_TN,tn_27392_582_4096,Default,2.10575
GemmTunableOp_Half_TN,tn_4096_428_13696,Gemm_Rocblas_1140853557,0.694724
GemmTunableOp_Half_TN,tn_4096_477_13696,Gemm_Rocblas_1140853557,0.702916
GemmTunableOp_Half_TN,tn_27392_477_4096,Default,1.60524
GemmTunableOp_Half_TN,tn_4096_433_13696,Gemm_Rocblas_1140853557,0.695956
GemmTunableOp_Half_TN,tn_27392_433_4096,Gemm_Rocblas_1140853649,1.47254
GemmTunableOp_Half_TN,tn_4096_531_4096,Gemm_Rocblas_1140853630,0.28693
GemmTunableOp_Half_TN,tn_4096_495_13696,Gemm_Rocblas_1140853557,0.719236
GemmTunableOp_Half_TN,tn_4096_455_13696,Gemm_Rocblas_1140853557,0.707636
GemmTunableOp_Half_TN,tn_27392_455_4096,Default,1.58683
GemmTunableOp_Half_TN,tn_27392_435_4096,Gemm_Rocblas_1140853649,1.48583
GemmTunableOp_Half_TN,tn_151552_20_4096,Gemm_Rocblas_1140853614,1.79621
GemmTunableOp_Half_TN,tn_4096_454_13696,Gemm_Rocblas_1140853557,0.703836
GemmTunableOp_Half_TN,tn_4096_435_4096,Gemm_Rocblas_1140853645,0.210049
GemmTunableOp_Half_TN,tn_27392_342_4096,Default,1.13723
GemmTunableOp_Half_TN,tn_4096_342_4096,Gemm_Rocblas_1140853557,0.149593
GemmTunableOp_Half_TN,tn_4096_534_13696,Gemm_Rocblas_1140853545,0.847213
GemmTunableOp_Half_TN,tn_27392_534_4096,Default,1.76009
GemmTunableOp_Half_TN,tn_4096_492_4096,Gemm_Rocblas_1140853578,0.242649
GemmTunableOp_Half_TN,tn_4096_536_13696,Gemm_Rocblas_1140853545,0.852141
GemmTunableOp_Half_TN,tn_27392_536_4096,Default,1.80185
GemmTunableOp_Half_TN,tn_4096_536_4096,Gemm_Rocblas_1140853628,0.286402
GemmTunableOp_Half_TN,tn_4096_525_13696,Gemm_Rocblas_1140853545,0.847541
GemmTunableOp_Half_TN,tn_27392_481_4096,Gemm_Rocblas_1140853649,1.66267
GemmTunableOp_Half_TN,tn_4096_481_4096,Gemm_Rocblas_1140853579,0.230113
GemmTunableOp_Half_TN,tn_4096_401_4096,Gemm_Rocblas_1140853645,0.203673
GemmTunableOp_Half_TN,tn_4096_490_13696,Gemm_Rocblas_1140853578,0.719437
GemmTunableOp_Half_TN,tn_27392_490_4096,Gemm_Rocblas_1140853619,1.75404
GemmTunableOp_Half_TN,tn_4096_490_4096,Gemm_Rocblas_1140853548,0.233697
GemmTunableOp_Half_TN,tn_27392_503_4096,Gemm_Rocblas_1140853649,1.67189
GemmTunableOp_Half_TN,tn_4096_390_13696,Gemm_Rocblas_1140853557,0.686228
GemmTunableOp_Half_TN,tn_4096_390_4096,Gemm_Rocblas_1140853645,0.200545
GemmTunableOp_Half_TN,tn_4096_561_13696,Gemm_Rocblas_1140853545,0.854766
GemmTunableOp_Half_TN,tn_27392_561_4096,Default,1.82528
GemmTunableOp_Half_TN,tn_4096_464_13696,Gemm_Rocblas_1140853557,0.70558
GemmTunableOp_Half_TN,tn_4096_561_4096,Gemm_Rocblas_1140853629,0.285634
GemmTunableOp_Half_TN,tn_4096_434_4096,Gemm_Rocblas_1140853645,0.207905
GemmTunableOp_Half_TN,tn_4096_537_13696,Gemm_Rocblas_1140853545,0.853734
GemmTunableOp_Half_TN,tn_4096_537_4096,Gemm_Rocblas_1140853628,0.285706
GemmTunableOp_Half_TN,tn_4096_412_13696,Gemm_Rocblas_1140853578,0.727533
GemmTunableOp_Half_TN,tn_27392_412_4096,Gemm_Rocblas_1140853649,1.54075
GemmTunableOp_Half_TN,tn_4096_459_13696,Gemm_Rocblas_1140853578,0.738085
GemmTunableOp_Half_TN,tn_27392_459_4096,Default,1.55952
GemmTunableOp_Half_TN,tn_4096_459_4096,Gemm_Rocblas_1140853548,0.233593
GemmTunableOp_Half_TN,tn_4096_379_13696,Gemm_Rocblas_1140853550,0.562004
GemmTunableOp_Half_TN,tn_4096_514_13696,Gemm_Rocblas_1140853545,0.838701
GemmTunableOp_Half_TN,tn_4096_2714_13696,Gemm_Rocblas_1140853576,3.68673
GemmTunableOp_Half_TN,tn_4096_2714_4096,Gemm_Rocblas_1140853627,1.13332
GemmTunableOp_Half_TN,tn_4096_16_13696,Gemm_Hipblaslt_TN_148177,0.184633
GemmTunableOp_Half_TN,tn_4096_16_4096,Gemm_Rocblas_1140853617,0.0345202
GemmTunableOp_Half_TN,tn_4096_32_13696,Gemm_Hipblaslt_TN_148178,0.189089
GemmTunableOp_Half_TN,tn_27392_32_4096,Gemm_Rocblas_1140853614,0.336194
GemmTunableOp_Half_TN,tn_4096_32_4096,Gemm_Rocblas_1140853617,0.0344482
GemmTunableOp_Half_TN,tn_4096_40_13696,Gemm_Rocblas_1140853594,0.197169
GemmTunableOp_Half_TN,tn_4096_40_4096,Gemm_Rocblas_1140853632,0.0460482
GemmTunableOp_Half_TN,tn_4096_48_13696,Gemm_Rocblas_1140853593,0.197889
GemmTunableOp_Half_TN,tn_27392_48_4096,Gemm_Rocblas_1140853648,0.346394
GemmTunableOp_Half_TN,tn_4096_48_4096,Gemm_Rocblas_1140853632,0.0458244
GemmTunableOp_Half_TN,tn_4096_56_13696,Gemm_Rocblas_1140853594,0.199281
GemmTunableOp_Half_TN,tn_4096_80_4096,Gemm_Rocblas_1140853633,0.0608484
GemmTunableOp_Half_TN,tn_4096_112_4096,Gemm_Rocblas_1140853628,0.0622324
GemmTunableOp_Half_TN,tn_27392_120_4096,Gemm_Rocblas_1140853629,0.449603
GemmTunableOp_Half_TN,tn_4096_176_13696,Gemm_Rocblas_1140853620,0.306994
GemmTunableOp_Half_TN,tn_27392_176_4096,Gemm_Rocblas_1140853645,0.664013
GemmTunableOp_Half_TN,tn_27392_192_4096,Gemm_Rocblas_1140853645,0.675573
GemmTunableOp_Half_TN,tn_4096_208_13696,Gemm_Rocblas_1140853515,0.400795
GemmTunableOp_Half_TN,tn_4096_224_13696,Gemm_Rocblas_1140853515,0.405995
GemmTunableOp_Half_TN,tn_27392_224_4096,Gemm_Rocblas_1140853583,0.778861
GemmTunableOp_Half_TN,tn_4096_294_4096,Gemm_Rocblas_1140853587,0.145025
GemmTunableOp_Half_TN,tn_4096_224_4096,Gemm_Rocblas_1140853646,0.127841
GemmTunableOp_Half_TN,tn_27392_24_4096,Gemm_Rocblas_1140853599,0.334769
GemmTunableOp_Half_TN,tn_27392_73_4096,Gemm_Rocblas_1140853628,0.429239
GemmTunableOp_Half_TN,tn_4096_24_4096,Gemm_Rocblas_1140853596,0.0349592
GemmTunableOp_Half_TN,tn_4096_324_13696,Gemm_Rocblas_1140853550,0.474627
GemmTunableOp_Half_TN,tn_4096_25_13696,Gemm_Hipblaslt_TN_148112,0.182116
GemmTunableOp_Half_TN,tn_4096_25_4096,Gemm_Rocblas_1140853615,0.0344152
GemmTunableOp_Half_TN,tn_4096_26_13696,Gemm_Hipblaslt_TN_148127,0.180236
GemmTunableOp_Half_TN,tn_27392_513_4096,Default,1.79643
GemmTunableOp_Half_TN,tn_4096_26_4096,Gemm_Rocblas_1140853598,0.0336552
GemmTunableOp_Half_TN,tn_27392_21_4096,Gemm_Rocblas_1140853599,0.33468
GemmTunableOp_Half_TN,tn_151552_27_4096,Gemm_Rocblas_1140853599,1.80845
GemmTunableOp_Half_TN,tn_27392_40_4096,Gemm_Rocblas_1140853633,0.344634
GemmTunableOp_Half_TN,tn_4096_27_13696,Gemm_Hipblaslt_TN_148112,0.182812
GemmTunableOp_Half_TN,tn_27392_27_4096,Gemm_Rocblas_1140853599,0.335641
GemmTunableOp_Half_TN,tn_4096_141_4096,Gemm_Rocblas_1140853519,0.0813506
GemmTunableOp_Half_TN,tn_27392_28_4096,Gemm_Rocblas_1140853614,0.335832
GemmTunableOp_Half_TN,tn_4096_243_4096,Gemm_Rocblas_1140853647,0.129858
GemmTunableOp_Half_TN,tn_4096_29_13696,Gemm_Hipblaslt_TN_148180,0.178892
GemmTunableOp_Half_TN,tn_4096_329_4096,Gemm_Rocblas_1140853587,0.138523
GemmTunableOp_Half_TN,tn_27392_29_4096,Gemm_Rocblas_1140853599,0.334944
GemmTunableOp_Half_TN,tn_4096_56_4096,Gemm_Rocblas_1140853632,0.0461522
GemmTunableOp_Half_TN,tn_27392_30_4096,Gemm_Rocblas_1140853614,0.335665
GemmTunableOp_Half_TN,tn_4096_30_4096,Gemm_Rocblas_1140853611,0.0335592
GemmTunableOp_Half_TN,tn_27392_544_4096,Default,1.79796
GemmTunableOp_Half_TN,tn_151552_31_4096,Gemm_Rocblas_1140853614,1.81632
GemmTunableOp_Half_TN,tn_27392_486_4096,Gemm_Rocblas_1140853649,1.7505
GemmTunableOp_Half_TN,tn_27392_31_4096,Gemm_Rocblas_1140853614,0.335192
GemmTunableOp_Half_TN,tn_4096_33_13696,Gemm_Rocblas_1140853647,0.192028
GemmTunableOp_Half_TN,tn_27392_33_4096,Gemm_Rocblas_1140853629,0.342712
GemmTunableOp_Half_TN,tn_4096_33_4096,Gemm_Rocblas_1140853647,0.044759
GemmTunableOp_Half_TN,tn_4096_132_13696,Gemm_Rocblas_1140853520,0.295051
GemmTunableOp_Half_TN,tn_151552_34_4096,Gemm_Rocblas_1140853645,1.82825
GemmTunableOp_Half_TN,tn_4096_176_4096,Gemm_Rocblas_1140853520,0.0812244
GemmTunableOp_Half_TN,tn_27392_34_4096,Gemm_Rocblas_1140853648,0.343272
GemmTunableOp_Half_TN,tn_4096_34_4096,Gemm_Rocblas_1140853646,0.043255
GemmTunableOp_Half_TN,tn_4096_380_13696,Gemm_Rocblas_1140853550,0.479824
GemmTunableOp_Half_TN,tn_151552_38_4096,Gemm_Rocblas_1140853645,1.83449
GemmTunableOp_Half_TN,tn_151552_39_4096,Gemm_Rocblas_1140853653,1.82634
GemmTunableOp_Half_TN,tn_27392_39_4096,Gemm_Rocblas_1140853628,0.343896
GemmTunableOp_Half_TN,tn_27392_174_4096,Gemm_Rocblas_1140853628,0.649473
GemmTunableOp_Half_TN,tn_4096_42_13696,Gemm_Rocblas_1140853594,0.19518
GemmTunableOp_Half_TN,tn_27392_548_4096,Default,1.80247
GemmTunableOp_Half_TN,tn_27392_45_4096,Gemm_Rocblas_1140853648,0.34448
GemmTunableOp_Half_TN,tn_27392_836_4096,Default,2.79801
GemmTunableOp_Half_TN,tn_4096_46_13696,Gemm_Rocblas_1140853594,0.19638
GemmTunableOp_Half_TN,tn_151552_88_4096,Gemm_Rocblas_1140853645,2.57199
GemmTunableOp_Half_TN,tn_27392_46_4096,Gemm_Rocblas_1140853628,0.34564
GemmTunableOp_Half_TN,tn_151552_228_4096,Gemm_Rocblas_1140853638,4.29085
GemmTunableOp_Half_TN,tn_27392_161_4096,Gemm_Rocblas_1140853645,0.634727
GemmTunableOp_Half_TN,tn_27392_317_4096,Gemm_Rocblas_1140853649,1.03507
GemmTunableOp_Half_TN,tn_4096_46_4096,Gemm_Rocblas_1140853646,0.043759
GemmTunableOp_Half_TN,tn_4096_49_13696,Gemm_Rocblas_1140853593,0.195812
GemmTunableOp_Half_TN,tn_27392_554_4096,Default,1.8161
GemmTunableOp_Half_TN,tn_4096_494_4096,Gemm_Rocblas_1140853587,0.2213
GemmTunableOp_Half_TN,tn_151552_14_4096,Gemm_Rocblas_1140853628,1.78148
GemmTunableOp_Half_TN,tn_27392_50_4096,Gemm_Rocblas_1140853648,0.346072
GemmTunableOp_Half_TN,tn_151552_51_4096,Gemm_Rocblas_1140853653,1.83664
GemmTunableOp_Half_TN,tn_4096_51_13696,Gemm_Rocblas_1140853594,0.196788
GemmTunableOp_Half_TN,tn_4096_51_4096,Gemm_Rocblas_1140853646,0.043199
GemmTunableOp_Half_TN,tn_4096_54_13696,Gemm_Rocblas_1140853593,0.197492
GemmTunableOp_Half_TN,tn_27392_55_4096,Gemm_Rocblas_1140853645,0.347888
GemmTunableOp_Half_TN,tn_4096_55_4096,Gemm_Rocblas_1140853632,0.049063
GemmTunableOp_Half_TN,tn_151552_58_4096,Gemm_Rocblas_1140853653,1.8191
GemmTunableOp_Half_TN,tn_4096_342_13696,Gemm_Rocblas_1140853550,0.515547
GemmTunableOp_Half_TN,tn_4096_58_13696,Gemm_Rocblas_1140853594,0.197652
GemmTunableOp_Half_TN,tn_4096_488_13696,Gemm_Rocblas_1140853557,0.707692
GemmTunableOp_Half_TN,tn_27392_58_4096,Gemm_Rocblas_1140853648,0.348608
GemmTunableOp_Half_TN,tn_4096_58_4096,Gemm_Rocblas_1140853647,0.043271
GemmTunableOp_Half_TN,tn_151552_59_4096,Gemm_Rocblas_1140853637,1.84322
GemmTunableOp_Half_TN,tn_151552_60_4096,Gemm_Rocblas_1140853653,1.82007
GemmTunableOp_Half_TN,tn_27392_60_4096,Gemm_Rocblas_1140853648,0.349488
GemmTunableOp_Half_TN,tn_4096_60_4096,Gemm_Rocblas_1140853647,0.0439592
GemmTunableOp_Half_TN,tn_27392_63_4096,Gemm_Rocblas_1140853648,0.348624
GemmTunableOp_Half_TN,tn_4096_63_4096,Gemm_Rocblas_1140853652,0.044863
GemmTunableOp_Half_TN,tn_4096_414_4096,Gemm_Rocblas_1140853648,0.196451
GemmTunableOp_Half_TN,tn_4096_64_4096,Gemm_Rocblas_1140853647,0.0429992
GemmTunableOp_Half_TN,tn_27392_65_4096,Gemm_Rocblas_1140853645,0.422159
GemmTunableOp_Half_TN,tn_151552_66_4096,Default,2.28544
GemmTunableOp_Half_TN,tn_4096_193_13696,Gemm_Rocblas_1140853515,0.403149
GemmTunableOp_Half_TN,tn_27392_66_4096,Gemm_Rocblas_1140853645,0.426319
GemmTunableOp_Half_TN,tn_151552_68_4096,Default,2.30648
GemmTunableOp_Half_TN,tn_4096_68_4096,Gemm_Rocblas_1140853648,0.0609746
GemmTunableOp_Half_TN,tn_151552_69_4096,Gemm_Hipblaslt_TN_148165,2.34228
GemmTunableOp_Half_TN,tn_4096_328_13696,Gemm_Rocblas_1140853550,0.474434
GemmTunableOp_Half_TN,tn_4096_69_13696,Gemm_Hipblaslt_TN_148168,0.211779
GemmTunableOp_Half_TN,tn_151552_70_4096,Default,2.33477
GemmTunableOp_Half_TN,tn_4096_36_13696,Gemm_Rocblas_1140853593,0.19426
GemmTunableOp_Half_TN,tn_151552_156_4096,Gemm_Hipblaslt_TN_148174,3.2565
GemmTunableOp_Half_TN,tn_4096_525_4096,Gemm_Rocblas_1140853629,0.28869
GemmTunableOp_Half_TN,tn_4096_450_13696,Gemm_Rocblas_1140853557,0.62774
GemmTunableOp_Half_TN,tn_4096_446_4096,Gemm_Rocblas_1140853645,0.199851
GemmTunableOp_Half_TN,tn_27392_377_4096,Default,1.15368
GemmTunableOp_Half_TN,tn_4096_349_13696,Gemm_Rocblas_1140853550,0.476354
GemmTunableOp_Half_TN,tn_27392_299_4096,Gemm_Rocblas_1140853649,1.13291
GemmTunableOp_Half_TN,tn_4096_505_4096,Gemm_Rocblas_1140853557,0.220451
GemmTunableOp_Half_TN,tn_27392_404_4096,Gemm_Rocblas_1140853649,1.51503
GemmTunableOp_Half_TN,tn_4096_321_4096,Gemm_Rocblas_1140853587,0.136179
GemmTunableOp_Half_TN,tn_27392_518_4096,Default,1.77536
GemmTunableOp_Half_TN,tn_4096_524_4096,Gemm_Rocblas_1140853629,0.290234
GemmTunableOp_Half_TN,tn_4096_466_13696,Gemm_Rocblas_1140853557,0.626495
GemmTunableOp_Half_TN,tn_27392_248_4096,Gemm_Rocblas_1140853552,0.821636
GemmTunableOp_Half_TN,tn_27392_96_4096,Gemm_Rocblas_1140853645,0.433943
GemmTunableOp_Half_TN,tn_27392_466_4096,Default,1.561
GemmTunableOp_Half_TN,tn_4096_369_13696,Gemm_Rocblas_1140853550,0.477888
GemmTunableOp_Half_TN,tn_4096_203_4096,Gemm_Rocblas_1140853646,0.122224
GemmTunableOp_Half_TN,tn_4096_481_13696,Gemm_Rocblas_1140853557,0.71098
GemmTunableOp_Half_TN,tn_4096_348_13696,Gemm_Rocblas_1140853550,0.490919
GemmTunableOp_Half_TN,tn_27392_409_4096,Gemm_Rocblas_1140853649,1.45725
GemmTunableOp_Half_TN,tn_4096_387_13696,Gemm_Rocblas_1140853557,0.642204
GemmTunableOp_Half_TN,tn_4096_347_4096,Gemm_Rocblas_1140853557,0.141026
GemmTunableOp_Half_TN,tn_4096_198_4096,Gemm_Rocblas_1140853632,0.126304
GemmTunableOp_Half_TN,tn_4096_359_13696,Gemm_Rocblas_1140853550,0.477463
GemmTunableOp_Half_TN,tn_4096_363_13696,Gemm_Rocblas_1140853550,0.496746
GemmTunableOp_Half_TN,tn_151552_175_4096,Gemm_Rocblas_1140853619,3.79071
GemmTunableOp_Half_TN,tn_4096_47_4096,Gemm_Rocblas_1140853651,0.043951
GemmTunableOp_Half_TN,tn_4096_77_13696,Gemm_Hipblaslt_TN_148168,0.213707
GemmTunableOp_Half_TN,tn_4096_318_4096,Gemm_Rocblas_1140853557,0.137314
GemmTunableOp_Half_TN,tn_27392_16384_4096,Gemm_Rocblas_1140853644,50.4664
GemmTunableOp_Half_TN,tn_4096_622_4096,Gemm_Rocblas_1140853629,0.286997
GemmTunableOp_Half_TN,tn_4096_358_13696,Gemm_Rocblas_1140853550,0.490984
GemmTunableOp_Half_TN,tn_151552_195_4096,Gemm_Rocblas_1140853638,4.15392
GemmTunableOp_Half_TN,tn_27392_452_4096,Default,1.60867
GemmTunableOp_Half_TN,tn_4096_60_13696,Gemm_Rocblas_1140853593,0.197524
GemmTunableOp_Half_TN,tn_151552_104_4096,Gemm_Rocblas_1140853645,2.42908
GemmTunableOp_Half_TN,tn_4096_399_13696,Gemm_Rocblas_1140853557,0.641443
GemmTunableOp_Half_TN,tn_4096_683_13696,Gemm_Rocblas_1140853576,0.815558
GemmTunableOp_Half_TN,tn_27392_335_4096,Default,1.13645
GemmTunableOp_Half_TN,tn_4096_431_13696,Gemm_Rocblas_1140853557,0.611764
GemmTunableOp_Half_TN,tn_4096_444_13696,Gemm_Rocblas_1140853557,0.622667
GemmTunableOp_Half_TN,tn_4096_487_4096,Gemm_Rocblas_1140853557,0.219099
GemmTunableOp_Half_TN,tn_27392_347_4096,Default,1.13511
GemmTunableOp_Half_TN,tn_27392_138_4096,Gemm_Rocblas_1140853628,0.587566
GemmTunableOp_Half_TN,tn_4096_496_4096,Gemm_Rocblas_1140853587,0.223788
GemmTunableOp_Half_TN,tn_4096_545_13696,Gemm_Rocblas_1140853545,0.836254
GemmTunableOp_Half_TN,tn_27392_11_4096,Gemm_Rocblas_1140853614,0.332337
GemmTunableOp_Half_TN,tn_27392_341_4096,Default,1.11212
GemmTunableOp_Half_TN,tn_4096_377_4096,Gemm_Rocblas_1140853587,0.141851
GemmTunableOp_Half_TN,tn_27392_189_4096,Gemm_Rocblas_1140853645,0.673138
GemmTunableOp_Half_TN,tn_4096_309_13696,Gemm_Rocblas_1140853550,0.497698
GemmTunableOp_Half_TN,tn_4096_6_4096,Gemm_Rocblas_1140853611,0.0336312
GemmTunableOp_Half_TN,tn_4096_323_13696,Gemm_Rocblas_1140853550,0.490547
GemmTunableOp_Half_TN,tn_4096_486_4096,Gemm_Rocblas_1140853587,0.220844
GemmTunableOp_Half_TN,tn_4096_376_13696,Gemm_Rocblas_1140853550,0.48273
GemmTunableOp_Half_TN,tn_151552_132_4096,Gemm_Hipblaslt_TN_148174,3.55463
GemmTunableOp_Half_TN,tn_151552_160_4096,Gemm_Hipblaslt_TN_148174,3.65299
GemmTunableOp_Half_TN,tn_4096_29_4096,Gemm_Rocblas_1140853617,0.0368152
GemmTunableOp_Half_TN,tn_27392_330_4096,Default,1.10826
GemmTunableOp_Half_TN,tn_4096_341_4096,Gemm_Rocblas_1140853557,0.140747
GemmTunableOp_Half_TN,tn_4096_192_13696,Gemm_Rocblas_1140853620,0.310714
GemmTunableOp_Half_TN,tn_4096_12_13696,Gemm_Hipblaslt_TN_148127,0.176668
GemmTunableOp_Half_TN,tn_4096_364_13696,Gemm_Rocblas_1140853550,0.491744
GemmTunableOp_Half_TN,tn_27392_463_4096,Gemm_Rocblas_1140853589,1.58785
GemmTunableOp_Half_TN,tn_151552_80_4096,Gemm_Rocblas_1140853645,2.42253
GemmTunableOp_Half_TN,tn_4096_332_4096,Gemm_Rocblas_1140853587,0.140138
GemmTunableOp_Half_TN,tn_4096_404_13696,Gemm_Rocblas_1140853557,0.64355
GemmTunableOp_Half_TN,tn_4096_137_4096,Gemm_Rocblas_1140853628,0.0733508
GemmTunableOp_Half_TN,tn_4096_422_13696,Gemm_Rocblas_1140853557,0.643724
GemmTunableOp_Half_TN,tn_27392_453_4096,Default,1.5896
GemmTunableOp_Half_TN,tn_4096_323_4096,Gemm_Rocblas_1140853557,0.137571
GemmTunableOp_Half_TN,tn_4096_518_13696,Gemm_Rocblas_1140853545,0.845917
GemmTunableOp_Half_TN,tn_151552_133_4096,Gemm_Rocblas_1140853619,3.59286
GemmTunableOp_Half_TN,tn_4096_333_13696,Gemm_Rocblas_1140853550,0.475016
GemmTunableOp_Half_TN,tn_4096_523_13696,Gemm_Rocblas_1140853545,0.825282
GemmTunableOp_Half_TN,tn_27392_430_4096,Gemm_Rocblas_1140853649,1.55715
GemmTunableOp_Half_TN,tn_4096_55_13696,Gemm_Rocblas_1140853594,0.19726
GemmTunableOp_Half_TN,tn_4096_382_4096,Gemm_Rocblas_1140853557,0.144419
GemmTunableOp_Half_TN,tn_4096_205_4096,Gemm_Rocblas_1140853646,0.123472
GemmTunableOp_Half_TN,tn_4096_112_13696,Gemm_Rocblas_1140853623,0.25313
GemmTunableOp_Half_TN,tn_4096_505_13696,Gemm_Rocblas_1140853580,0.697579
GemmTunableOp_Half_TN,tn_4096_499_13696,Gemm_Rocblas_1140853580,0.696581
GemmTunableOp_Half_TN,tn_27392_75_4096,Gemm_Rocblas_1140853628,0.428567
GemmTunableOp_Half_TN,tn_4096_332_13696,Gemm_Rocblas_1140853550,0.476664
GemmTunableOp_Half_TN,tn_4096_244_13696,Gemm_Rocblas_1140853632,0.427454
GemmTunableOp_Half_TN,tn_4096_376_4096,Gemm_Rocblas_1140853557,0.144139
GemmTunableOp_Half_TN,tn_4096_406_13696,Gemm_Rocblas_1140853565,0.644674
GemmTunableOp_Half_TN,tn_4096_466_4096,Gemm_Rocblas_1140853587,0.221021
GemmTunableOp_Half_TN,tn_151552_98_4096,Gemm_Rocblas_1140853645,2.38833
GemmTunableOp_Half_TN,tn_4096_334_13696,Gemm_Rocblas_1140853550,0.494451
GemmTunableOp_Half_TN,tn_4096_311_4096,Gemm_Rocblas_1140853557,0.136291
GemmTunableOp_Half_TN,tn_4096_325_13696,Gemm_Rocblas_1140853550,0.475099
GemmTunableOp_Half_TN,tn_4096_57_4096,Gemm_Rocblas_1140853651,0.0438152
GemmTunableOp_Half_TN,tn_4096_501_13696,Gemm_Rocblas_1140853557,0.695835
GemmTunableOp_Half_TN,tn_151552_81_4096,Gemm_Rocblas_1140853645,2.37688
GemmTunableOp_Half_TN,tn_4096_497_13696,Gemm_Rocblas_1140853557,0.696525
GemmTunableOp_Half_TN,tn_4096_331_13696,Gemm_Rocblas_1140853550,0.494579
GemmTunableOp_Half_TN,tn_4096_514_4096,Gemm_Rocblas_1140853629,0.280946
GemmTunableOp_Half_TN,tn_151552_26_4096,Gemm_Rocblas_1140853599,1.80714
GemmTunableOp_Half_TN,tn_27392_447_4096,Gemm_Rocblas_1140853649,1.49291
GemmTunableOp_Half_TN,tn_4096_310_13696,Gemm_Rocblas_1140853646,0.469375
GemmTunableOp_Half_TN,tn_4096_326_4096,Gemm_Rocblas_1140853587,0.137627
GemmTunableOp_Half_TN,tn_4096_250_4096,Gemm_Rocblas_1140853632,0.129994
GemmTunableOp_Half_TN,tn_4096_548_13696,Gemm_Rocblas_1140853545,0.853109
GemmTunableOp_Half_TN,tn_27392_515_4096,Default,1.78713
GemmTunableOp_Half_TN,tn_27392_19_4096,Gemm_Rocblas_1140853599,0.331897
GemmTunableOp_Half_TN,tn_4096_448_13696,Gemm_Rocblas_1140853580,0.64627
GemmTunableOp_Half_TN,tn_4096_469_13696,Gemm_Rocblas_1140853557,0.63502
GemmTunableOp_Half_TN,tn_4096_133_4096,Gemm_Rocblas_1140853628,0.0811426
GemmTunableOp_Half_TN,tn_27392_569_4096,Default,1.90011
GemmTunableOp_Half_TN,tn_4096_152_4096,Gemm_Rocblas_1140853519,0.0833906
GemmTunableOp_Half_TN,tn_27392_367_4096,Default,1.11192
GemmTunableOp_Half_TN,tn_27392_38_4096,Gemm_Rocblas_1140853648,0.344544
GemmTunableOp_Half_TN,tn_27392_311_4096,Gemm_Rocblas_1140853649,1.03602
GemmTunableOp_Half_TN,tn_151552_209_4096,Gemm_Rocblas_1140853638,4.22539
GemmTunableOp_Half_TN,tn_4096_411_13696,Gemm_Rocblas_1140853557,0.621013
GemmTunableOp_Half_TN,tn_151552_106_4096,Gemm_Rocblas_1140853645,2.51851
GemmTunableOp_Half_TN,tn_151552_216_4096,Gemm_Rocblas_1140853638,4.25284
GemmTunableOp_Half_TN,tn_27392_322_4096,Default,1.13295
GemmTunableOp_Half_TN,tn_27392_316_4096,Gemm_Rocblas_1140853649,1.04643
GemmTunableOp_Half_TN,tn_27392_359_4096,Default,1.1847
GemmTunableOp_Half_TN,tn_27392_380_4096,Default,1.1265
GemmTunableOp_Half_TN,tn_4096_190_4096,Gemm_Rocblas_1140853629,0.0793594
GemmTunableOp_Half_TN,tn_4096_144_4096,Gemm_Rocblas_1140853519,0.0831268
GemmTunableOp_Half_TN,tn_4096_45_13696,Gemm_Rocblas_1140853593,0.19606
GemmTunableOp_Half_TN,tn_4096_103_13696,Gemm_Rocblas_1140853622,0.239651
GemmTunableOp_Half_TN,tn_4096_508_13696,Gemm_Rocblas_1140853580,0.694631
GemmTunableOp_Half_TN,tn_4096_84_4096,Gemm_Rocblas_1140853633,0.0602148
GemmTunableOp_Half_TN,tn_4096_299_13696,Gemm_Rocblas_1140853646,0.471603
GemmTunableOp_Half_TN,tn_27392_84_4096,Gemm_Rocblas_1140853628,0.426567
GemmTunableOp_Half_TN,tn_27392_328_4096,Default,1.10112
GemmTunableOp_Half_TN,tn_27392_368_4096,Default,1.1143
GemmTunableOp_Half_TN,tn_4096_320_13696,Gemm_Rocblas_1140853624,0.47517
GemmTunableOp_Half_TN,tn_4096_312_4096,Gemm_Rocblas_1140853557,0.136827
GemmTunableOp_Half_TN,tn_27392_496_4096,Default,1.78382
GemmTunableOp_Half_TN,tn_27392_128_4096,Gemm_Rocblas_1140853628,0.447235
GemmTunableOp_Half_TN,tn_4096_519_13696,Gemm_Rocblas_1140853545,0.846253
GemmTunableOp_Half_TN,tn_27392_523_4096,Default,1.81681
GemmTunableOp_Half_TN,tn_4096_352_13696,Gemm_Rocblas_1140853550,0.474175
GemmTunableOp_Half_TN,tn_4096_324_4096,Gemm_Rocblas_1140853557,0.136955
GemmTunableOp_Half_TN,tn_4096_409_13696,Gemm_Rocblas_1140853557,0.655322
GemmTunableOp_Half_TN,tn_27392_306_4096,Gemm_Rocblas_1140853649,1.14419
GemmTunableOp_Half_TN,tn_27392_309_4096,Gemm_Rocblas_1140853649,1.04236
GemmTunableOp_Half_TN,tn_27392_499_4096,Gemm_Rocblas_1140853649,1.67055
GemmTunableOp_Half_TN,tn_27392_413_4096,Gemm_Rocblas_1140853649,1.45023
GemmTunableOp_Half_TN,tn_27392_411_4096,Gemm_Rocblas_1140853649,1.4523
GemmTunableOp_Half_TN,tn_27392_461_4096,Gemm_Rocblas_1140853589,1.58655
GemmTunableOp_Half_TN,tn_4096_587_13696,Gemm_Rocblas_1140853545,0.854621
GemmTunableOp_Half_TN,tn_4096_161_4096,Gemm_Rocblas_1140853529,0.081351
GemmTunableOp_Half_TN,tn_27392_297_4096,Gemm_Rocblas_1140853649,1.15505
GemmTunableOp_Half_TN,tn_4096_523_4096,Gemm_Rocblas_1140853629,0.268782
GemmTunableOp_Half_TN,tn_4096_118_13696,Gemm_Rocblas_1140853622,0.245859
GemmTunableOp_Half_TN,tn_4096_119_4096,Gemm_Rocblas_1140853628,0.063367
GemmTunableOp_Half_TN,tn_4096_411_4096,Gemm_Rocblas_1140853645,0.195668
GemmTunableOp_Half_TN,tn_4096_1635_4096,Default,0.786323
GemmTunableOp_Half_TN,tn_4096_7_4096,Gemm_Rocblas_1140853612,0.0340712
GemmTunableOp_Half_TN,tn_4096_207_4096,Gemm_Rocblas_1140853632,0.126984
GemmTunableOp_Half_TN,tn_27392_324_4096,Default,1.12334
GemmTunableOp_Half_TN,tn_4096_303_4096,Gemm_Rocblas_1140853557,0.135786
GemmTunableOp_Half_TN,tn_4096_316_13696,Gemm_Rocblas_1140853550,0.47613
GemmTunableOp_Half_TN,tn_151552_243_4096,Gemm_Rocblas_1140853638,4.39478
GemmTunableOp_Half_TN,tn_27392_385_4096,Gemm_Rocblas_1140853645,1.4215
GemmTunableOp_Half_TN,tn_4096_565_4096,Gemm_Rocblas_1140853630,0.272238
GemmTunableOp_Half_TN,tn_27392_78_4096,Gemm_Rocblas_1140853628,0.427607
GemmTunableOp_Half_TN,tn_27392_57_4096,Gemm_Rocblas_1140853645,0.346976
GemmTunableOp_Half_TN,tn_4096_328_4096,Gemm_Rocblas_1140853587,0.138387
GemmTunableOp_Half_TN,tn_27392_89_4096,Gemm_Rocblas_1140853645,0.431151
GemmTunableOp_Half_TN,tn_4096_54_4096,Gemm_Rocblas_1140853651,0.044079
GemmTunableOp_Half_TN,tn_27392_344_4096,Default,1.10993
GemmTunableOp_Half_TN,tn_4096_111_4096,Gemm_Rocblas_1140853534,0.0618068
GemmTunableOp_Half_TN,tn_4096_362_4096,Gemm_Rocblas_1140853587,0.143259
GemmTunableOp_Half_TN,tn_27392_505_4096,Gemm_Rocblas_1140853649,1.70151
GemmTunableOp_Half_TN,tn_4096_330_4096,Gemm_Rocblas_1140853557,0.138147
GemmTunableOp_Half_TN,tn_151552_250_4096,Gemm_Rocblas_1140853627,4.43088
GemmTunableOp_Half_TN,tn_4096_237_4096,Gemm_Rocblas_1140853632,0.129346
GemmTunableOp_Half_TN,tn_27392_340_4096,Default,1.10794
GemmTunableOp_Half_TN,tn_27392_310_4096,Gemm_Rocblas_1140853649,1.033
GemmTunableOp_Half_TN,tn_27392_54_4096,Gemm_Rocblas_1140853648,0.346944
GemmTunableOp_Half_TN,tn_27392_391_4096,Gemm_Rocblas_1140853649,1.43065
GemmTunableOp_Half_TN,tn_27392_356_4096,Default,1.0944
GemmTunableOp_Half_TN,tn_4096_15_4096,Gemm_Rocblas_1140853612,0.0340712
GemmTunableOp_Half_TN,tn_4096_345_13696,Gemm_Rocblas_1140853550,0.4756
GemmTunableOp_Half_TN,tn_4096_391_13696,Gemm_Rocblas_1140853551,0.557828
GemmTunableOp_Half_TN,tn_27392_339_4096,Default,1.12039
GemmTunableOp_Half_TN,tn_4096_94_4096,Gemm_Rocblas_1140853520,0.0618386
GemmTunableOp_Half_TN,tn_4096_150_13696,Gemm_Rocblas_1140853520,0.299691
GemmTunableOp_Half_TN,tn_4096_187_4096,Gemm_Rocblas_1140853519,0.0838634
GemmTunableOp_Half_TN,tn_27392_670_4096,Default,2.11186
GemmTunableOp_Half_TN,tn_4096_308_13696,Gemm_Rocblas_1140853646,0.472163
GemmTunableOp_Half_TN,tn_4096_349_4096,Gemm_Rocblas_1140853587,0.142283
GemmTunableOp_Half_TN,tn_4096_333_4096,Gemm_Rocblas_1140853557,0.137402
GemmTunableOp_Half_TN,tn_151552_77_4096,Gemm_Rocblas_1140853645,2.37273
GemmTunableOp_Half_TN,tn_27392_357_4096,Default,1.10292
GemmTunableOp_Half_TN,tn_4096_339_13696,Gemm_Rocblas_1140853550,0.477313
GemmTunableOp_Half_TN,tn_4096_10_4096,Gemm_Rocblas_1140853596,0.0340152
GemmTunableOp_Half_TN,tn_4096_31_13696,Gemm_Hipblaslt_TN_148180,0.18474
GemmTunableOp_Half_TN,tn_4096_16384_4096,Gemm_Rocblas_1140853653,6.85425
GemmTunableOp_Half_TN,tn_4096_432_13696,Gemm_Rocblas_1140853557,0.622715
GemmTunableOp_Half_TN,tn_4096_467_4096,Gemm_Rocblas_1140853587,0.214332
GemmTunableOp_Half_TN,tn_151552_119_4096,Gemm_Rocblas_1140853645,2.50487
GemmTunableOp_Half_TN,tn_27392_522_4096,Default,1.78183
GemmTunableOp_Half_TN,tn_151552_200_4096,Gemm_Rocblas_1140853638,4.20679
GemmTunableOp_Half_TN,tn_4096_11_4096,Gemm_Rocblas_1140853617,0.0364152
GemmTunableOp_Half_TN,tn_27392_378_4096,Default,1.11452
GemmTunableOp_Half_TN,tn_27392_403_4096,Gemm_Rocblas_1140853649,1.44349
GemmTunableOp_Half_TN,tn_4096_315_13696,Gemm_Rocblas_1140853646,0.47101
GemmTunableOp_Half_TN,tn_4096_371_4096,Gemm_Rocblas_1140853557,0.141699
GemmTunableOp_Half_TN,tn_27392_467_4096,Gemm_Rocblas_1140853564,1.61863
GemmTunableOp_Half_TN,tn_27392_17_4096,Gemm_Rocblas_1140853614,0.332144
GemmTunableOp_Half_TN,tn_4096_418_13696,Gemm_Rocblas_1140853557,0.618635
GemmTunableOp_Half_TN,tn_4096_321_13696,Gemm_Rocblas_1140853550,0.476683
GemmTunableOp_Half_TN,tn_4096_478_13696,Gemm_Rocblas_1140853557,0.711027
GemmTunableOp_Half_TN,tn_4096_65_13696,Gemm_Hipblaslt_TN_148168,0.210987
GemmTunableOp_Half_TN,tn_4096_337_4096,Gemm_Rocblas_1140853587,0.139874
GemmTunableOp_Half_TN,tn_4096_467_13696,Gemm_Rocblas_1140853557,0.622363
GemmTunableOp_Half_TN,tn_4096_356_4096,Gemm_Rocblas_1140853557,0.142282
GemmTunableOp_Half_TN,tn_151552_50_4096,Gemm_Rocblas_1140853653,1.81762
GemmTunableOp_Half_TN,tn_4096_497_4096,Gemm_Rocblas_1140853578,0.227196
GemmTunableOp_Half_TN,tn_27392_314_4096,Gemm_Rocblas_1140853649,1.03875
GemmTunableOp_Half_TN,tn_27392_325_4096,Default,1.12303
GemmTunableOp_Half_TN,tn_4096_570_4096,Gemm_Rocblas_1140853629,0.26125
GemmTunableOp_Half_TN,tn_4096_317_4096,Gemm_Rocblas_1140853557,0.137866
GemmTunableOp_Half_TN,tn_4096_420_13696,Gemm_Rocblas_1140853557,0.651394
GemmTunableOp_Half_TN,tn_4096_9_4096,Gemm_Rocblas_1140853602,0.0333352
GemmTunableOp_Half_TN,tn_27392_318_4096,Gemm_Rocblas_1140853649,1.03614
GemmTunableOp_Half_TN,tn_4096_98_13696,Gemm_Rocblas_1140853622,0.242379
GemmTunableOp_Half_TN,tn_4096_345_4096,Gemm_Rocblas_1140853557,0.139282
GemmTunableOp_Half_TN,tn_4096_394_4096,Gemm_Rocblas_1140853649,0.191915
GemmTunableOp_Half_TN,tn_27392_492_4096,Gemm_Rocblas_1140853649,1.78465
GemmTunableOp_Half_TN,tn_27392_256_4096,Gemm_Rocblas_1140853552,0.83998
GemmTunableOp_Half_TN,tn_4096_335_4096,Gemm_Rocblas_1140853587,0.138891
GemmTunableOp_Half_TN,tn_151552_183_4096,Gemm_Rocblas_1140853619,3.84119
GemmTunableOp_Half_TN,tn_4096_394_13696,Gemm_Rocblas_1140853557,0.618179
GemmTunableOp_Half_TN,tn_4096_347_13696,Gemm_Rocblas_1140853550,0.479809
GemmTunableOp_Half_TN,tn_4096_457_4096,Gemm_Rocblas_1140853557,0.21918
GemmTunableOp_Half_TN,tn_151552_248_4096,Gemm_Rocblas_1140853627,4.41644
GemmTunableOp_Half_TN,tn_27392_146_4096,Gemm_Rocblas_1140853628,0.626902
GemmTunableOp_Half_TN,tn_4096_134_13696,Gemm_Rocblas_1140853520,0.296003
GemmTunableOp_Half_TN,tn_4096_297_13696,Gemm_Rocblas_1140853580,0.512448
GemmTunableOp_Half_TN,tn_27392_381_4096,Default,1.13587
GemmTunableOp_Half_TN,tn_4096_355_4096,Gemm_Rocblas_1140853587,0.141202
GemmTunableOp_Half_TN,tn_4096_464_4096,Gemm_Rocblas_1140853557,0.236049
GemmTunableOp_Half_TN,tn_27392_418_4096,Gemm_Rocblas_1140853649,1.51749
GemmTunableOp_Half_TN,tn_4096_379_4096,Gemm_Rocblas_1140853587,0.161657
GemmTunableOp_Half_TN,tn_4096_120_13696,Gemm_Rocblas_1140853622,0.254578
GemmTunableOp_Half_TN,tn_4096_375_4096,Gemm_Rocblas_1140853587,0.143443
GemmTunableOp_Half_TN,tn_27392_126_4096,Gemm_Rocblas_1140853628,0.42616
GemmTunableOp_Half_TN,tn_4096_444_4096,Gemm_Rocblas_1140853649,0.199723
GemmTunableOp_Half_TN,tn_4096_351_13696,Gemm_Rocblas_1140853550,0.475656
GemmTunableOp_Half_TN,tn_4096_327_13696,Gemm_Rocblas_1140853550,0.479384
GemmTunableOp_Half_TN,tn_27392_206_4096,Gemm_Rocblas_1140853583,0.781265
GemmTunableOp_Half_TN,tn_27392_370_4096,Default,1.15202
GemmTunableOp_Half_TN,tn_4096_546_4096,Gemm_Rocblas_1140853629,0.256972
GemmTunableOp_Half_TN,tn_4096_302_13696,Gemm_Rocblas_1140853646,0.474322
GemmTunableOp_Half_TN,tn_4096_432_4096,Gemm_Rocblas_1140853649,0.199196
GemmTunableOp_Half_TN,tn_151552_194_4096,Gemm_Rocblas_1140853638,4.57631
GemmTunableOp_Half_TN,tn_4096_480_13696,Gemm_Rocblas_1140853557,0.693115
GemmTunableOp_Half_TN,tn_27392_148_4096,Gemm_Rocblas_1140853628,0.62947
GemmTunableOp_Half_TN,tn_27392_15_4096,Gemm_Rocblas_1140853599,0.332768
GemmTunableOp_Half_TN,tn_4096_397_4096,Gemm_Rocblas_1140853645,0.194811
GemmTunableOp_Half_TN,tn_4096_366_4096,Gemm_Rocblas_1140853587,0.143811
GemmTunableOp_Half_TN,tn_4096_405_4096,Gemm_Rocblas_1140853649,0.194491
GemmTunableOp_Half_TN,tn_4096_442_13696,Gemm_Rocblas_1140853557,0.70446
GemmTunableOp_Half_TN,tn_27392_631_4096,Default,2.08961
GemmTunableOp_Half_TN,tn_27392_516_4096,Default,1.77839
GemmTunableOp_Half_TN,tn_27392_388_4096,Gemm_Rocblas_1140853649,1.49242
GemmTunableOp_Half_TN,tn_4096_150_4096,Gemm_Rocblas_1140853632,0.070815
GemmTunableOp_Half_TN,tn_27392_25_4096,Gemm_Rocblas_1140853599,0.334376
GemmTunableOp_Half_TN,tn_4096_193_4096,Gemm_Rocblas_1140853646,0.125799
GemmTunableOp_Half_TN,tn_27392_12_4096,Gemm_Rocblas_1140853603,0.332017
GemmTunableOp_Half_TN,tn_4096_398_13696,Gemm_Rocblas_1140853557,0.626325
GemmTunableOp_Half_TN,tn_27392_121_4096,Gemm_Rocblas_1140853628,0.438792
GemmTunableOp_Half_TN,tn_4096_50_4096,Gemm_Rocblas_1140853647,0.0432392
GemmTunableOp_Half_TN,tn_4096_407_13696,Gemm_Rocblas_1140853557,0.620186
GemmTunableOp_Half_TN,tn_27392_419_4096,Gemm_Rocblas_1140853649,1.44987
GemmTunableOp_Half_TN,tn_4096_538_13696,Gemm_Rocblas_1140853545,0.832421
GemmTunableOp_Half_TN,tn_27392_329_4096,Default,1.13268
GemmTunableOp_Half_TN,tn_4096_39_4096,Gemm_Rocblas_1140853646,0.0492708
GemmTunableOp_Half_TN,tn_4096_503_13696,Gemm_Rocblas_1140853578,0.720973
GemmTunableOp_Half_TN,tn_151552_236_4096,Gemm_Rocblas_1140853627,4.37135
GemmTunableOp_Half_TN,tn_27392_525_4096,Default,1.79304
GemmTunableOp_Half_TN,tn_27392_379_4096,Gemm_Rocblas_1140853583,1.22649
GemmTunableOp_Half_TN,tn_4096_367_13696,Gemm_Rocblas_1140853550,0.4782
GemmTunableOp_Half_TN,tn_4096_256_4096,Gemm_Rocblas_1140853647,0.131299
GemmTunableOp_Half_TN,tn_27392_417_4096,Gemm_Rocblas_1140853649,1.44763
GemmTunableOp_Half_TN,tn_4096_2_13696,Gemm_Hipblaslt_TN_148112,0.176444
GemmTunableOp_Half_TN,tn_4096_406_4096,Gemm_Rocblas_1140853649,0.196187
GemmTunableOp_Half_TN,tn_27392_428_4096,Default,1.5393
GemmTunableOp_Half_TN,tn_4096_248_4096,Gemm_Rocblas_1140853632,0.130786
GemmTunableOp_Half_TN,tn_4096_109_4096,Gemm_Rocblas_1140853629,0.0613108
GemmTunableOp_Half_TN,tn_4096_293_4096,Gemm_Rocblas_1140853557,0.134986
GemmTunableOp_Half_TN,tn_4096_447_4096,Gemm_Rocblas_1140853647,0.203075
GemmTunableOp_Half_TN,tn_4096_571_13696,Gemm_Rocblas_1140853545,0.857949
GemmTunableOp_Half_TN,tn_4096_461_13696,Gemm_Rocblas_1140853557,0.627579
GemmTunableOp_Half_TN,tn_27392_584_4096,Default,2.11418
GemmTunableOp_Half_TN,tn_4096_253_4096,Gemm_Rocblas_1140853632,0.129954
GemmTunableOp_Half_TN,tn_27392_241_4096,Gemm_Rocblas_1140853552,0.843244
GemmTunableOp_Half_TN,tn_4096_418_4096,Gemm_Rocblas_1140853645,0.195859
GemmTunableOp_Half_TN,tn_4096_305_4096,Gemm_Rocblas_1140853587,0.136218
GemmTunableOp_Half_TN,tn_151552_46_4096,Gemm_Rocblas_1140853653,1.81914
GemmTunableOp_Half_TN,tn_27392_514_4096,Default,1.7713
GemmTunableOp_Half_TN,tn_4096_313_4096,Gemm_Rocblas_1140853587,0.138243
GemmTunableOp_Half_TN,tn_4096_522_4096,Gemm_Rocblas_1140853628,0.273148
GemmTunableOp_Half_TN,tn_27392_460_4096,Default,1.59645
GemmTunableOp_Half_TN,tn_151552_96_4096,Gemm_Rocblas_1140853645,2.39106
GemmTunableOp_Half_TN,tn_4096_445_13696,Gemm_Rocblas_1140853557,0.623867
GemmTunableOp_Half_TN,tn_4096_301_13696,Gemm_Rocblas_1140853624,0.473607
GemmTunableOp_Half_TN,tn_151552_139_4096,Gemm_Rocblas_1140853619,3.62074
GemmTunableOp_Half_TN,tn_4096_614_4096,Gemm_Rocblas_1140853629,0.305394
GemmTunableOp_Half_TN,tn_27392_332_4096,Default,1.10966
GemmTunableOp_Half_TN,tn_151552_215_4096,Gemm_Rocblas_1140853619,4.71758
GemmTunableOp_Half_TN,tn_27392_361_4096,Default,1.11657
GemmTunableOp_Half_TN,tn_4096_439_4096,Gemm_Rocblas_1140853646,0.201716
GemmTunableOp_Half_TN,tn_4096_392_13696,Gemm_Rocblas_1140853557,0.641172
GemmTunableOp_Half_TN,tn_27392_343_4096,Default,1.10621
GemmTunableOp_Half_TN,tn_27392_168_4096,Gemm_Rocblas_1140853628,0.660864
GemmTunableOp_Half_TN,tn_151552_63_4096,Gemm_Rocblas_1140853653,1.84614
GemmTunableOp_Half_TN,tn_27392_193_4096,Gemm_Rocblas_1140853552,0.803666
GemmTunableOp_Half_TN,tn_4096_419_4096,Gemm_Rocblas_1140853630,0.197771
GemmTunableOp_Half_TN,tn_4096_123_4096,Gemm_Rocblas_1140853628,0.062359
GemmTunableOp_Half_TN,tn_151552_18_4096,Gemm_Rocblas_1140853614,1.78925
GemmTunableOp_Half_TN,tn_27392_4_4096,Gemm_Rocblas_1140853614,0.329137
GemmTunableOp_Half_TN,tn_4096_491_4096,Gemm_Rocblas_1140853587,0.222196
GemmTunableOp_Half_TN,tn_27392_414_4096,Gemm_Rocblas_1140853649,1.49853
GemmTunableOp_Half_TN,tn_4096_452_13696,Gemm_Rocblas_1140853557,0.649666
GemmTunableOp_Half_TN,tn_4096_460_4096,Gemm_Rocblas_1140853587,0.220796
GemmTunableOp_Half_TN,tn_27392_437_4096,Gemm_Rocblas_1140853649,1.49189
GemmTunableOp_Half_TN,tn_4096_408_13696,Gemm_Rocblas_1140853557,0.624994
GemmTunableOp_Half_TN,tn_4096_456_4096,Gemm_Rocblas_1140853587,0.211011
GemmTunableOp_Half_TN,tn_4096_413_4096,Gemm_Rocblas_1140853645,0.195508
GemmTunableOp_Half_TN,tn_4096_608_4096,Gemm_Rocblas_1140853648,0.289444
GemmTunableOp_Half_TN,tn_27392_434_4096,Gemm_Rocblas_1140853649,1.55843
GemmTunableOp_Half_TN,tn_4096_398_4096,Gemm_Rocblas_1140853649,0.196276
GemmTunableOp_Half_TN,tn_4096_299_4096,Gemm_Rocblas_1140853587,0.136587
GemmTunableOp_Half_TN,tn_4096_582_4096,Gemm_Rocblas_1140853629,0.30761
GemmTunableOp_Half_TN,tn_4096_6_13696,Gemm_Hipblaslt_TN_148177,0.17738
GemmTunableOp_Half_TN,tn_27392_8_4096,Gemm_Rocblas_1140853614,0.331024
GemmTunableOp_Half_TN,tn_27392_366_4096,Default,1.13316
GemmTunableOp_Half_TN,tn_27392_87_4096,Gemm_Rocblas_1140853628,0.433511
GemmTunableOp_Half_TN,tn_27392_608_4096,Default,2.06586
GemmTunableOp_Half_TN,tn_151552_116_4096,Gemm_Rocblas_1140853645,2.47594
GemmTunableOp_Half_TN,tn_151552_7_4096,Gemm_Rocblas_1140853603,1.76095
GemmTunableOp_Half_TN,tn_27392_334_4096,Default,1.12653
GemmTunableOp_Half_TN,tn_27392_407_4096,Gemm_Rocblas_1140853649,1.45236
GemmTunableOp_Half_TN,tn_27392_464_4096,Default,1.5583
GemmTunableOp_Half_TN,tn_151552_54_4096,Gemm_Rocblas_1140853653,1.81834
GemmTunableOp_Half_TN,tn_151552_15_4096,Gemm_Rocblas_1140853618,1.78398
GemmTunableOp_Half_TN,tn_27392_98_4096,Gemm_Rocblas_1140853628,0.434791
GemmTunableOp_Half_TN,tn_4096_82_13696,Gemm_Hipblaslt_TN_148168,0.215434
GemmTunableOp_Half_TN,tn_4096_608_13696,Gemm_Rocblas_1140853545,0.859309
GemmTunableOp_Half_TN,tn_4096_433_4096,Gemm_Rocblas_1140853645,0.207129
GemmTunableOp_Half_TN,tn_27392_429_4096,Gemm_Rocblas_1140853649,1.47855
GemmTunableOp_Half_TN,tn_27392_337_4096,Default,1.11677
GemmTunableOp_Half_TN,tn_4096_381_4096,Gemm_Rocblas_1140853587,0.143514
GemmTunableOp_Half_TN,tn_4096_529_13696,Gemm_Rocblas_1140853545,0.855509
GemmTunableOp_Half_TN,tn_151552_141_4096,Gemm_Rocblas_1140853619,3.64628
GemmTunableOp_Half_TN,tn_4096_453_4096,Gemm_Rocblas_1140853557,0.220413
GemmTunableOp_Half_TN,tn_27392_456_4096,Default,1.59015
GemmTunableOp_Half_TN,tn_27392_382_4096,Default,1.1107
GemmTunableOp_Half_TN,tn_4096_312_13696,Gemm_Rocblas_1140853550,0.477314
GemmTunableOp_Half_TN,tn_27392_80_4096,Gemm_Rocblas_1140853628,0.425699
GemmTunableOp_Half_TN,tn_151552_55_4096,Gemm_Rocblas_1140853653,1.84246
GemmTunableOp_Half_TN,tn_4096_322_13696,Gemm_Rocblas_1140853550,0.481601
GemmTunableOp_Half_TN,tn_4096_388_13696,Gemm_Rocblas_1140853557,0.639843
GemmTunableOp_Half_TN,tn_4096_11_13696,Gemm_Hipblaslt_TN_148127,0.176932
GemmTunableOp_Half_TN,tn_151552_6_4096,Gemm_Rocblas_1140853603,1.7572
GemmTunableOp_Half_TN,tn_151552_123_4096,Gemm_Rocblas_1140853645,2.51997
GemmTunableOp_Half_TN,tn_151552_8_4096,Gemm_Rocblas_1140853603,1.76546
GemmTunableOp_Half_TN,tn_4096_18_13696,Gemm_Hipblaslt_TN_148112,0.183452
GemmTunableOp_Half_TN,tn_4096_534_4096,Gemm_Rocblas_1140853630,0.29217
GemmTunableOp_Half_TN,tn_27392_7_4096,Gemm_Rocblas_1140853599,0.330577
GemmTunableOp_Half_TN,tn_4096_378_4096,Gemm_Rocblas_1140853557,0.144346
GemmTunableOp_Half_TN,tn_27392_478_4096,Default,1.60869
GemmTunableOp_Half_TN,tn_151552_103_4096,Gemm_Rocblas_1140853645,2.41558
GemmTunableOp_Half_TN,tn_4096_208_4096,Gemm_Rocblas_1140853632,0.123025
GemmTunableOp_Half_TN,tn_27392_18_4096,Gemm_Rocblas_1140853614,0.333464
GemmTunableOp_Half_TN,tn_4096_343_13696,Gemm_Rocblas_1140853550,0.48176
GemmTunableOp_Half_TN,tn_4096_18_4096,Gemm_Rocblas_1140853596,0.0357832
GemmTunableOp_Half_TN,tn_27392_165_4096,Gemm_Rocblas_1140853645,0.649512
GemmTunableOp_Half_TN,tn_4096_429_13696,Gemm_Rocblas_1140853557,0.656506
GemmTunableOp_Half_TN,tn_4096_405_13696,Gemm_Rocblas_1140853557,0.625475
GemmTunableOp_Half_TN,tn_27392_1_4096,Gemm_Rocblas_1140853603,0.328969
GemmTunableOp_Half_TN,tn_27392_298_4096,Gemm_Rocblas_1140853649,1.12596
GemmTunableOp_Half_TN,tn_27392_14_4096,Gemm_Rocblas_1140853603,0.332545
GemmTunableOp_Half_TN,tn_4096_338_4096,Gemm_Rocblas_1140853557,0.139978
GemmTunableOp_Half_TN,tn_4096_535_13696,Gemm_Rocblas_1140853545,0.82839
GemmTunableOp_Half_TN,tn_151552_256_4096,Gemm_Rocblas_1140853627,4.14503
GemmTunableOp_Half_TN,tn_151552_64_4096,Gemm_Rocblas_1140853653,1.8268
GemmTunableOp_Half_TN,tn_27392_13_4096,Gemm_Rocblas_1140853599,0.332048
GemmTunableOp_Half_TN,tn_27392_345_4096,Default,1.10644
GemmTunableOp_Half_TN,tn_4096_430_13696,Gemm_Rocblas_1140853557,0.646387
GemmTunableOp_Half_TN,tn_4096_13_13696,Gemm_Hipblaslt_TN_148127,0.18042
GemmTunableOp_Half_TN,tn_4096_3_13696,Gemm_Hipblaslt_TN_148177,0.178572
GemmTunableOp_Half_TN,tn_4096_192_4096,Gemm_Rocblas_1140853520,0.0812886
GemmTunableOp_Half_TN,tn_4096_351_4096,Gemm_Rocblas_1140853557,0.140218
GemmTunableOp_Half_TN,tn_27392_508_4096,Default,1.78252
GemmTunableOp_Half_TN,tn_4096_417_13696,Gemm_Rocblas_1140853557,0.619522
GemmTunableOp_Half_TN,tn_4096_209_13696,Gemm_Rocblas_1140853515,0.406569
GemmTunableOp_Half_TN,tn_27392_405_4096,Gemm_Rocblas_1140853649,1.44559
GemmTunableOp_Half_TN,tn_4096_565_13696,Gemm_Rocblas_1140853545,0.836145
GemmTunableOp_Half_TN,tn_4096_5_4096,Gemm_Rocblas_1140853612,0.0336312
GemmTunableOp_Half_TN,tn_27392_22_4096,Gemm_Rocblas_1140853599,0.333112
GemmTunableOp_Half_TN,tn_4096_206_13696,Gemm_Rocblas_1140853515,0.40112
GemmTunableOp_Half_TN,tn_4096_353_13696,Gemm_Rocblas_1140853550,0.489855
GemmTunableOp_Half_TN,tn_4096_443_13696,Gemm_Rocblas_1140853557,0.630587
GemmTunableOp_Half_TN,tn_4096_361_4096,Gemm_Rocblas_1140853587,0.141194
GemmTunableOp_Half_TN,tn_4096_327_4096,Gemm_Rocblas_1140853557,0.138122
GemmTunableOp_Half_TN,tn_27392_535_4096,Default,1.83171
GemmTunableOp_Half_TN,tn_4096_447_13696,Gemm_Rocblas_1140853557,0.622298
GemmTunableOp_Half_TN,tn_4096_314_13696,Gemm_Rocblas_1140853550,0.480632
GemmTunableOp_Half_TN,tn_151552_11_4096,Gemm_Rocblas_1140853603,1.77424
GemmTunableOp_Half_TN,tn_4096_510_4096,Gemm_Rocblas_1140853587,0.219868
GemmTunableOp_Half_TN,tn_151552_10_4096,Gemm_Rocblas_1140853603,1.77082
GemmTunableOp_Half_TN,tn_4096_335_13696,Gemm_Rocblas_1140853550,0.480481
GemmTunableOp_Half_TN,tn_27392_363_4096,Default,1.15192
GemmTunableOp_Half_TN,tn_151552_101_4096,Gemm_Rocblas_1140853645,2.42086
GemmTunableOp_Half_TN,tn_151552_9_4096,Gemm_Rocblas_1140853618,1.76795
GemmTunableOp_Half_TN,tn_27392_479_4096,Default,1.57795
GemmTunableOp_Half_TN,tn_4096_622_13696,Gemm_Rocblas_1140853545,0.790077
GemmTunableOp_Half_TN,tn_4096_190_13696,Gemm_Rocblas_1140853622,0.309334
GemmTunableOp_Half_TN,tn_27392_500_4096,Default,1.79212
GemmTunableOp_Half_TN,tn_4096_16384_13696,Gemm_Rocblas_1140853578,19.0995
GemmTunableOp_Half_TN,tn_151552_107_4096,Gemm_Rocblas_1140853645,2.4558
GemmTunableOp_Half_TN,tn_4096_4_13696,Gemm_Hipblaslt_TN_148112,0.180052
GemmTunableOp_Half_TN,tn_4096_174_13696,Gemm_Rocblas_1140853520,0.304797
GemmTunableOp_Half_TN,tn_27392_351_4096,Default,1.1154
GemmTunableOp_Half_TN,tn_27392_293_4096,Gemm_Rocblas_1140853649,1.11431
GemmTunableOp_Half_TN,tn_4096_478_4096,Gemm_Rocblas_1140853587,0.219491
GemmTunableOp_Half_TN,tn_4096_538_4096,Gemm_Rocblas_1140853628,0.26414
GemmTunableOp_Half_TN,tn_4096_4_4096,Gemm_Rocblas_1140853612,0.0358472
GemmTunableOp_Half_TN,tn_4096_377_13696,Gemm_Rocblas_1140853550,0.494523
GemmTunableOp_Half_TN,tn_151552_17_4096,Gemm_Rocblas_1140853599,1.78839
GemmTunableOp_Half_TN,tn_4096_387_4096,Gemm_Rocblas_1140853645,0.191492
GemmTunableOp_Half_TN,tn_27392_2714_4096,Gemm_Rocblas_1140853644,9.34441
GemmTunableOp_Half_TN,tn_4096_42_4096,Gemm_Rocblas_1140853636,0.0433592
GemmTunableOp_Half_TN,tn_27392_443_4096,Gemm_Rocblas_1140853649,1.49486
GemmTunableOp_Half_TN,tn_4096_148_4096,Gemm_Rocblas_1140853519,0.0834866
GemmTunableOp_Half_TN,tn_151552_5_4096,Gemm_Rocblas_1140853618,1.75438
GemmTunableOp_Half_TN,tn_27392_420_4096,Default,1.56789
GemmTunableOp_Half_TN,tn_151552_3_4096,Gemm_Rocblas_1140853603,1.74822
GemmTunableOp_Half_TN,tn_4096_368_13696,Gemm_Rocblas_1140853550,0.476795
GemmTunableOp_Half_TN,tn_4096_461_4096,Gemm_Rocblas_1140853587,0.213276
GemmTunableOp_Half_TN,tn_27392_134_4096,Gemm_Rocblas_1140853628,0.589429
GemmTunableOp_Half_TN,tn_27392_208_4096,Gemm_Rocblas_1140853552,0.772781
GemmTunableOp_Half_TN,tn_4096_369_4096,Gemm_Rocblas_1140853587,0.142898
GemmTunableOp_Half_TN,tn_4096_500_4096,Gemm_Rocblas_1140853578,0.225427
GemmTunableOp_Half_TN,tn_4096_404_4096,Gemm_Rocblas_1140853648,0.196628
GemmTunableOp_Half_TN,tn_27392_491_4096,Gemm_Rocblas_1140853649,1.66908
GemmTunableOp_Half_TN,tn_4096_587_4096,Gemm_Rocblas_1140853630,0.294148
GemmTunableOp_Half_TN,tn_4096_250_13696,Gemm_Rocblas_1140853515,0.42567
GemmTunableOp_Half_TN,tn_151552_148_4096,Gemm_Hipblaslt_TN_148174,3.64236
GemmTunableOp_Half_TN,tn_4096_14_4096,Gemm_Rocblas_1140853598,0.036871
GemmTunableOp_Half_TN,tn_4096_417_4096,Gemm_Rocblas_1140853649,0.196795
GemmTunableOp_Half_TN,tn_151552_13_4096,Gemm_Rocblas_1140853618,1.77917
GemmTunableOp_Half_TN,tn_4096_307_4096,Gemm_Rocblas_1140853557,0.137867
GemmTunableOp_Half_TN,tn_4096_311_13696,Gemm_Rocblas_1140853646,0.476203
GemmTunableOp_Half_TN,tn_4096_549_13696,Gemm_Rocblas_1140853545,0.833051
GemmTunableOp_Half_TN,tn_27392_519_4096,Default,1.80384
GemmTunableOp_Half_TN,tn_4096_452_4096,Gemm_Rocblas_1140853587,0.216371
GemmTunableOp_Half_TN,tn_27392_5_4096,Gemm_Rocblas_1140853599,0.329985
GemmTunableOp_Half_TN,tn_4096_126_4096,Gemm_Rocblas_1140853648,0.056775
GemmTunableOp_Half_TN,tn_151552_19_4096,Gemm_Rocblas_1140853599,1.7935
GemmTunableOp_Half_TN,tn_4096_9_13696,Gemm_Hipblaslt_TN_148178,0.18062
GemmTunableOp_Half_TN,tn_4096_346_13696,Gemm_Rocblas_1140853550,0.477839
GemmTunableOp_Half_TN,tn_27392_406_4096,Gemm_Rocblas_1140853649,1.50031
GemmTunableOp_Half_TN,tn_4096_340_13696,Gemm_Rocblas_1140853550,0.47992
GemmTunableOp_Half_TN,tn_151552_21_4096,Gemm_Rocblas_1140853614,1.79807
GemmTunableOp_Half_TN,tn_4096_21_13696,Gemm_Hipblaslt_TN_148112,0.17866
GemmTunableOp_Half_TN,tn_27392_527_4096,Default,1.8331
GemmTunableOp_Half_TN,tn_4096_353_4096,Gemm_Rocblas_1140853557,0.140138
GemmTunableOp_Half_TN,tn_4096_564_13696,Gemm_Rocblas_1140853545,0.833208
GemmTunableOp_Half_TN,tn_27392_372_4096,Default,1.14023
GemmTunableOp_Half_TN,tn_27392_494_4096,Gemm_Rocblas_1140853649,1.76767
GemmTunableOp_Half_TN,tn_4096_22_13696,Gemm_Hipblaslt_TN_148127,0.184388
GemmTunableOp_Half_TN,tn_27392_200_4096,Gemm_Rocblas_1140853583,0.786126
GemmTunableOp_Half_TN,tn_4096_457_13696,Gemm_Rocblas_1140853557,0.632419
GemmTunableOp_Half_TN,tn_4096_24_13696,Gemm_Hipblaslt_TN_148112,0.175492
GemmTunableOp_Half_TN,tn_27392_394_4096,Gemm_Rocblas_1140853649,1.50663
GemmTunableOp_Half_TN,tn_27392_319_4096,Gemm_Rocblas_1140853645,1.15225
GemmTunableOp_Half_TN,tn_4096_38_4096,Gemm_Rocblas_1140853632,0.044287
GemmTunableOp_Half_TN,tn_4096_22_4096,Gemm_Rocblas_1140853597,0.0335192
GemmTunableOp_Half_TN,tn_4096_531_13696,Gemm_Rocblas_1140853545,0.846661
GemmTunableOp_Half_TN,tn_4096_385_13696,Gemm_Rocblas_1140853557,0.624867
GemmTunableOp_Half_TN,tn_27392_116_4096,Gemm_Rocblas_1140853628,0.4394
GemmTunableOp_Half_TN,tn_27392_254_4096,Gemm_Rocblas_1140853552,0.854109
GemmTunableOp_Half_TN,tn_4096_296_13696,Gemm_Rocblas_1140853646,0.476264
GemmTunableOp_Half_TN,tn_4096_419_13696,Gemm_Rocblas_1140853557,0.626162
GemmTunableOp_Half_TN,tn_151552_226_4096,Gemm_Rocblas_1140853619,4.73656
GemmTunableOp_Half_TN,tn_151552_12_4096,Gemm_Rocblas_1140853618,1.77692
GemmTunableOp_Half_TN,tn_4096_421_13696,Gemm_Rocblas_1140853557,0.664882
GemmTunableOp_Half_TN,tn_4096_513_13696,Gemm_Rocblas_1140853545,0.819604
GemmTunableOp_Half_TN,tn_4096_7_13696,Gemm_Hipblaslt_TN_148177,0.179044
GemmTunableOp_Half_TN,tn_4096_544_4096,Gemm_Rocblas_1140853649,0.26838
GemmTunableOp_Half_TN,tn_27392_10_4096,Gemm_Rocblas_1140853603,0.332936
GemmTunableOp_Half_TN,tn_4096_107_13696,Gemm_Rocblas_1140853631,0.242515
GemmTunableOp_Half_TN,tn_4096_57_13696,Gemm_Rocblas_1140853593,0.19842
GemmTunableOp_Half_TN,tn_27392_398_4096,Gemm_Rocblas_1140853649,1.49545
GemmTunableOp_Half_TN,tn_4096_27_4096,Gemm_Rocblas_1140853598,0.0348152
GemmTunableOp_Half_TN,tn_27392_393_4096,Gemm_Rocblas_1140853649,1.44607
GemmTunableOp_Half_TN,tn_4096_300_4096,Gemm_Rocblas_1140853587,0.145017
GemmTunableOp_Half_TN,tn_4096_212_4096,Gemm_Rocblas_1140853647,0.128753
GemmTunableOp_Half_TN,tn_151552_30_4096,Gemm_Rocblas_1140853614,1.81289
GemmTunableOp_Half_TN,tn_4096_428_4096,Gemm_Rocblas_1140853629,0.216297
GemmTunableOp_Half_TN,tn_4096_472_4096,Gemm_Rocblas_1140853587,0.2151
GemmTunableOp_Half_TN,tn_4096_325_4096,Gemm_Rocblas_1140853587,0.139011
GemmTunableOp_Half_TN,tn_27392_1635_4096,Default,5.6892
GemmTunableOp_Half_TN,tn_27392_3_4096,Gemm_Rocblas_1140853614,0.329376
GemmTunableOp_Half_TN,tn_4096_365_4096,Gemm_Rocblas_1140853557,0.14345
GemmTunableOp_Half_TN,tn_4096_146_13696,Gemm_Rocblas_1140853515,0.300363
GemmTunableOp_Half_TN,tn_4096_518_4096,Gemm_Rocblas_1140853629,0.26333
GemmTunableOp_Half_TN,tn_4096_519_4096,Gemm_Rocblas_1140853630,0.2745
GemmTunableOp_Half_TN,tn_27392_350_4096,Default,1.10142
GemmTunableOp_Half_TN,tn_4096_388_4096,Gemm_Rocblas_1140853645,0.190363
GemmTunableOp_Half_TN,tn_4096_527_4096,Gemm_Rocblas_1140853646,0.266404
GemmTunableOp_Half_TN,tn_27392_622_4096,Default,2.08018
GemmTunableOp_Half_TN,tn_151552_53_4096,Gemm_Rocblas_1140853649,1.87414
GemmTunableOp_Half_TN,tn_151552_224_4096,Gemm_Rocblas_1140853619,4.22904
GemmTunableOp_Half_TN,tn_27392_408_4096,Gemm_Rocblas_1140853648,1.54582
GemmTunableOp_Half_TN,tn_4096_15_13696,Gemm_Hipblaslt_TN_148127,0.179004
GemmTunableOp_Half_TN,tn_4096_338_13696,Gemm_Rocblas_1140853550,0.498776
GemmTunableOp_Half_TN,tn_27392_531_4096,Default,1.81224
GemmTunableOp_Half_TN,tn_4096_386_13696,Gemm_Rocblas_1140853557,0.641468
GemmTunableOp_Half_TN,tn_27392_88_4096,Gemm_Rocblas_1140853628,0.433883
GemmTunableOp_Half_TN,tn_151552_163_4096,Gemm_Rocblas_1140853628,3.32988
GemmTunableOp_Half_TN,tn_151552_82_4096,Gemm_Rocblas_1140853645,2.38209
GemmTunableOp_Half_TN,tn_4096_355_13696,Gemm_Rocblas_1140853550,0.477936
GemmTunableOp_Half_TN,tn_151552_237_4096,Gemm_Rocblas_1140853619,5.00628
GemmTunableOp_Half_TN,tn_27392_338_4096,Default,1.11947
GemmTunableOp_Half_TN,tn_27392_77_4096,Gemm_Rocblas_1140853628,0.427295
GemmTunableOp_Half_TN,tn_4096_456_13696,Gemm_Rocblas_1140853557,0.646371
GemmTunableOp_Half_TN,tn_4096_64_13696,Gemm_Rocblas_1140853593,0.198116
GemmTunableOp_Half_TN,tn_4096_2048_13696,Gemm_Rocblas_1140853577,2.57348
GemmTunableOp_Half_TN,tn_4096_631_13696,Gemm_Rocblas_1140853545,0.78782
GemmTunableOp_Half_TN,tn_4096_584_13696,Gemm_Rocblas_1140853545,0.857245
GemmTunableOp_Half_TN,tn_4096_420_4096,Gemm_Rocblas_1140853648,0.197035
GemmTunableOp_Half_TN,tn_4096_434_13696,Gemm_Rocblas_1140853580,0.700757
GemmTunableOp_Half_TN,tn_4096_296_4096,Gemm_Rocblas_1140853587,0.136818
GemmTunableOp_Half_TN,tn_4096_569_4096,Gemm_Rocblas_1140853630,0.276476
GemmTunableOp_Half_TN,tn_27392_150_4096,Gemm_Rocblas_1140853645,0.628582
GemmTunableOp_Half_TN,tn_4096_397_13696,Gemm_Rocblas_1140853557,0.644011
GemmTunableOp_Half_TN,tn_27392_397_4096,Gemm_Rocblas_1140853649,1.43968
GemmTunableOp_Half_TN,tn_4096_39_13696,Gemm_Rocblas_1140853594,0.194508
GemmTunableOp_Half_TN,tn_4096_401_13696,Gemm_Rocblas_1140853557,0.68262
GemmTunableOp_Half_TN,tn_4096_569_13696,Gemm_Rocblas_1140853545,0.838526
GemmTunableOp_Half_TN,tn_27392_56_4096,Gemm_Rocblas_1140853645,0.347586
GemmTunableOp_Half_TN,tn_4096_225_4096,Gemm_Rocblas_1140853632,0.126402
GemmTunableOp_Half_TN,tn_4096_683_4096,Gemm_Rocblas_1140853630,0.294533
GemmTunableOp_Half_TN,tn_27392_216_4096,Gemm_Rocblas_1140853583,0.792862
GemmTunableOp_Half_TN,tn_4096_1_13696,Gemm_Hipblaslt_TN_148112,0.177556
GemmTunableOp_Half_TN,tn_4096_430_4096,Gemm_Rocblas_1140853645,0.200099
GemmTunableOp_Half_TN,tn_27392_376_4096,Default,1.11725
GemmTunableOp_Half_TN,tn_4096_508_4096,Gemm_Rocblas_1140853587,0.227149
GemmTunableOp_Half_TN,tn_4096_535_4096,Gemm_Rocblas_1140853630,0.258356
GemmTunableOp_Half_TN,tn_4096_463_4096,Gemm_Rocblas_1140853587,0.217139
GemmTunableOp_Half_TN,tn_4096_13_4096,Gemm_Rocblas_1140853616,0.0336552
GemmTunableOp_Half_TN,tn_4096_240_4096,Gemm_Rocblas_1140853632,0.128642
GemmTunableOp_Half_TN,tn_4096_87_4096,Gemm_Rocblas_1140853628,0.0588068
GemmTunableOp_Half_TN,tn_4096_372_13696,Gemm_Rocblas_1140853550,0.478624
GemmTunableOp_Half_TN,tn_4096_491_13696,Gemm_Rocblas_1140853578,0.696084
GemmTunableOp_Half_TN,tn_4096_346_4096,Gemm_Rocblas_1140853557,0.142026
GemmTunableOp_Half_TN,tn_4096_128_13696,Gemm_Rocblas_1140853622,0.248722
GemmTunableOp_Half_TN,tn_4096_410_4096,Gemm_Rocblas_1140853645,0.194731
GemmTunableOp_Half_TN,tn_4096_3_4096,Gemm_Rocblas_1140853611,0.0336632
GemmTunableOp_Half_TN,tn_4096_205_13696,Gemm_Rocblas_1140853515,0.412408
GemmTunableOp_Half_TN,tn_4096_472_13696,Gemm_Rocblas_1140853557,0.69058
GemmTunableOp_Half_TN,tn_4096_403_13696,Gemm_Rocblas_1140853557,0.619314
GemmTunableOp_Half_TN,tn_4096_382_13696,Gemm_Rocblas_1140853550,0.479426
GemmTunableOp_Half_TN,tn_4096_371_13696,Gemm_Rocblas_1140853550,0.479746
GemmTunableOp_Half_TN,tn_4096_546_13696,Gemm_Rocblas_1140853545,0.844077
GemmTunableOp_Half_TN,tn_4096_437_4096,Gemm_Rocblas_1140853645,0.201843
GemmTunableOp_Half_TN,tn_4096_350_4096,Gemm_Rocblas_1140853557,0.14165
GemmTunableOp_Half_TN,tn_27392_225_4096,Gemm_Rocblas_1140853583,0.81941
GemmTunableOp_Half_TN,tn_151552_188_4096,Default,3.85808
GemmTunableOp_Half_TN,tn_4096_424_4096,Gemm_Rocblas_1140853649,0.197067
GemmTunableOp_Half_TN,tn_27392_369_4096,Default,1.12778
GemmTunableOp_Half_TN,tn_151552_152_4096,Gemm_Hipblaslt_TN_148174,3.66794
GemmTunableOp_Half_TN,tn_4096_393_4096,Gemm_Rocblas_1140853645,0.192859
GemmTunableOp_Half_TN,tn_4096_479_13696,Gemm_Rocblas_1140853557,0.690964
GemmTunableOp_Half_TN,tn_151552_71_4096,Default,2.38981
GemmTunableOp_Half_TN,tn_4096_479_4096,Gemm_Rocblas_1140853587,0.220164
GemmTunableOp_Half_TN,tn_4096_515_4096,Gemm_Rocblas_1140853630,0.268556
GemmTunableOp_Half_TN,tn_4096_480_4096,Gemm_Rocblas_1140853587,0.218364
GemmTunableOp_Half_TN,tn_4096_10_13696,Gemm_Hipblaslt_TN_148177,0.179884
GemmTunableOp_Half_TN,tn_151552_159_4096,Gemm_Hipblaslt_TN_148174,3.26622
GemmTunableOp_Half_TN,tn_4096_495_4096,Gemm_Rocblas_1140853578,0.234369
GemmTunableOp_Half_TN,tn_4096_545_4096,Gemm_Rocblas_1140853647,0.266332
GemmTunableOp_Half_TN,tn_27392_307_4096,Gemm_Rocblas_1140853648,1.03312
GemmTunableOp_Half_TN,tn_4096_8_13696,Gemm_Hipblaslt_TN_148180,0.177812
GemmTunableOp_Half_TN,tn_27392_9_4096,Gemm_Rocblas_1140853618,0.330712
GemmTunableOp_Half_TN,tn_151552_203_4096,Gemm_Rocblas_1140853639,4.21317
GemmTunableOp_Half_TN,tn_4096_17_13696,Gemm_Hipblaslt_TN_148112,0.183428
GemmTunableOp_Half_TN,tn_4096_380_4096,Gemm_Rocblas_1140853587,0.144762
GemmTunableOp_Half_TN,tn_4096_384_4096,Gemm_Rocblas_1140853587,0.138642
GemmTunableOp_Half_TN,tn_4096_334_4096,Gemm_Rocblas_1140853557,0.139291
GemmTunableOp_Half_TN,tn_4096_314_4096,Gemm_Rocblas_1140853557,0.138026
GemmTunableOp_Half_TN,tn_4096_385_4096,Gemm_Rocblas_1140853645,0.192707
GemmTunableOp_Half_TN,tn_4096_359_4096,Gemm_Rocblas_1140853587,0.14129
GemmTunableOp_Half_TN,tn_151552_35_4096,Gemm_Rocblas_1140853629,1.83439
GemmTunableOp_Half_TN,tn_27392_469_4096,Default,1.57432
GemmTunableOp_Half_TN,tn_4096_415_13696,Gemm_Rocblas_1140853557,0.662922
GemmTunableOp_Half_TN,tn_4096_364_4096,Gemm_Rocblas_1140853557,0.143522
GemmTunableOp_Half_TN,tn_4096_593_13696,Gemm_Rocblas_1140853545,0.847721
GemmTunableOp_Half_TN,tn_4096_370_4096,Gemm_Rocblas_1140853557,0.144154
GemmTunableOp_Half_TN,tn_27392_410_4096,Gemm_Rocblas_1140853649,1.51985
GemmTunableOp_Half_TN,tn_4096_89_13696,Gemm_Hipblaslt_TN_148168,0.214499
GemmTunableOp_Half_TN,tn_27392_472_4096,Default,1.67036
GemmTunableOp_Half_TN,tn_4096_564_4096,Gemm_Rocblas_1140853628,0.261781
GemmTunableOp_Half_TN,tn_4096_547_4096,Gemm_Rocblas_1140853628,0.27793
GemmTunableOp_Half_TN,tn_4096_500_13696,Gemm_Rocblas_1140853578,0.712003
GemmTunableOp_Half_TN,tn_151552_1_4096,Gemm_Rocblas_1140853512,1.74107
GemmTunableOp_Half_TN,tn_4096_836_13696,Gemm_Rocblas_1140853545,1.09387
GemmTunableOp_Half_TN,tn_4096_383_4096,Gemm_Rocblas_1140853587,0.143195
GemmTunableOp_Half_TN,tn_4096_5_13696,Gemm_Hipblaslt_TN_148112,0.176876
GemmTunableOp_Half_TN,tn_27392_305_4096,Gemm_Rocblas_1140853649,1.14865
GemmTunableOp_Half_TN,tn_27392_445_4096,Gemm_Rocblas_1140853648,1.50687
GemmTunableOp_Half_TN,tn_4096_66_4096,Gemm_Rocblas_1140853645,0.0614386
GemmTunableOp_Half_TN,tn_4096_391_4096,Gemm_Rocblas_1140853645,0.192276
GemmTunableOp_Half_TN,tn_4096_393_13696,Gemm_Rocblas_1140853557,0.620866
GemmTunableOp_Half_TN,tn_27392_383_4096,Gemm_Rocblas_1140853552,1.25704
GemmTunableOp_Half_TN,tn_27392_432_4096,Default,1.5807
GemmTunableOp_Half_TN,tn_4096_373_13696,Gemm_Rocblas_1140853550,0.519259
GemmTunableOp_Half_TN,tn_27392_296_4096,Gemm_Rocblas_1140853649,1.13339
GemmTunableOp_Half_TN,tn_4096_403_4096,Gemm_Rocblas_1140853648,0.194883
GemmTunableOp_Half_TN,tn_27392_203_4096,Gemm_Rocblas_1140853583,0.797719
GemmTunableOp_Half_TN,tn_4096_584_4096,Gemm_Rocblas_1140853628,0.290284
GemmTunableOp_Half_TN,tn_4096_341_13696,Gemm_Rocblas_1140853550,0.476227
GemmTunableOp_Half_TN,tn_4096_549_4096,Gemm_Rocblas_1140853630,0.260454
GemmTunableOp_Half_TN,tn_4096_400_4096,Gemm_Rocblas_1140853649,0.193507
GemmTunableOp_Half_TN,tn_4096_412_4096,Gemm_Rocblas_1140853645,0.206273
GemmTunableOp_Half_TN,tn_27392_112_4096,Gemm_Rocblas_1140853628,0.437259
GemmTunableOp_Half_TN,tn_151552_25_4096,Gemm_Rocblas_1140853614,1.80375
GemmTunableOp_Half_TN,tn_151552_233_4096,Gemm_Rocblas_1140853638,4.30973
GemmTunableOp_Half_TN,tn_4096_225_13696,Gemm_Rocblas_1140853632,0.421645
GemmTunableOp_Half_TN,tn_27392_16_4096,Gemm_Rocblas_1140853614,0.333226
GemmTunableOp_Half_TN,tn_27392_326_4096,Default,1.12857
GemmTunableOp_Half_TN,tn_4096_360_4096,Gemm_Rocblas_1140853557,0.143082
GemmTunableOp_Half_TN,tn_27392_205_4096,Gemm_Rocblas_1140853552,0.813816
GemmTunableOp_Half_TN,tn_151552_115_4096,Gemm_Rocblas_1140853619,2.56009
GemmTunableOp_Half_TN,tn_4096_510_13696,Gemm_Rocblas_1140853550,0.696684
GemmTunableOp_Half_TN,tn_27392_549_4096,Default,1.80938
GemmTunableOp_Half_TN,tn_4096_368_4096,Gemm_Rocblas_1140853557,0.142611
GemmTunableOp_Half_TN,tn_4096_77_4096,Gemm_Rocblas_1140853652,0.0604466
GemmTunableOp_Half_TN,tn_4096_297_4096,Gemm_Rocblas_1140853557,0.136418
GemmTunableOp_Half_TN,tn_4096_354_4096,Gemm_Rocblas_1140853587,0.142339
GemmTunableOp_Half_TN,tn_4096_524_13696,Gemm_Rocblas_1140853545,0.845413
GemmTunableOp_Half_TN,tn_27392_510_4096,Default,1.77823
GemmTunableOp_Half_TN,tn_4096_209_4096,Gemm_Rocblas_1140853647,0.127248
GemmTunableOp_Half_TN,tn_4096_181_13696,Gemm_Rocblas_1140853520,0.309117
GemmTunableOp_Half_TN,tn_151552_95_4096,Gemm_Rocblas_1140853645,2.38421
GemmTunableOp_Half_TN,tn_27392_545_4096,Default,1.80315
GemmTunableOp_Half_TN,tn_4096_306_4096,Gemm_Rocblas_1140853587,0.137371
GemmTunableOp_Half_TN,tn_4096_527_13696,Gemm_Rocblas_1140853545,0.829341
GemmTunableOp_Half_TN,tn_4096_476_4096,Gemm_Rocblas_1140853587,0.220452
GemmTunableOp_Half_TN,tn_27392_538_4096,Default,1.81162
GemmTunableOp_Half_TN,tn_4096_140_4096,Gemm_Rocblas_1140853636,0.0703588
GemmTunableOp_Half_TN,tn_27392_493_4096,Gemm_Rocblas_1140853649,1.68764
GemmTunableOp_Half_TN,tn_27392_424_4096,Gemm_Rocblas_1140853649,1.54841
GemmTunableOp_Half_TN,tn_151552_165_4096,Gemm_Rocblas_1140853619,3.35219
GemmTunableOp_Half_TN,tn_27392_107_4096,Gemm_Rocblas_1140853628,0.431016
GemmTunableOp_Half_TN,tn_4096_65_4096,Gemm_Rocblas_1140853520,0.0632226
GemmTunableOp_Half_TN,tn_4096_357_13696,Gemm_Rocblas_1140853550,0.474794
GemmTunableOp_Half_TN,tn_151552_196_4096,Gemm_Rocblas_1140853639,4.17533
GemmTunableOp_Half_TN,tn_4096_441_4096,Gemm_Rocblas_1140853645,0.209577
GemmTunableOp_Half_TN,tn_27392_35_4096,Gemm_Rocblas_1140853628,0.3436
GemmTunableOp_Half_TN,tn_151552_186_4096,Gemm_Rocblas_1140853619,3.94666
GemmTunableOp_Half_TN,tn_4096_320_4096,Gemm_Rocblas_1140853557,0.137355
GemmTunableOp_Half_TN,tn_4096_316_4096,Gemm_Rocblas_1140853587,0.139483
GemmTunableOp_Half_TN,tn_4096_408_4096,Gemm_Rocblas_1140853649,0.195899
GemmTunableOp_Half_TN,tn_4096_469_4096,Gemm_Rocblas_1140853587,0.219524
GemmTunableOp_Half_TN,tn_4096_363_4096,Gemm_Rocblas_1140853587,0.142859
GemmTunableOp_Half_TN,tn_27392_371_4096,Default,1.13018
GemmTunableOp_Half_TN,tn_4096_424_13696,Gemm_Rocblas_1140853557,0.622914
GemmTunableOp_Half_TN,tn_4096_445_4096,Gemm_Rocblas_1140853646,0.199804
GemmTunableOp_Half_TN,tn_4096_446_13696,Gemm_Rocblas_1140853557,0.644434
GemmTunableOp_Half_TN,tn_4096_330_13696,Gemm_Rocblas_1140853580,0.48061
GemmTunableOp_Half_TN,tn_27392_375_4096,Default,1.11699
GemmTunableOp_Half_TN,tn_4096_88_4096,Gemm_Rocblas_1140853649,0.0620644
GemmTunableOp_Half_TN,tn_151552_213_4096,Gemm_Rocblas_1140853619,4.82178
GemmTunableOp_Half_TN,tn_4096_308_4096,Gemm_Rocblas_1140853557,0.136251
GemmTunableOp_Half_TN,tn_27392_593_4096,Default,2.09147
GemmTunableOp_Half_TN,tn_4096_331_4096,Gemm_Rocblas_1140853587,0.137987
GemmTunableOp_Half_TN,tn_4096_107_4096,Gemm_Rocblas_1140853649,0.056175
GemmTunableOp_Half_TN,tn_4096_431_4096,Gemm_Rocblas_1140853648,0.199052
GemmTunableOp_Half_TN,tn_27392_301_4096,Gemm_Rocblas_1140853649,1.1359
GemmTunableOp_Half_TN,tn_151552_140_4096,Gemm_Rocblas_1140853619,3.65163
GemmTunableOp_Half_TN,tn_27392_431_4096,Gemm_Rocblas_1140853649,1.48571
GemmTunableOp_Half_TN,tn_4096_438_4096,Gemm_Rocblas_1140853645,0.20122
GemmTunableOp_Half_TN,tn_27392_374_4096,Default,1.2387
GemmTunableOp_Half_TN,tn_4096_339_4096,Gemm_Rocblas_1140853587,0.139242
GemmTunableOp_Half_TN,tn_4096_378_13696,Gemm_Rocblas_1140853550,0.480944
GemmTunableOp_Half_TN,tn_27392_438_4096,Gemm_Rocblas_1140853649,1.56732
GemmTunableOp_Half_TN,tn_27392_401_4096,Gemm_Rocblas_1140853649,1.44907
GemmTunableOp_Half_TN,tn_4096_438_13696,Gemm_Rocblas_1140853557,0.647437
GemmTunableOp_Half_TN,tn_4096_81_13696,Gemm_Hipblaslt_TN_148168,0.211843
GemmTunableOp_Half_TN,tn_4096_399_4096,Gemm_Rocblas_1140853645,0.193755
GemmTunableOp_Half_TN,tn_27392_580_4096,Default,2.10142
GemmTunableOp_Half_TN,tn_27392_565_4096,Default,1.84269
GemmTunableOp_Half_TN,tn_4096_414_13696,Gemm_Rocblas_1140853565,0.628154
GemmTunableOp_Half_TN,tn_4096_499_4096,Gemm_Rocblas_1140853579,0.226236
GemmTunableOp_Half_TN,tn_4096_85_13696,Gemm_Hipblaslt_TN_148168,0.215452
GemmTunableOp_Half_TN,tn_4096_496_13696,Gemm_Rocblas_1140853580,0.697742
GemmTunableOp_Half_TN,tn_4096_453_13696,Gemm_Rocblas_1140853557,0.647871
GemmTunableOp_Half_TN,tn_4096_340_4096,Gemm_Rocblas_1140853557,0.139746
GemmTunableOp_Half_TN,tn_4096_153_4096,Gemm_Rocblas_1140853529,0.0804708
GemmTunableOp_Half_TN,tn_27392_488_4096,Gemm_Rocblas_1140853619,1.79318
GemmTunableOp_Half_TN,tn_27392_302_4096,Gemm_Rocblas_1140853648,1.13745
GemmTunableOp_Half_TN,tn_4096_298_13696,Gemm_Rocblas_1140853646,0.472712
GemmTunableOp_Half_TN,tn_4096_836_4096,Gemm_Rocblas_1140853583,0.379991
GemmTunableOp_Half_TN,tn_27392_2_4096,Gemm_Rocblas_1140853614,0.328121
GemmTunableOp_Half_TN,tn_4096_366_13696,Gemm_Rocblas_1140853550,0.495946
GemmTunableOp_Half_TN,tn_27392_294_4096,Gemm_Rocblas_1140853649,1.12107
GemmTunableOp_Half_TN,tn_4096_422_4096,Gemm_Rocblas_1140853645,0.196364
GemmTunableOp_Half_TN,tn_27392_425_4096,Gemm_Rocblas_1140853649,1.48345
GemmTunableOp_Half_TN,tn_27392_354_4096,Default,1.11061
GemmTunableOp_Half_TN,tn_4096_130_13696,Gemm_Rocblas_1140853520,0.292707
GemmTunableOp_Half_TN,tn_27392_446_4096,Gemm_Rocblas_1140853649,1.56429
GemmTunableOp_Half_TN,tn_4096_130_4096,Gemm_Rocblas_1140853636,0.0692388
GemmTunableOp_Half_TN,tn_4096_381_13696,Gemm_Rocblas_1140853550,0.47944
GemmTunableOp_Half_TN,tn_151552_29_4096,Gemm_Rocblas_1140853599,1.81442
GemmTunableOp_Half_TN,tn_4096_354_13696,Gemm_Rocblas_1140853550,0.491586
GemmTunableOp_Half_TN,tn_4096_310_4096,Gemm_Rocblas_1140853557,0.13785
GemmTunableOp_Half_TN,tn_4096_141_13696,Gemm_Rocblas_1140853520,0.299443
GemmTunableOp_Half_TN,tn_4096_593_4096,Gemm_Rocblas_1140853629,0.279854
GemmTunableOp_Half_TN,tn_4096_383_13696,Gemm_Rocblas_1140853550,0.477946
GemmTunableOp_Half_TN,tn_27392_512_4096,Default,1.79077
GemmTunableOp_Half_TN,tn_27392_64_4096,Gemm_Rocblas_1140853653,0.348032
GemmTunableOp_Half_TN,tn_4096_318_13696,Gemm_Rocblas_1140853646,0.474561
GemmTunableOp_Half_TN,tn_27392_196_4096,Gemm_Rocblas_1140853552,0.757692
GemmTunableOp_Half_TN,tn_4096_463_13696,Gemm_Rocblas_1140853557,0.659538
GemmTunableOp_Half_TN,tn_4096_548_4096,Gemm_Rocblas_1140853629,0.278362
GemmTunableOp_Half_TN,tn_151552_84_4096,Gemm_Rocblas_1140853645,2.36715
GemmTunableOp_Half_TN,tn_27392_313_4096,Gemm_Rocblas_1140853649,1.03906
GemmTunableOp_Half_TN,tn_27392_243_4096,Gemm_Rocblas_1140853552,0.839948
GemmTunableOp_Half_TN,tn_4096_78_13696,Gemm_Hipblaslt_TN_148168,0.214083
GemmTunableOp_Half_TN,tn_4096_12_4096,Gemm_Rocblas_1140853617,0.0362712
GemmTunableOp_Half_TN,tn_4096_309_4096,Gemm_Rocblas_1140853557,0.137219
GemmTunableOp_Half_TN,tn_27392_228_4096,Gemm_Rocblas_1140853583,0.829988
GemmTunableOp_Half_TN,tn_151552_49_4096,Gemm_Rocblas_1140853653,1.8329
GemmTunableOp_Half_TN,tn_151552_72_4096,Gemm_Rocblas_1140853645,2.37219
GemmTunableOp_Half_TN,tn_27392_457_4096,Default,1.58213
GemmTunableOp_Half_TN,tn_4096_68_13696,Gemm_Hipblaslt_TN_148168,0.210476
GemmTunableOp_Half_TN,tn_4096_21_4096,Gemm_Rocblas_1140853612,0.0342872
GemmTunableOp_Half_TN,tn_27392_587_4096,Default,2.12941
GemmTunableOp_Half_TN,tn_4096_80_13696,Gemm_Hipblaslt_TN_148168,0.217498
GemmTunableOp_Half_TN,tn_4096_216_13696,Gemm_Rocblas_1140853515,0.406347
GemmTunableOp_Half_TN,tn_4096_302_4096,Gemm_Rocblas_1140853557,0.136675
GemmTunableOp_Half_TN,tn_4096_448_4096,Gemm_Rocblas_1140853646,0.20026
GemmTunableOp_Half_TN,tn_27392_355_4096,Default,1.12705
GemmTunableOp_Half_TN,tn_151552_75_4096,Gemm_Rocblas_1140853645,2.36374
GemmTunableOp_Half_TN,tn_27392_352_4096,Default,1.10823
GemmTunableOp_Half_TN,tn_27392_416_4096,Gemm_Rocblas_1140853649,1.53604
GemmTunableOp_Half_TN,tn_27392_389_4096,Gemm_Rocblas_1140853649,1.43055
GemmTunableOp_Half_TN,tn_4096_78_4096,Gemm_Rocblas_1140853520,0.0631986
GemmTunableOp_Half_TN,tn_27392_386_4096,Gemm_Rocblas_1140853649,1.48001
GemmTunableOp_Half_TN,tn_4096_386_4096,Gemm_Rocblas_1140853649,0.19442
GemmTunableOp_Half_TN,tn_4096_372_4096,Gemm_Rocblas_1140853557,0.142794
GemmTunableOp_Half_TN,tn_4096_156_13696,Gemm_Rocblas_1140853515,0.30442
GemmTunableOp_Half_TN,tn_4096_344_13696,Gemm_Rocblas_1140853550,0.477186
GemmTunableOp_Half_TN,tn_4096_303_13696,Gemm_Rocblas_1140853550,0.478185
GemmTunableOp_Half_TN,tn_4096_470_4096,Gemm_Rocblas_1140853587,0.213228
GemmTunableOp_Half_TN,tn_151552_78_4096,Gemm_Rocblas_1140853645,2.36999
GemmTunableOp_Half_TN,tn_4096_350_13696,Gemm_Rocblas_1140853550,0.476119
GemmTunableOp_Half_TN,tn_4096_315_4096,Gemm_Rocblas_1140853557,0.138299
GemmTunableOp_Half_TN,tn_4096_306_13696,Gemm_Rocblas_1140853646,0.46857
GemmTunableOp_Half_TN,tn_27392_348_4096,Default,1.12633
GemmTunableOp_Half_TN,tn_27392_483_4096,Gemm_Rocblas_1140853649,1.65854
GemmTunableOp_Half_TN,tn_4096_344_4096,Gemm_Rocblas_1140853557,0.141059
GemmTunableOp_Half_TN,tn_4096_370_13696,Gemm_Rocblas_1140853550,0.48092
GemmTunableOp_Half_TN,tn_151552_161_4096,Gemm_Rocblas_1140853628,3.32666
GemmTunableOp_Half_TN,tn_4096_375_13696,Gemm_Rocblas_1140853550,0.496841
GemmTunableOp_Half_TN,tn_27392_109_4096,Gemm_Rocblas_1140853628,0.439727
GemmTunableOp_Half_TN,tn_4096_104_4096,Gemm_Rocblas_1140853530,0.0588788
GemmTunableOp_Half_TN,tn_4096_305_13696,Gemm_Rocblas_1140853646,0.476057
GemmTunableOp_Half_TN,tn_4096_547_13696,Gemm_Rocblas_1140853545,0.855533
GemmTunableOp_Half_TN,tn_4096_256_13696,Gemm_Rocblas_1140853515,0.420778
GemmTunableOp_Half_TN,tn_4096_304_13696,Gemm_Rocblas_1140853646,0.473362
GemmTunableOp_Half_TN,tn_27392_2048_4096,Gemm_Rocblas_1140853653,6.37507
GemmTunableOp_Half_TN,tn_4096_1635_13696,Gemm_Rocblas_1140853576,2.18488
GemmTunableOp_Half_TN,tn_27392_362_4096,Default,1.10698
GemmTunableOp_Half_TN,tn_4096_357_4096,Gemm_Rocblas_1140853557,0.142067
GemmTunableOp_Half_TN,tn_4096_392_4096,Gemm_Rocblas_1140853649,0.195436
GemmTunableOp_Half_TN,tn_4096_367_4096,Gemm_Rocblas_1140853557,0.14193
GemmTunableOp_Half_TN,tn_27392_36_4096,Gemm_Rocblas_1140853648,0.343528
GemmTunableOp_Half_TN,tn_4096_35_13696,Gemm_Rocblas_1140853594,0.19306
GemmTunableOp_Half_TN,tn_4096_313_13696,Gemm_Rocblas_1140853550,0.494187
GemmTunableOp_Half_TN,tn_27392_444_4096,Default,1.57277
GemmTunableOp_Half_TN,tn_27392_422_4096,Gemm_Rocblas_1140853649,1.53188
GemmTunableOp_Half_TN,tn_27392_480_4096,Default,1.61359
GemmTunableOp_Half_TN,tn_4096_301_4096,Gemm_Rocblas_1140853587,0.137538
GemmTunableOp_Half_TN,tn_4096_389_4096,Gemm_Rocblas_1140853645,0.19262
GemmTunableOp_Half_TN,tn_27392_470_4096,Default,1.59723
GemmTunableOp_Half_TN,tn_4096_352_4096,Gemm_Rocblas_1140853557,0.14125
GemmTunableOp_Half_TN,tn_4096_92_13696,Gemm_Hipblaslt_TN_148168,0.212412
GemmTunableOp_Half_TN,tn_4096_544_13696,Gemm_Rocblas_1140853545,0.847285
GemmTunableOp_Half_TN,tn_27392_312_4096,Gemm_Rocblas_1140853649,1.04267
GemmTunableOp_Half_TN,tn_4096_486_13696,Gemm_Rocblas_1140853580,0.694461
GemmTunableOp_Half_TN,tn_4096_307_13696,Gemm_Rocblas_1140853550,0.482913
GemmTunableOp_Half_TN,tn_4096_293_13696,Gemm_Rocblas_1140853646,0.470991
GemmTunableOp_Half_TN,tn_27392_439_4096,Gemm_Rocblas_1140853649,1.50449
GemmTunableOp_Half_TN,tn_151552_244_4096,Gemm_Rocblas_1140853627,4.40766
GemmTunableOp_Half_TN,tn_4096_492_13696,Gemm_Rocblas_1140853557,0.715341
GemmTunableOp_Half_TN,tn_4096_462_4096,Gemm_Rocblas_1140853587,0.221556
GemmTunableOp_Half_TN,tn_4096_216_4096,Gemm_Rocblas_1140853646,0.127305
GemmTunableOp_Half_TN,tn_27392_462_4096,Default,1.57607
GemmTunableOp_Half_TN,tn_4096_300_13696,Gemm_Rocblas_1140853550,0.507019
GemmTunableOp_Half_TN,tn_4096_407_4096,Gemm_Rocblas_1140853649,0.192187
GemmTunableOp_Half_TN,tn_4096_429_4096,Gemm_Rocblas_1140853649,0.197483
GemmTunableOp_Half_TN,tn_151552_99_4096,Gemm_Rocblas_1140853628,2.50809
GemmTunableOp_Half_TN,tn_4096_513_4096,Gemm_Rocblas_1140853628,0.260612
GemmTunableOp_Half_TN,tn_27392_392_4096,Gemm_Rocblas_1140853649,1.50479
GemmTunableOp_Half_TN,tn_4096_317_13696,Gemm_Rocblas_1140853550,0.495776
GemmTunableOp_Half_TN,tn_4096_14_13696,Gemm_Hipblaslt_TN_148127,0.177404
GemmTunableOp_Half_TN,tn_151552_24_4096,Gemm_Rocblas_1140853614,1.80298
GemmTunableOp_Half_TN,tn_4096_101_13696,Gemm_Rocblas_1140853622,0.243163
GemmTunableOp_Half_TN,tn_27392_140_4096,Gemm_Rocblas_1140853628,0.586486
GemmTunableOp_Half_TN,tn_4096_389_13696,Gemm_Rocblas_1140853557,0.620572
GemmTunableOp_Half_TN,tn_151552_92_4096,Gemm_Rocblas_1140853645,2.38869
GemmTunableOp_Half_TN,tn_4096_460_13696,Gemm_Rocblas_1140853557,0.654101
GemmTunableOp_Half_TN,tn_27392_473_4096,Default,1.61825
GemmTunableOp_Half_TN,tn_27392_320_4096,Gemm_Rocblas_1140853653,1.04465
GemmTunableOp_Half_TN,tn_27392_232_4096,Gemm_Rocblas_1140853552,0.827236
GemmTunableOp_Half_TN,tn_4096_395_4096,Gemm_Rocblas_1140853645,0.192043
GemmTunableOp_Half_TN,tn_4096_322_4096,Gemm_Rocblas_1140853587,0.137635
GemmTunableOp_Half_TN,tn_4096_439_13696,Gemm_Rocblas_1140853557,0.626859
GemmTunableOp_Half_TN,tn_4096_450_4096,Gemm_Rocblas_1140853557,0.219292
GemmTunableOp_Half_TN,tn_27392_450_4096,Default,1.59809
GemmTunableOp_Half_TN,tn_4096_416_4096,Gemm_Rocblas_1140853649,0.194835
GemmTunableOp_Half_TN,tn_4096_442_4096,Gemm_Rocblas_1140853645,0.211793
GemmTunableOp_Half_TN,tn_4096_437_13696,Gemm_Rocblas_1140853557,0.622874
GemmTunableOp_Half_TN,tn_4096_329_13696,Gemm_Rocblas_1140853550,0.483282
GemmTunableOp_Half_TN,tn_27392_487_4096,Gemm_Rocblas_1140853649,1.66844
GemmTunableOp_Half_TN,tn_4096_487_13696,Gemm_Rocblas_1140853557,0.692667
GemmTunableOp_Half_TN,tn_4096_493_4096,Gemm_Rocblas_1140853548,0.224547
GemmTunableOp_Half_TN,tn_4096_493_13696,Gemm_Rocblas_1140853580,0.695618
GemmTunableOp_Half_TN,tn_151552_207_4096,Gemm_Rocblas_1140853639,4.22428
GemmTunableOp_Half_TN,tn_27392_353_4096,Default,1.13384
GemmTunableOp_Half_TN,tn_27392_136_4096,Gemm_Rocblas_1140853646,0.58267
GemmTunableOp_Half_TN,tn_4096_670_4096,Gemm_Rocblas_1140853630,0.306981
GemmTunableOp_Half_TN,tn_151552_57_4096,Gemm_Rocblas_1140853653,1.84659
GemmTunableOp_Half_TN,tn_4096_416_13696,Gemm_Rocblas_1140853557,0.621971
GemmTunableOp_Half_TN,tn_4096_384_13696,Gemm_Rocblas_1140853580,0.488263
GemmTunableOp_Half_TN,tn_27392_315_4096,Gemm_Rocblas_1140853649,1.04221
GemmTunableOp_Half_TN,tn_27392_400_4096,Gemm_Rocblas_1140853649,1.53497
GemmTunableOp_Half_TN,tn_4096_28_13696,Gemm_Hipblaslt_TN_148112,0.1799
GemmTunableOp_Half_TN,tn_4096_35_4096,Gemm_Rocblas_1140853651,0.043439
GemmTunableOp_Half_TN,tn_4096_415_4096,Gemm_Rocblas_1140853649,0.193699
GemmTunableOp_Half_TN,tn_27392_415_4096,Gemm_Rocblas_1140853649,1.45036
GemmTunableOp_Half_TN,tn_27392_360_4096,Default,1.11331
GemmTunableOp_Half_TN,tn_4096_360_13696,Gemm_Rocblas_1140853550,0.500375
GemmTunableOp_Half_TN,tn_4096_88_13696,Gemm_Hipblaslt_TN_148168,0.217685
GemmTunableOp_Half_TN,tn_151552_121_4096,Gemm_Rocblas_1140853645,2.48654
GemmTunableOp_Half_TN,tn_4096_515_13696,Gemm_Rocblas_1140853545,0.842156
GemmTunableOp_Half_TN,tn_4096_409_4096,Gemm_Rocblas_1140853645,0.193923
GemmTunableOp_Half_TN,tn_4096_631_4096,Gemm_Rocblas_1140853630,0.2761
GemmTunableOp_Half_TN,tn_4096_400_13696,Gemm_Rocblas_1140853557,0.661546
GemmTunableOp_Half_TN,tn_151552_94_4096,Gemm_Rocblas_1140853645,2.39441
GemmTunableOp_Half_TN,tn_4096_516_4096,Gemm_Rocblas_1140853628,0.271052
GemmTunableOp_Half_TN,tn_4096_128_4096,Gemm_Rocblas_1140853634,0.0602004
GemmTunableOp_Half_TN,tn_4096_90_4096,Gemm_Rocblas_1140853649,0.0554228
GemmTunableOp_Half_TN,tn_27392_82_4096,Gemm_Rocblas_1140853628,0.425159
GemmTunableOp_Half_TN,tn_4096_365_13696,Gemm_Rocblas_1140853550,0.474031
GemmTunableOp_Half_TN,tn_4096_82_4096,Gemm_Rocblas_1140853645,0.0569588
GemmTunableOp_Half_TN,tn_4096_516_13696,Gemm_Rocblas_1140853545,0.843293
GemmTunableOp_Half_TN,tn_4096_473_13696,Gemm_Rocblas_1140853557,0.691931
GemmTunableOp_Half_TN,tn_151552_255_4096,Gemm_Rocblas_1140853626,4.90149
GemmTunableOp_Half_TN,tn_4096_361_13696,Gemm_Rocblas_1140853550,0.476431
GemmTunableOp_Half_TN,tn_4096_580_13696,Gemm_Rocblas_1140853545,0.837361
GemmTunableOp_Half_TN,tn_4096_254_4096,Gemm_Rocblas_1140853632,0.130322
GemmTunableOp_Half_TN,tn_4096_254_13696,Gemm_Rocblas_1140853632,0.428246
GemmTunableOp_Half_TN,tn_151552_254_4096,Gemm_Rocblas_1140853626,4.41355
GemmTunableOp_Half_TN,tn_4096_455_4096,Gemm_Rocblas_1140853549,0.230457
GemmTunableOp_Half_TN,tn_27392_253_4096,Gemm_Rocblas_1140853583,0.836932
GemmTunableOp_Half_TN,tn_4096_73_13696,Gemm_Hipblaslt_TN_148168,0.212196
GemmTunableOp_Half_TN,tn_4096_232_4096,Gemm_Rocblas_1140853632,0.128898
GemmTunableOp_Half_TN,tn_4096_421_4096,Gemm_Rocblas_1140853645,0.196667
GemmTunableOp_Half_TN,tn_4096_253_13696,Gemm_Rocblas_1140853632,0.42655
GemmTunableOp_Half_TN,tn_4096_105_13696,Gemm_Rocblas_1140853622,0.243011
GemmTunableOp_Half_TN,tn_4096_443_4096,Gemm_Rocblas_1140853645,0.20074
GemmTunableOp_Half_TN,tn_151552_253_4096,Gemm_Rocblas_1140853638,4.46459
GemmTunableOp_Half_TN,tn_27392_250_4096,Gemm_Rocblas_1140853583,0.860316
GemmTunableOp_Half_TN,tn_4096_473_4096,Gemm_Rocblas_1140853587,0.218379
GemmTunableOp_Half_TN,tn_4096_248_13696,Gemm_Rocblas_1140853515,0.423422
GemmTunableOp_Half_TN,tn_4096_244_4096,Gemm_Rocblas_1140853646,0.129346
GemmTunableOp_Half_TN,tn_4096_104_13696,Gemm_Rocblas_1140853622,0.242059
GemmTunableOp_Half_TN,tn_4096_243_13696,Gemm_Rocblas_1140853515,0.42579
GemmTunableOp_Half_TN,tn_4096_241_4096,Gemm_Rocblas_1140853647,0.127626
GemmTunableOp_Half_TN,tn_4096_241_13696,Gemm_Rocblas_1140853515,0.418782
GemmTunableOp_Half_TN,tn_27392_683_4096,Default,2.29318
GemmTunableOp_Half_TN,tn_151552_241_4096,Gemm_Rocblas_1140853638,4.37693
GemmTunableOp_Half_TN,tn_27392_240_4096,Gemm_Rocblas_1140853583,0.851804
GemmTunableOp_Half_TN,tn_4096_227_13696,Gemm_Rocblas_1140853515,0.41743
GemmTunableOp_Half_TN,tn_27392_304_4096,Gemm_Rocblas_1140853649,1.14226
GemmTunableOp_Half_TN,tn_151552_240_4096,Gemm_Rocblas_1140853638,4.37843
GemmTunableOp_Half_TN,tn_4096_239_4096,Gemm_Rocblas_1140853632,0.129538
GemmTunableOp_Half_TN,tn_27392_187_4096,Gemm_Rocblas_1140853645,0.678706
GemmTunableOp_Half_TN,tn_27392_239_4096,Gemm_Rocblas_1140853583,0.837124
GemmTunableOp_Half_TN,tn_151552_4_4096,Gemm_Rocblas_1140853603,1.75102
GemmTunableOp_Half_TN,tn_4096_239_13696,Gemm_Rocblas_1140853515,0.422926
GemmTunableOp_Half_TN,tn_4096_96_4096,Gemm_Rocblas_1140853520,0.0646948
GemmTunableOp_Half_TN,tn_151552_239_4096,Gemm_Rocblas_1140853638,4.38509
GemmTunableOp_Half_TN,tn_27392_237_4096,Gemm_Rocblas_1140853583,0.82794
GemmTunableOp_Half_TN,tn_27392_236_4096,Gemm_Rocblas_1140853552,0.825252
GemmTunableOp_Half_TN,tn_4096_171_13696,Gemm_Rocblas_1140853520,0.30658
GemmTunableOp_Half_TN,tn_4096_237_13696,Gemm_Rocblas_1140853632,0.425566
GemmTunableOp_Half_TN,tn_4096_614_13696,Gemm_Rocblas_1140853545,0.851101
GemmTunableOp_Half_TN,tn_4096_236_4096,Gemm_Rocblas_1140853647,0.12541
GemmTunableOp_Half_TN,tn_27392_47_4096,Gemm_Rocblas_1140853628,0.346104
GemmTunableOp_Half_TN,tn_27392_564_4096,Default,1.80125
GemmTunableOp_Half_TN,tn_4096_236_13696,Gemm_Rocblas_1140853632,0.427102
GemmTunableOp_Half_TN,tn_4096_233_4096,Gemm_Rocblas_1140853646,0.12813
GemmTunableOp_Half_TN,tn_4096_462_13696,Gemm_Rocblas_1140853557,0.632356
GemmTunableOp_Half_TN,tn_4096_70_13696,Gemm_Hipblaslt_TN_148168,0.211107
GemmTunableOp_Half_TN,tn_4096_233_13696,Gemm_Rocblas_1140853632,0.428206
GemmTunableOp_Half_TN,tn_27392_223_4096,Gemm_Rocblas_1140853583,0.827305
GemmTunableOp_Half_TN,tn_4096_395_13696,Gemm_Rocblas_1140853565,0.628836
GemmTunableOp_Half_TN,tn_4096_173_4096,Gemm_Rocblas_1140853519,0.0814632
GemmTunableOp_Half_TN,tn_4096_427_13696,Gemm_Rocblas_1140853557,0.699388
GemmTunableOp_Half_TN,tn_4096_232_13696,Gemm_Rocblas_1140853515,0.423454
GemmTunableOp_Half_TN,tn_4096_163_13696,Gemm_Rocblas_1140853520,0.300332
GemmTunableOp_Half_TN,tn_4096_470_13696,Gemm_Rocblas_1140853557,0.649524
GemmTunableOp_Half_TN,tn_4096_228_13696,Gemm_Rocblas_1140853515,0.421302
GemmTunableOp_Half_TN,tn_4096_227_4096,Gemm_Rocblas_1140853632,0.128402
GemmTunableOp_Half_TN,tn_27392_227_4096,Gemm_Rocblas_1140853552,0.800451
GemmTunableOp_Half_TN,tn_4096_501_4096,Gemm_Rocblas_1140853557,0.21578
GemmTunableOp_Half_TN,tn_151552_42_4096,Gemm_Rocblas_1140853637,1.82101
GemmTunableOp_Half_TN,tn_151552_227_4096,Gemm_Rocblas_1140853638,4.27661
GemmTunableOp_Half_TN,tn_151552_143_4096,Gemm_Hipblaslt_TN_148174,3.65117
GemmTunableOp_Half_TN,tn_151552_225_4096,Gemm_Rocblas_1140853638,4.27849
GemmTunableOp_Half_TN,tn_4096_223_13696,Gemm_Rocblas_1140853515,0.414684
GemmTunableOp_Half_TN,tn_27392_421_4096,Gemm_Rocblas_1140853649,1.46714
GemmTunableOp_Half_TN,tn_27392_244_4096,Gemm_Rocblas_1140853552,0.851804
GemmTunableOp_Half_TN,tn_151552_223_4096,Gemm_Rocblas_1140853638,4.26462
GemmTunableOp_Half_TN,tn_4096_326_13696,Gemm_Rocblas_1140853550,0.475179
GemmTunableOp_Half_TN,tn_4096_219_4096,Gemm_Rocblas_1140853632,0.128793
GemmTunableOp_Half_TN,tn_4096_219_13696,Gemm_Rocblas_1140853515,0.408084
GemmTunableOp_Half_TN,tn_151552_219_4096,Gemm_Rocblas_1140853638,4.25799
GemmTunableOp_Half_TN,tn_27392_212_4096,Gemm_Rocblas_1140853552,0.810549
GemmTunableOp_Half_TN,tn_4096_609_4096,Gemm_Rocblas_1140853630,0.304914
GemmTunableOp_Half_TN,tn_151552_146_4096,Gemm_Rocblas_1140853619,3.69951
GemmTunableOp_Half_TN,tn_4096_212_13696,Gemm_Rocblas_1140853515,0.415514
GemmTunableOp_Half_TN,tn_27392_390_4096,Gemm_Rocblas_1140853649,1.46498
GemmTunableOp_Half_TN,tn_4096_132_4096,Gemm_Rocblas_1140853529,0.0705748
GemmTunableOp_Half_TN,tn_27392_399_4096,Gemm_Rocblas_1140853649,1.44149
GemmTunableOp_Half_TN,tn_151552_212_4096,Gemm_Rocblas_1140853638,4.24545
GemmTunableOp_Half_TN,tn_151552_153_4096,Gemm_Rocblas_1140853619,3.73204
GemmTunableOp_Half_TN,tn_27392_211_4096,Gemm_Rocblas_1140853583,0.806508
GemmTunableOp_Half_TN,tn_27392_476_4096,Default,1.60048
GemmTunableOp_Half_TN,tn_4096_211_13696,Gemm_Rocblas_1140853515,0.40601
GemmTunableOp_Half_TN,tn_27392_321_4096,Default,1.1056
GemmTunableOp_Half_TN,tn_4096_2_4096,Gemm_Rocblas_1140853617,0.0345114
GemmTunableOp_Half_TN,tn_151552_211_4096,Gemm_Rocblas_1140853638,4.21439
GemmTunableOp_Half_TN,tn_27392_364_4096,Default,1.12343
GemmTunableOp_Half_TN,tn_4096_38_13696,Gemm_Rocblas_1140853623,0.192188
GemmTunableOp_Half_TN,tn_27392_209_4096,Gemm_Rocblas_1140853552,0.801091
GemmTunableOp_Half_TN,tn_4096_69_4096,Gemm_Rocblas_1140853635,0.0592946
GemmTunableOp_Half_TN,tn_4096_28_4096,Gemm_Rocblas_1140853597,0.0352232
GemmTunableOp_Half_TN,tn_27392_207_4096,Gemm_Rocblas_1140853583,0.785986
GemmTunableOp_Half_TN,tn_4096_63_13696,Gemm_Rocblas_1140853594,0.19694
GemmTunableOp_Half_TN,tn_4096_207_13696,Gemm_Rocblas_1140853515,0.404641
GemmTunableOp_Half_TN,tn_4096_206_4096,Gemm_Rocblas_1140853647,0.128024
GemmTunableOp_Half_TN,tn_151552_206_4096,Gemm_Rocblas_1140853639,4.21743
GemmTunableOp_Half_TN,tn_4096_503_4096,Gemm_Rocblas_1140853578,0.237138
GemmTunableOp_Half_TN,tn_151552_205_4096,Gemm_Rocblas_1140853638,4.20248
GemmTunableOp_Half_TN,tn_4096_203_13696,Gemm_Rocblas_1140853515,0.405656
GemmTunableOp_Half_TN,tn_151552_90_4096,Gemm_Rocblas_1140853645,2.39893
GemmTunableOp_Half_TN,tn_4096_201_4096,Gemm_Rocblas_1140853632,0.12724
GemmTunableOp_Half_TN,tn_27392_395_4096,Gemm_Rocblas_1140853649,1.43811
GemmTunableOp_Half_TN,tn_27392_201_4096,Gemm_Rocblas_1140853552,0.789646
GemmTunableOp_Half_TN,tn_4096_477_4096,Gemm_Rocblas_1140853548,0.233346
GemmTunableOp_Half_TN,tn_4096_200_4096,Gemm_Rocblas_1140853647,0.126304
GemmTunableOp_Half_TN,tn_4096_200_13696,Gemm_Rocblas_1140853515,0.404887
GemmTunableOp_Half_TN,tn_27392_68_4096,Gemm_Rocblas_1140853645,0.426471
GemmTunableOp_Half_TN,tn_4096_201_13696,Gemm_Rocblas_1140853515,0.397607
GemmTunableOp_Half_TN,tn_151552_28_4096,Gemm_Rocblas_1140853614,1.81325
GemmTunableOp_Half_TN,tn_27392_501_4096,Gemm_Rocblas_1140853649,1.69222
GemmTunableOp_Half_TN,tn_27392_198_4096,Gemm_Rocblas_1140853552,0.804677
GemmTunableOp_Half_TN,tn_4096_198_13696,Gemm_Rocblas_1140853515,0.40607
GemmTunableOp_Half_TN,tn_151552_198_4096,Gemm_Rocblas_1140853638,4.18961
GemmTunableOp_Half_TN,tn_4096_197_4096,Gemm_Rocblas_1140853646,0.122879
GemmTunableOp_Half_TN,tn_151552_89_4096,Gemm_Rocblas_1140853645,2.38437
GemmTunableOp_Half_TN,tn_4096_31_4096,Gemm_Rocblas_1140853612,0.0355112
GemmTunableOp_Half_TN,tn_27392_197_4096,Gemm_Rocblas_1140853552,0.78906
GemmTunableOp_Half_TN,tn_4096_197_13696,Gemm_Rocblas_1140853515,0.39959
GemmTunableOp_Half_TN,tn_4096_50_13696,Gemm_Rocblas_1140853594,0.19662
GemmTunableOp_Half_TN,tn_151552_197_4096,Gemm_Rocblas_1140853638,4.18296
GemmTunableOp_Half_TN,tn_4096_196_4096,Gemm_Rocblas_1140853647,0.125911
GemmTunableOp_Half_TN,tn_27392_303_4096,Gemm_Rocblas_1140853649,1.13768
GemmTunableOp_Half_TN,tn_4096_17_4096,Gemm_Rocblas_1140853598,0.0346472
GemmTunableOp_Half_TN,tn_4096_223_4096,Gemm_Rocblas_1140853646,0.129113
GemmTunableOp_Half_TN,tn_4096_196_13696,Gemm_Rocblas_1140853515,0.400246
GemmTunableOp_Half_TN,tn_4096_195_4096,Gemm_Rocblas_1140853632,0.124527
GemmTunableOp_Half_TN,tn_151552_127_4096,Gemm_Rocblas_1140853645,2.57569
GemmTunableOp_Half_TN,tn_27392_195_4096,Gemm_Rocblas_1140853583,0.793155
GemmTunableOp_Half_TN,tn_4096_195_13696,Gemm_Rocblas_1140853515,0.402917
GemmTunableOp_Half_TN,tn_151552_83_4096,Default,2.50591
GemmTunableOp_Half_TN,tn_27392_160_4096,Gemm_Rocblas_1140853628,0.639911
GemmTunableOp_Half_TN,tn_151552_193_4096,Gemm_Rocblas_1140853638,4.1629
GemmTunableOp_Half_TN,tn_4096_85_4096,Gemm_Rocblas_1140853533,0.0583108
GemmTunableOp_Half_TN,tn_27392_190_4096,Gemm_Rocblas_1140853646,0.677163
GemmTunableOp_Half_TN,tn_151552_190_4096,Gemm_Rocblas_1140853619,3.48522
GemmTunableOp_Half_TN,tn_27392_384_4096,Default,1.27801
GemmTunableOp_Half_TN,tn_4096_189_4096,Gemm_Rocblas_1140853530,0.0809512
GemmTunableOp_Half_TN,tn_151552_47_4096,Gemm_Rocblas_1140853637,1.83448
GemmTunableOp_Half_TN,tn_151552_189_4096,Gemm_Rocblas_1140853619,3.49346
GemmTunableOp_Half_TN,tn_4096_554_4096,Gemm_Rocblas_1140853648,0.270565
GemmTunableOp_Half_TN,tn_4096_187_13696,Gemm_Rocblas_1140853622,0.309341
GemmTunableOp_Half_TN,tn_151552_187_4096,Default,3.47855
GemmTunableOp_Half_TN,tn_4096_184_13696,Gemm_Rocblas_1140853620,0.308397
GemmTunableOp_Half_TN,tn_4096_168_13696,Gemm_Rocblas_1140853622,0.30758
GemmTunableOp_Half_TN,tn_27392_72_4096,Gemm_Rocblas_1140853628,0.424271
GemmTunableOp_Half_TN,tn_4096_580_4096,Gemm_Rocblas_1140853589,0.277902
GemmTunableOp_Half_TN,tn_151552_184_4096,Gemm_Rocblas_1140853619,3.47947
GemmTunableOp_Half_TN,tn_27392_94_4096,Gemm_Rocblas_1140853628,0.432599
GemmTunableOp_Half_TN,tn_4096_181_4096,Gemm_Rocblas_1140853647,0.0807432
GemmTunableOp_Half_TN,tn_4096_670_13696,Gemm_Rocblas_1140853576,0.812668
GemmTunableOp_Half_TN,tn_27392_181_4096,Gemm_Rocblas_1140853628,0.675433
GemmTunableOp_Half_TN,tn_4096_59_13696,Gemm_Rocblas_1140853594,0.197404
GemmTunableOp_Half_TN,tn_27392_92_4096,Gemm_Rocblas_1140853628,0.429007
GemmTunableOp_Half_TN,tn_4096_435_13696,Gemm_Rocblas_1140853557,0.702316
GemmTunableOp_Half_TN,tn_151552_181_4096,Gemm_Rocblas_1140853619,3.45376
GemmTunableOp_Half_TN,tn_4096_2048_4096,Default,0.876175
GemmTunableOp_Half_TN,tn_27392_123_4096,Gemm_Rocblas_1140853628,0.44864
GemmTunableOp_Half_TN,tn_27392_101_4096,Gemm_Rocblas_1140853628,0.433487
GemmTunableOp_Half_TN,tn_4096_90_13696,Gemm_Hipblaslt_TN_148168,0.216899
GemmTunableOp_Half_TN,tn_4096_179_4096,Gemm_Rocblas_1140853519,0.0822072
GemmTunableOp_Half_TN,tn_27392_179_4096,Gemm_Rocblas_1140853628,0.670833
GemmTunableOp_Half_TN,tn_4096_348_4096,Gemm_Rocblas_1140853587,0.140762
GemmTunableOp_Half_TN,tn_4096_179_13696,Gemm_Rocblas_1140853620,0.308765
GemmTunableOp_Half_TN,tn_4096_45_4096,Gemm_Rocblas_1140853647,0.044127
GemmTunableOp_Half_TN,tn_27392_349_4096,Default,1.11135
GemmTunableOp_Half_TN,tn_151552_179_4096,Gemm_Rocblas_1140853619,3.45584
GemmTunableOp_Half_TN,tn_27392_156_4096,Gemm_Rocblas_1140853628,0.633599
GemmTunableOp_Half_TN,tn_4096_109_13696,Gemm_Rocblas_1140853622,0.243091
GemmTunableOp_Half_TN,tn_4096_184_4096,Gemm_Rocblas_1140853519,0.0839912
GemmTunableOp_Half_TN,tn_151552_22_4096,Gemm_Rocblas_1140853614,1.79858
GemmTunableOp_Half_TN,tn_4096_174_4096,Gemm_Rocblas_1140853519,0.082583
GemmTunableOp_Half_TN,tn_151552_174_4096,Gemm_Rocblas_1140853619,3.40112
GemmTunableOp_Half_TN,tn_27392_173_4096,Gemm_Rocblas_1140853628,0.661328
GemmTunableOp_Half_TN,tn_27392_327_4096,Default,1.11119
GemmTunableOp_Half_TN,tn_4096_173_13696,Gemm_Rocblas_1140853622,0.307652
GemmTunableOp_Half_TN,tn_151552_173_4096,Gemm_Rocblas_1140853619,3.38539
GemmTunableOp_Half_TN,tn_4096_362_13696,Gemm_Rocblas_1140853550,0.49761
GemmTunableOp_Half_TN,tn_4096_171_4096,Gemm_Rocblas_1140853528,0.081271
GemmTunableOp_Half_TN,tn_27392_171_4096,Gemm_Rocblas_1140853629,0.664472
GemmTunableOp_Half_TN,tn_151552_171_4096,Gemm_Rocblas_1140853619,3.38463
GemmTunableOp_Half_TN,tn_4096_168_4096,Gemm_Rocblas_1140853649,0.082063
GemmTunableOp_Half_TN,tn_151552_168_4096,Gemm_Rocblas_1140853619,3.37156
GemmTunableOp_Half_TN,tn_4096_165_4096,Gemm_Rocblas_1140853652,0.081071
GemmTunableOp_Half_TN,tn_27392_59_4096,Gemm_Rocblas_1140853648,0.347736
GemmTunableOp_Half_TN,tn_151552_157_4096,Gemm_Hipblaslt_TN_148174,3.63588
GemmTunableOp_Half_TN,tn_27392_233_4096,Gemm_Rocblas_1140853583,0.830636
GemmTunableOp_Half_TN,tn_4096_163_4096,Gemm_Rocblas_1140853519,0.081903
GemmTunableOp_Half_TN,tn_151552_150_4096,Gemm_Hipblaslt_TN_148174,3.65068
GemmTunableOp_Half_TN,tn_4096_134_4096,Gemm_Rocblas_1140853630,0.0836384
GemmTunableOp_Half_TN,tn_27392_219_4096,Gemm_Rocblas_1140853583,0.816543
GemmTunableOp_Half_TN,tn_27392_163_4096,Gemm_Rocblas_1140853645,0.643704
GemmTunableOp_Half_TN,tn_4096_413_13696,Gemm_Rocblas_1140853557,0.64486
GemmTunableOp_Half_TN,tn_4096_161_13696,Gemm_Rocblas_1140853622,0.305276
GemmTunableOp_Half_TN,tn_151552_100_4096,Gemm_Rocblas_1140853645,2.41997
GemmTunableOp_Half_TN,tn_4096_160_4096,Gemm_Rocblas_1140853645,0.0808468
GemmTunableOp_Half_TN,tn_4096_114_4096,Gemm_Rocblas_1140853651,0.0600628
GemmTunableOp_Half_TN,tn_4096_476_13696,Gemm_Rocblas_1140853557,0.691838
GemmTunableOp_Half_TN,tn_27392_331_4096,Default,1.12765
GemmTunableOp_Half_TN,tn_151552_109_4096,Gemm_Rocblas_1140853645,2.41582
GemmTunableOp_Half_TN,tn_27392_69_4096,Gemm_Rocblas_1140853645,0.425743
GemmTunableOp_Half_TN,tn_27392_346_4096,Default,1.11268
GemmTunableOp_Half_TN,tn_27392_85_4096,Gemm_Rocblas_1140853628,0.432767
GemmTunableOp_Half_TN,tn_151552_87_4096,Gemm_Rocblas_1140853645,2.38787
GemmTunableOp_Half_TN,tn_4096_160_13696,Gemm_Rocblas_1140853520,0.303916
GemmTunableOp_Half_TN,tn_4096_159_4096,Gemm_Rocblas_1140853519,0.080975
GemmTunableOp_Half_TN,tn_27392_159_4096,Gemm_Rocblas_1140853628,0.636247
GemmTunableOp_Half_TN,tn_4096_159_13696,Gemm_Rocblas_1140853515,0.306844
GemmTunableOp_Half_TN,tn_4096_211_4096,Gemm_Rocblas_1140853646,0.126081
GemmTunableOp_Half_TN,tn_4096_59_4096,Gemm_Rocblas_1140853651,0.0441752
GemmTunableOp_Half_TN,tn_27392_387_4096,Gemm_Rocblas_1140853649,1.42573
GemmTunableOp_Half_TN,tn_4096_156_4096,Gemm_Rocblas_1140853630,0.0817268
GemmTunableOp_Half_TN,tn_4096_138_13696,Gemm_Rocblas_1140853520,0.297627
GemmTunableOp_Half_TN,tn_151552_2_4096,Gemm_Rocblas_1140853603,1.74483
GemmTunableOp_Half_TN,tn_27392_153_4096,Gemm_Rocblas_1140853628,0.634783
GemmTunableOp_Half_TN,tn_4096_189_13696,Gemm_Rocblas_1140853622,0.308917
GemmTunableOp_Half_TN,tn_4096_153_13696,Gemm_Rocblas_1140853515,0.306907
GemmTunableOp_Half_TN,tn_27392_323_4096,Default,1.13478
GemmTunableOp_Half_TN,tn_27392_152_4096,Gemm_Rocblas_1140853628,0.637142
GemmTunableOp_Half_TN,tn_4096_152_13696,Gemm_Rocblas_1140853520,0.301963
GemmTunableOp_Half_TN,tn_4096_30_13696,Gemm_Hipblaslt_TN_148180,0.182828
GemmTunableOp_Half_TN,tn_151552_110_4096,Gemm_Rocblas_1140853645,2.57359
GemmTunableOp_Half_TN,tn_4096_148_13696,Gemm_Rocblas_1140853520,0.299027
GemmTunableOp_Half_TN,tn_27392_537_4096,Default,1.77806
GemmTunableOp_Half_TN,tn_4096_103_4096,Gemm_Rocblas_1140853634,0.0568868
GemmTunableOp_Half_TN,tn_4096_120_4096,Gemm_Rocblas_1140853629,0.0626644
GemmTunableOp_Half_TN,tn_4096_337_13696,Gemm_Rocblas_1140853550,0.503736
GemmTunableOp_Half_TN,tn_4096_240_13696,Gemm_Rocblas_1140853631,0.38527
GemmTunableOp_Half_TN,tn_4096_146_4096,Gemm_Rocblas_1140853636,0.0702548
GemmTunableOp_Half_TN,tn_27392_144_4096,Gemm_Rocblas_1140853628,0.633502
GemmTunableOp_Half_TN,tn_27392_448_4096,Default,1.58714
GemmTunableOp_Half_TN,tn_4096_144_13696,Gemm_Rocblas_1140853520,0.306243
GemmTunableOp_Half_TN,tn_4096_8_4096,Gemm_Rocblas_1140853611,0.0338712
GemmTunableOp_Half_TN,tn_151552_144_4096,Gemm_Hipblaslt_TN_148174,3.63985
GemmTunableOp_Half_TN,tn_27392_141_4096,Gemm_Rocblas_1140853646,0.572711
GemmTunableOp_Half_TN,tn_4096_47_13696,Gemm_Rocblas_1140853594,0.197476
GemmTunableOp_Half_TN,tn_4096_140_13696,Gemm_Rocblas_1140853520,0.290955
GemmTunableOp_Half_TN,tn_4096_138_4096,Gemm_Rocblas_1140853519,0.0819266
GemmTunableOp_Half_TN,tn_27392_497_4096,Gemm_Rocblas_1140853649,1.68706
GemmTunableOp_Half_TN,tn_151552_138_4096,Gemm_Rocblas_1140853619,3.63982
GemmTunableOp_Half_TN,tn_4096_304_4096,Gemm_Rocblas_1140853587,0.137003
GemmTunableOp_Half_TN,tn_27392_137_4096,Gemm_Rocblas_1140853646,0.586718
GemmTunableOp_Half_TN,tn_4096_137_13696,Gemm_Rocblas_1140853515,0.304091
GemmTunableOp_Half_TN,tn_151552_137_4096,Gemm_Hipblaslt_TN_148174,3.59945
GemmTunableOp_Half_TN,tn_151552_130_4096,Gemm_Rocblas_1140853619,3.55636
GemmTunableOp_Half_TN,tn_4096_136_4096,Gemm_Rocblas_1140853519,0.0832466
GemmTunableOp_Half_TN,tn_4096_136_13696,Gemm_Rocblas_1140853520,0.297459
GemmTunableOp_Half_TN,tn_27392_76_4096,Gemm_Rocblas_1140853628,0.425223
GemmTunableOp_Half_TN,tn_4096_554_13696,Gemm_Rocblas_1140853545,0.830784
GemmTunableOp_Half_TN,tn_151552_136_4096,Gemm_Rocblas_1140853619,3.62947
GemmTunableOp_Half_TN,tn_4096_36_4096,Gemm_Rocblas_1140853632,0.044439
GemmTunableOp_Half_TN,tn_151552_134_4096,Gemm_Rocblas_1140853619,3.59413
GemmTunableOp_Half_TN,tn_27392_365_4096,Default,1.14042
GemmTunableOp_Half_TN,tn_27392_133_4096,Gemm_Rocblas_1140853646,0.581398
GemmTunableOp_Half_TN,tn_4096_133_13696,Gemm_Rocblas_1140853520,0.296131
GemmTunableOp_Half_TN,tn_27392_132_4096,Gemm_Rocblas_1140853646,0.581942
GemmTunableOp_Half_TN,tn_27392_130_4096,Gemm_Rocblas_1140853628,0.585477
GemmTunableOp_Half_TN,tn_4096_410_13696,Gemm_Rocblas_1140853557,0.647195
GemmTunableOp_Half_TN,tn_4096_34_13696,Gemm_Rocblas_1140853594,0.1939
GemmTunableOp_Half_TN,tn_4096_126_13696,Gemm_Rocblas_1140853623,0.246507
GemmTunableOp_Half_TN,tn_151552_126_4096,Gemm_Rocblas_1140853645,2.52924
GemmTunableOp_Half_TN,tn_27392_333_4096,Default,1.10727
GemmTunableOp_Half_TN,tn_4096_123_13696,Gemm_Rocblas_1140853631,0.246675
GemmTunableOp_Half_TN,tn_4096_121_4096,Gemm_Rocblas_1140853649,0.056743
GemmTunableOp_Half_TN,tn_4096_121_13696,Gemm_Rocblas_1140853623,0.244284
GemmTunableOp_Half_TN,tn_27392_119_4096,Gemm_Rocblas_1140853628,0.447832
GemmTunableOp_Half_TN,tn_151552_135_4096,Gemm_Rocblas_1140853619,3.62204
GemmTunableOp_Half_TN,tn_27392_51_4096,Gemm_Rocblas_1140853628,0.346856
GemmTunableOp_Half_TN,tn_4096_119_13696,Gemm_Rocblas_1140853646,0.242323
GemmTunableOp_Half_TN,tn_4096_118_4096,Gemm_Rocblas_1140853530,0.0673588
GemmTunableOp_Half_TN,tn_27392_118_4096,Gemm_Rocblas_1140853628,0.452743
GemmTunableOp_Half_TN,tn_27392_358_4096,Default,1.12433
GemmTunableOp_Half_TN,tn_151552_118_4096,Gemm_Rocblas_1140853645,2.50096
GemmTunableOp_Half_TN,tn_4096_116_13696,Gemm_Rocblas_1140853622,0.246579
GemmTunableOp_Half_TN,tn_27392_114_4096,Gemm_Rocblas_1140853645,0.445599
GemmTunableOp_Half_TN,tn_27392_495_4096,Gemm_Rocblas_1140853649,1.66336
GemmTunableOp_Half_TN,tn_27392_308_4096,Gemm_Rocblas_1140853649,1.02902
GemmTunableOp_Half_TN,tn_4096_114_13696,Gemm_Rocblas_1140853622,0.244291
GemmTunableOp_Half_TN,tn_27392_111_4096,Gemm_Rocblas_1140853628,0.440351
GemmTunableOp_Half_TN,tn_4096_111_13696,Gemm_Rocblas_1140853622,0.243883
GemmTunableOp_Half_TN,tn_27392_81_4096,Gemm_Rocblas_1140853645,0.430663
GemmTunableOp_Half_TN,tn_151552_201_4096,Gemm_Rocblas_1140853638,4.19121
GemmTunableOp_Half_TN,tn_151552_111_4096,Gemm_Rocblas_1140853645,2.44544
GemmTunableOp_Half_TN,tn_4096_1_4096,Gemm_Rocblas_1140853617,0.0325992
GemmTunableOp_Half_TN,tn_4096_105_4096,Gemm_Rocblas_1140853648,0.0560948
GemmTunableOp_Half_TN,tn_27392_105_4096,Gemm_Rocblas_1140853628,0.437751
GemmTunableOp_Half_TN,tn_27392_49_4096,Gemm_Rocblas_1140853648,0.346032
GemmTunableOp_Half_TN,tn_151552_105_4096,Gemm_Rocblas_1140853645,2.43963
GemmTunableOp_Half_TN,tn_27392_6_4096,Gemm_Rocblas_1140853614,0.330616
GemmTunableOp_Half_TN,tn_4096_19_4096,Gemm_Rocblas_1140853612,0.0351752
GemmTunableOp_Half_TN,tn_4096_116_4096,Gemm_Rocblas_1140853534,0.0651508
GemmTunableOp_Half_TN,tn_4096_102_4096,Gemm_Rocblas_1140853520,0.0645666
GemmTunableOp_Half_TN,tn_151552_65_4096,Default,2.26481
GemmTunableOp_Half_TN,tn_27392_102_4096,Gemm_Rocblas_1140853628,0.435559
GemmTunableOp_Half_TN,tn_4096_102_13696,Gemm_Rocblas_1140853622,0.242835
GemmTunableOp_Half_TN,tn_151552_102_4096,Gemm_Rocblas_1140853645,2.4398
GemmTunableOp_Half_TN,tn_27392_546_4096,Default,1.81497
GemmTunableOp_Half_TN,tn_4096_101_4096,Gemm_Rocblas_1140853520,0.0647828
GemmTunableOp_Half_TN,tn_27392_291_4096,Gemm_Rocblas_1140853646,1.1036
GemmTunableOp_Half_TN,tn_151552_33_4096,Gemm_Rocblas_1140853645,1.83176
GemmTunableOp_Half_TN,tn_4096_100_4096,Gemm_Rocblas_1140853649,0.0633588
GemmTunableOp_Half_TN,tn_27392_26_4096,Gemm_Rocblas_1140853599,0.335728
GemmTunableOp_Half_TN,tn_4096_356_13696,Gemm_Rocblas_1140853550,0.476312
GemmTunableOp_Half_TN,tn_27392_100_4096,Gemm_Rocblas_1140853628,0.427967
GemmTunableOp_Half_TN,tn_4096_100_13696,Gemm_Rocblas_1140853622,0.241571
GemmTunableOp_Half_TN,tn_4096_522_13696,Gemm_Rocblas_1140853545,0.841758
GemmTunableOp_Half_TN,tn_4096_98_4096,Gemm_Rocblas_1140853629,0.0600226
GemmTunableOp_Half_TN,tn_27392_103_4096,Gemm_Rocblas_1140853628,0.435959
GemmTunableOp_Half_TN,tn_4096_66_13696,Gemm_Hipblaslt_TN_148168,0.211051
GemmTunableOp_Half_TN,tn_27392_42_4096,Gemm_Rocblas_1140853648,0.344528
GemmTunableOp_Half_TN,tn_4096_96_13696,Gemm_Hipblaslt_TN_148168,0.225029
GemmTunableOp_Half_TN,tn_4096_95_4096,Gemm_Rocblas_1140853630,0.0638546
GemmTunableOp_Half_TN,tn_27392_95_4096,Gemm_Rocblas_1140853645,0.432935
GemmTunableOp_Half_TN,tn_151552_36_4096,Gemm_Rocblas_1140853645,1.8336
GemmTunableOp_Half_TN,tn_151552_67_4096,Default,2.35529
GemmTunableOp_Half_TN,tn_27392_104_4096,Gemm_Rocblas_1140853628,0.440423
GemmTunableOp_Half_TN,tn_4096_95_13696,Gemm_Hipblaslt_TN_148168,0.223595
GemmTunableOp_Half_TN,tn_4096_94_13696,Gemm_Hipblaslt_TN_148168,0.216748
GemmTunableOp_Half_TN,tn_4096_92_4096,Gemm_Rocblas_1140853629,0.055335
GemmTunableOp_Half_TN,tn_27392_90_4096,Gemm_Rocblas_1140853628,0.430711
GemmTunableOp_Half_TN,tn_4096_89_4096,Gemm_Rocblas_1140853630,0.0593508
GemmTunableOp_Half_TN,tn_4096_87_13696,Gemm_Hipblaslt_TN_148168,0.212419
GemmTunableOp_Half_TN,tn_4096_343_4096,Gemm_Rocblas_1140853587,0.139402
GemmTunableOp_Half_TN,tn_151552_85_4096,Gemm_Rocblas_1140853645,2.39294
GemmTunableOp_Half_TN,tn_4096_358_4096,Gemm_Rocblas_1140853587,0.142762
GemmTunableOp_Half_TN,tn_4096_84_13696,Gemm_Hipblaslt_TN_148168,0.21406
GemmTunableOp_Half_TN,tn_151552_162_4096,Gemm_Rocblas_1140853619,3.66596
GemmTunableOp_Half_TN,tn_4096_488_4096,Gemm_Rocblas_1140853587,0.234577
GemmTunableOp_Half_TN,tn_27392_373_4096,Gemm_Rocblas_1140853583,1.20184
GemmTunableOp_Half_TN,tn_151552_45_4096,Gemm_Rocblas_1140853653,1.83078
GemmTunableOp_Half_TN,tn_151552_232_4096,Gemm_Rocblas_1140853638,4.35106
GemmTunableOp_Half_TN,tn_4096_81_4096,Gemm_Rocblas_1140853648,0.0555748
GemmTunableOp_Half_TN,tn_27392_184_4096,Gemm_Rocblas_1140853645,0.680114
GemmTunableOp_Half_TN,tn_4096_165_13696,Gemm_Rocblas_1140853520,0.297308
GemmTunableOp_Half_TN,tn_4096_76_4096,Gemm_Rocblas_1140853649,0.0550788
GemmTunableOp_Half_TN,tn_4096_76_13696,Gemm_Hipblaslt_TN_148168,0.215167
GemmTunableOp_Half_TN,tn_4096_19_13696,Gemm_Hipblaslt_TN_148112,0.18078
GemmTunableOp_Half_TN,tn_151552_76_4096,Gemm_Rocblas_1140853645,2.35149
GemmTunableOp_Half_TN,tn_4096_75_4096,Gemm_Rocblas_1140853633,0.0652306
GemmTunableOp_Half_TN,tn_4096_49_4096,Gemm_Rocblas_1140853646,0.045351
GemmTunableOp_Half_TN,tn_151552_114_4096,Gemm_Rocblas_1140853645,2.46443
GemmTunableOp_Half_TN,tn_4096_75_13696,Gemm_Hipblaslt_TN_148168,0.213163
GemmTunableOp_Half_TN,tn_4096_73_4096,Gemm_Rocblas_1140853520,0.0625428
GemmTunableOp_Half_TN,tn_151552_73_4096,Gemm_Rocblas_1140853645,2.35598
GemmTunableOp_Half_TN,tn_4096_72_4096,Gemm_Rocblas_1140853649,0.0616226
GemmTunableOp_Half_TN,tn_4096_298_4096,Gemm_Rocblas_1140853557,0.137298
GemmTunableOp_Half_TN,tn_4096_72_13696,Gemm_Hipblaslt_TN_148168,0.211635
GemmTunableOp_Half_TN,tn_4096_228_4096,Gemm_Rocblas_1140853632,0.127258
GemmTunableOp_Half_TN,tn_4096_70_4096,Gemm_Rocblas_1140853636,0.0602066
GemmTunableOp_Half_TN,tn_27392_70_4096,Gemm_Rocblas_1140853645,0.429207
GemmTunableOp_Half_TN,tn_4096_494_13696,Gemm_Rocblas_1140853578,0.696323
GemmAndBiasTunableOp_Half_TN,tn_4608_511_4096,Gemm_Hipblaslt_TN_148168,0.308794
GemmAndBiasTunableOp_Half_TN,tn_4608_423_4096,Gemm_Hipblaslt_TN_148169,0.271606
GemmAndBiasTunableOp_Half_TN,tn_4608_529_4096,Gemm_Hipblaslt_TN_148168,0.305046
GemmAndBiasTunableOp_Half_TN,tn_4608_454_4096,Gemm_Hipblaslt_TN_148169,0.277686
GemmAndBiasTunableOp_Half_TN,tn_4608_291_4096,Gemm_Hipblaslt_TN_148174,0.190939
GemmAndBiasTunableOp_Half_TN,tn_4608_427_4096,Gemm_Hipblaslt_TN_148169,0.261792
GemmAndBiasTunableOp_Half_TN,tn_4608_465_4096,Gemm_Hipblaslt_TN_148169,0.26201
GemmAndBiasTunableOp_Half_TN,tn_4608_609_4096,Gemm_Hipblaslt_TN_148169,0.38895
GemmAndBiasTunableOp_Half_TN,tn_4608_300_4096,Gemm_Hipblaslt_TN_148174,0.183205
GemmAndBiasTunableOp_Half_TN,tn_4608_441_4096,Gemm_Hipblaslt_TN_148169,0.261466
GemmAndBiasTunableOp_Half_TN,tn_4608_548_4096,Gemm_Hipblaslt_TN_148168,0.3139
GemmAndBiasTunableOp_Half_TN,tn_4608_514_4096,Gemm_Hipblaslt_TN_148168,0.308616
GemmAndBiasTunableOp_Half_TN,tn_4608_294_4096,Gemm_Hipblaslt_TN_148174,0.193833
GemmAndBiasTunableOp_Half_TN,tn_4608_483_4096,Gemm_Hipblaslt_TN_148168,0.288578
GemmAndBiasTunableOp_Half_TN,tn_4608_524_4096,Gemm_Hipblaslt_TN_148168,0.317918
GemmAndBiasTunableOp_Half_TN,tn_4608_464_4096,Gemm_Hipblaslt_TN_148169,0.2862
GemmAndBiasTunableOp_Half_TN,tn_4608_373_4096,Gemm_Hipblaslt_TN_148165,0.199403
GemmAndBiasTunableOp_Half_TN,tn_4608_531_4096,Gemm_Hipblaslt_TN_148168,0.319128
GemmAndBiasTunableOp_Half_TN,tn_4608_495_4096,Gemm_Hipblaslt_TN_148168,0.312288
GemmAndBiasTunableOp_Half_TN,tn_4608_435_4096,Gemm_Hipblaslt_TN_148169,0.278538
GemmAndBiasTunableOp_Half_TN,tn_4608_570_4096,Gemm_Hipblaslt_TN_148168,0.30723
GemmAndBiasTunableOp_Half_TN,tn_4608_342_4096,Gemm_Hipblaslt_TN_148165,0.201215
GemmAndBiasTunableOp_Half_TN,tn_4608_492_4096,Gemm_Hipblaslt_TN_148168,0.317084
GemmAndBiasTunableOp_Half_TN,tn_4608_390_4096,Gemm_Hipblaslt_TN_148169,0.271988
GemmAndBiasTunableOp_Half_TN,tn_4608_561_4096,Gemm_Hipblaslt_TN_148168,0.322608
GemmAndBiasTunableOp_Half_TN,tn_4608_434_4096,Gemm_Hipblaslt_TN_148169,0.275294
GemmAndBiasTunableOp_Half_TN,tn_4608_503_4096,Gemm_Hipblaslt_TN_148168,0.3082
GemmAndBiasTunableOp_Half_TN,tn_4608_412_4096,Gemm_Hipblaslt_TN_148169,0.274526
GemmAndBiasTunableOp_Half_TN,tn_4608_459_4096,Gemm_Hipblaslt_TN_148169,0.283772
GemmAndBiasTunableOp_Half_TN,tn_4608_379_4096,Gemm_Hipblaslt_TN_148165,0.208309
GemmAndBiasTunableOp_Half_TN,tn_4608_2714_4096,Default,1.46533
GemmAndBiasTunableOp_Half_TN,tn_4608_32_4096,Gemm_Hipblaslt_TN_148137,0.0571584
GemmAndBiasTunableOp_Half_TN,tn_4608_40_4096,Gemm_Hipblaslt_TN_148169,0.0730926
GemmAndBiasTunableOp_Half_TN,tn_4608_48_4096,Gemm_Hipblaslt_TN_148169,0.0734444
GemmAndBiasTunableOp_Half_TN,tn_4608_56_4096,Gemm_Hipblaslt_TN_148169,0.0736124
GemmAndBiasTunableOp_Half_TN,tn_4608_80_4096,Gemm_Hipblaslt_TN_148169,0.0709766
GemmAndBiasTunableOp_Half_TN,tn_4608_88_4096,Gemm_Hipblaslt_TN_148169,0.0714384
GemmAndBiasTunableOp_Half_TN,tn_4608_120_4096,Gemm_Hipblaslt_TN_148165,0.113003
GemmAndBiasTunableOp_Half_TN,tn_4608_176_4096,Gemm_Hipblaslt_TN_148168,0.114865
GemmAndBiasTunableOp_Half_TN,tn_4608_208_4096,Gemm_Hipblaslt_TN_148165,0.150795
GemmAndBiasTunableOp_Half_TN,tn_4608_16384_4096,Default,7.42267
GemmAndBiasTunableOp_Half_TN,tn_4608_136_4096,Gemm_Hipblaslt_TN_148175,0.11333
GemmAndBiasTunableOp_Half_TN,tn_4608_137_4096,Gemm_Hipblaslt_TN_148165,0.11507
GemmAndBiasTunableOp_Half_TN,tn_4608_146_4096,Gemm_Hipblaslt_TN_148175,0.115822
GemmAndBiasTunableOp_Half_TN,tn_4608_446_4096,Gemm_Hipblaslt_TN_148169,0.270788
GemmAndBiasTunableOp_Half_TN,tn_4608_150_4096,Gemm_Hipblaslt_TN_148175,0.116358
GemmAndBiasTunableOp_Half_TN,tn_4608_156_4096,Gemm_Hipblaslt_TN_148168,0.118134
GemmAndBiasTunableOp_Half_TN,tn_4608_2048_4096,Default,1.01058
GemmAndBiasTunableOp_Half_TN,tn_4608_165_4096,Gemm_Hipblaslt_TN_148168,0.117287
GemmAndBiasTunableOp_Half_TN,tn_4608_24_4096,Gemm_Hipblaslt_TN_148139,0.0522048
GemmAndBiasTunableOp_Half_TN,tn_4608_159_4096,Gemm_Hipblaslt_TN_148168,0.111006
GemmAndBiasTunableOp_Half_TN,tn_4608_161_4096,Gemm_Hipblaslt_TN_148168,0.110126
GemmAndBiasTunableOp_Half_TN,tn_4608_163_4096,Gemm_Hipblaslt_TN_148168,0.110831
GemmAndBiasTunableOp_Half_TN,tn_4608_473_4096,Gemm_Hipblaslt_TN_148169,0.268824
GemmAndBiasTunableOp_Half_TN,tn_4608_173_4096,Gemm_Hipblaslt_TN_148168,0.118095
GemmAndBiasTunableOp_Half_TN,tn_4608_428_4096,Gemm_Hipblaslt_TN_148169,0.280698
GemmAndBiasTunableOp_Half_TN,tn_4608_184_4096,Gemm_Hipblaslt_TN_148168,0.120909
GemmAndBiasTunableOp_Half_TN,tn_4608_141_4096,Gemm_Hipblaslt_TN_148168,0.116086
GemmAndBiasTunableOp_Half_TN,tn_4608_193_4096,Gemm_Hipblaslt_TN_148165,0.159767
GemmAndBiasTunableOp_Half_TN,tn_4608_380_4096,Default,0.190721
GemmAndBiasTunableOp_Half_TN,tn_4608_50_4096,Gemm_Hipblaslt_TN_148137,0.0726224
GemmAndBiasTunableOp_Half_TN,tn_4608_195_4096,Gemm_Hipblaslt_TN_148165,0.156799
GemmAndBiasTunableOp_Half_TN,tn_4608_314_4096,Default,0.194579
GemmAndBiasTunableOp_Half_TN,tn_4608_168_4096,Gemm_Hipblaslt_TN_148168,0.115713
GemmAndBiasTunableOp_Half_TN,tn_4608_536_4096,Gemm_Hipblaslt_TN_148168,0.319828
GemmAndBiasTunableOp_Half_TN,tn_4608_198_4096,Gemm_Hipblaslt_TN_148165,0.156367
GemmAndBiasTunableOp_Half_TN,tn_4608_201_4096,Gemm_Hipblaslt_TN_148165,0.158472
GemmAndBiasTunableOp_Half_TN,tn_4608_203_4096,Gemm_Hipblaslt_TN_148165,0.157976
GemmAndBiasTunableOp_Half_TN,tn_4608_565_4096,Gemm_Hipblaslt_TN_148168,0.30209
GemmAndBiasTunableOp_Half_TN,tn_4608_105_4096,Gemm_Hipblaslt_TN_148169,0.11003
GemmAndBiasTunableOp_Half_TN,tn_4608_205_4096,Gemm_Hipblaslt_TN_148165,0.161128
GemmAndBiasTunableOp_Half_TN,tn_4608_216_4096,Gemm_Hipblaslt_TN_148165,0.158281
GemmAndBiasTunableOp_Half_TN,tn_4608_232_4096,Gemm_Hipblaslt_TN_148165,0.16453
GemmAndBiasTunableOp_Half_TN,tn_4608_207_4096,Gemm_Hipblaslt_TN_148165,0.161824
GemmAndBiasTunableOp_Half_TN,tn_4608_420_4096,Gemm_Hipblaslt_TN_148169,0.269388
GemmAndBiasTunableOp_Half_TN,tn_4608_547_4096,Gemm_Hipblaslt_TN_148168,0.308618
GemmAndBiasTunableOp_Half_TN,tn_4608_219_4096,Gemm_Hipblaslt_TN_148165,0.157793
GemmAndBiasTunableOp_Half_TN,tn_4608_227_4096,Gemm_Hipblaslt_TN_148165,0.159674
GemmAndBiasTunableOp_Half_TN,tn_4608_228_4096,Gemm_Hipblaslt_TN_148165,0.159682
GemmAndBiasTunableOp_Half_TN,tn_4608_497_4096,Gemm_Hipblaslt_TN_148168,0.293806
GemmAndBiasTunableOp_Half_TN,tn_4608_236_4096,Gemm_Hipblaslt_TN_148165,0.160258
GemmAndBiasTunableOp_Half_TN,tn_4608_237_4096,Gemm_Hipblaslt_TN_148165,0.161474
GemmAndBiasTunableOp_Half_TN,tn_4608_144_4096,Gemm_Hipblaslt_TN_148168,0.11659
GemmAndBiasTunableOp_Half_TN,tn_4608_9_4096,Gemm_Hipblaslt_TN_148139,0.0525268
GemmAndBiasTunableOp_Half_TN,tn_4608_241_4096,Gemm_Hipblaslt_TN_148169,0.160106
GemmAndBiasTunableOp_Half_TN,tn_4608_239_4096,Gemm_Hipblaslt_TN_148165,0.165482
GemmAndBiasTunableOp_Half_TN,tn_4608_248_4096,Gemm_Hipblaslt_TN_148165,0.15385
GemmAndBiasTunableOp_Half_TN,tn_4608_442_4096,Gemm_Hipblaslt_TN_148169,0.27463
GemmAndBiasTunableOp_Half_TN,tn_4608_250_4096,Gemm_Hipblaslt_TN_148165,0.15237
GemmAndBiasTunableOp_Half_TN,tn_4608_253_4096,Gemm_Hipblaslt_TN_148165,0.15377
GemmAndBiasTunableOp_Half_TN,tn_4608_409_4096,Gemm_Hipblaslt_TN_148169,0.26812
GemmAndBiasTunableOp_Half_TN,tn_4608_360_4096,Default,0.197595
GemmAndBiasTunableOp_Half_TN,tn_4608_211_4096,Gemm_Hipblaslt_TN_148165,0.159505
GemmAndBiasTunableOp_Half_TN,tn_4608_544_4096,Gemm_Hipblaslt_TN_148168,0.285164
GemmAndBiasTunableOp_Half_TN,tn_4608_463_4096,Gemm_Hipblaslt_TN_148169,0.261396
GemmAndBiasTunableOp_Half_TN,tn_4608_90_4096,Gemm_Hipblaslt_TN_148169,0.0717506
GemmAndBiasTunableOp_Half_TN,tn_4608_493_4096,Gemm_Hipblaslt_TN_148168,0.303092
GemmAndBiasTunableOp_Half_TN,tn_4608_320_4096,Gemm_Hipblaslt_TN_148174,0.18722
GemmAndBiasTunableOp_Half_TN,tn_4608_487_4096,Gemm_Hipblaslt_TN_148168,0.287252
GemmAndBiasTunableOp_Half_TN,tn_4608_311_4096,Default,0.190068
GemmAndBiasTunableOp_Half_TN,tn_4608_421_4096,Gemm_Hipblaslt_TN_148169,0.268828
GemmAndBiasTunableOp_Half_TN,tn_4608_587_4096,Gemm_Hipblaslt_TN_148169,0.369226
GemmAndBiasTunableOp_Half_TN,tn_4608_65_4096,Gemm_Hipblaslt_TN_148168,0.0803084
GemmAndBiasTunableOp_Half_TN,tn_4608_519_4096,Gemm_Hipblaslt_TN_148168,0.304413
GemmAndBiasTunableOp_Half_TN,tn_4608_347_4096,Default,0.192376
GemmAndBiasTunableOp_Half_TN,tn_4608_297_4096,Default,0.191377
GemmAndBiasTunableOp_Half_TN,tn_4608_452_4096,Gemm_Hipblaslt_TN_148169,0.270404
GemmAndBiasTunableOp_Half_TN,tn_4608_196_4096,Gemm_Hipblaslt_TN_148165,0.158711
GemmAndBiasTunableOp_Half_TN,tn_4608_114_4096,Gemm_Hipblaslt_TN_148169,0.111806
GemmAndBiasTunableOp_Half_TN,tn_4608_608_4096,Gemm_Hipblaslt_TN_148169,0.361737
GemmAndBiasTunableOp_Half_TN,tn_4608_126_4096,Gemm_Hipblaslt_TN_148168,0.107064
GemmAndBiasTunableOp_Half_TN,tn_4608_160_4096,Gemm_Hipblaslt_TN_148175,0.109775
GemmAndBiasTunableOp_Half_TN,tn_4608_353_4096,Gemm_Hipblaslt_TN_148165,0.197047
GemmAndBiasTunableOp_Half_TN,tn_4608_500_4096,Gemm_Hipblaslt_TN_148168,0.302245
GemmAndBiasTunableOp_Half_TN,tn_4608_513_4096,Gemm_Hipblaslt_TN_148168,0.287918
GemmAndBiasTunableOp_Half_TN,tn_4608_190_4096,Gemm_Hipblaslt_TN_148168,0.121209
GemmAndBiasTunableOp_Half_TN,tn_4608_505_4096,Gemm_Hipblaslt_TN_148168,0.289064
GemmAndBiasTunableOp_Half_TN,tn_4608_391_4096,Gemm_Hipblaslt_TN_148169,0.26718
GemmAndBiasTunableOp_Half_TN,tn_4608_408_4096,Gemm_Hipblaslt_TN_148169,0.2662
GemmAndBiasTunableOp_Half_TN,tn_4608_371_4096,Default,0.191972
GemmAndBiasTunableOp_Half_TN,tn_4608_240_4096,Gemm_Hipblaslt_TN_148165,0.159946
GemmAndBiasTunableOp_Half_TN,tn_4608_437_4096,Gemm_Hipblaslt_TN_148169,0.261572
GemmAndBiasTunableOp_Half_TN,tn_4608_39_4096,Gemm_Hipblaslt_TN_148169,0.0679646
GemmAndBiasTunableOp_Half_TN,tn_4608_455_4096,Gemm_Hipblaslt_TN_148169,0.28084
GemmAndBiasTunableOp_Half_TN,tn_4608_361_4096,Default,0.190451
GemmAndBiasTunableOp_Half_TN,tn_4608_256_4096,Gemm_Hipblaslt_TN_148165,0.164952
GemmAndBiasTunableOp_Half_TN,tn_4608_359_4096,Default,0.191243
GemmAndBiasTunableOp_Half_TN,tn_4608_118_4096,Gemm_Hipblaslt_TN_148169,0.112278
GemmAndBiasTunableOp_Half_TN,tn_4608_447_4096,Gemm_Hipblaslt_TN_148169,0.270112
GemmAndBiasTunableOp_Half_TN,tn_4608_466_4096,Gemm_Hipblaslt_TN_148169,0.25925
GemmAndBiasTunableOp_Half_TN,tn_4608_494_4096,Gemm_Hipblaslt_TN_148168,0.294921
GemmAndBiasTunableOp_Half_TN,tn_4608_47_4096,Gemm_Hipblaslt_TN_148169,0.0708524
GemmAndBiasTunableOp_Half_TN,tn_4608_38_4096,Gemm_Hipblaslt_TN_148169,0.0703004
GemmAndBiasTunableOp_Half_TN,tn_4608_593_4096,Default,0.368351
GemmAndBiasTunableOp_Half_TN,tn_4608_375_4096,Default,0.194508
GemmAndBiasTunableOp_Half_TN,tn_4608_362_4096,Gemm_Hipblaslt_TN_148165,0.19588
GemmAndBiasTunableOp_Half_TN,tn_4608_364_4096,Gemm_Hipblaslt_TN_148165,0.195563
GemmAndBiasTunableOp_Half_TN,tn_4608_422_4096,Gemm_Hipblaslt_TN_148169,0.266835
GemmAndBiasTunableOp_Half_TN,tn_4608_306_4096,Gemm_Hipblaslt_TN_148174,0.190396
GemmAndBiasTunableOp_Half_TN,tn_4608_549_4096,Gemm_Hipblaslt_TN_148168,0.290671
GemmAndBiasTunableOp_Half_TN,tn_4608_307_4096,Gemm_Hipblaslt_TN_148174,0.189203
GemmAndBiasTunableOp_Half_TN,tn_4608_499_4096,Gemm_Hipblaslt_TN_148168,0.30163
GemmAndBiasTunableOp_Half_TN,tn_4608_389_4096,Gemm_Hipblaslt_TN_148169,0.265975
GemmAndBiasTunableOp_Half_TN,tn_4608_415_4096,Gemm_Hipblaslt_TN_148169,0.26826
GemmAndBiasTunableOp_Half_TN,tn_4608_171_4096,Gemm_Hipblaslt_TN_148168,0.118377
GemmAndBiasTunableOp_Half_TN,tn_4608_405_4096,Gemm_Hipblaslt_TN_148169,0.261021
GemmAndBiasTunableOp_Half_TN,tn_4608_401_4096,Gemm_Hipblaslt_TN_148169,0.273022
GemmAndBiasTunableOp_Half_TN,tn_4608_450_4096,Gemm_Hipblaslt_TN_148169,0.271363
GemmAndBiasTunableOp_Half_TN,tn_4608_304_4096,Default,0.190734
GemmAndBiasTunableOp_Half_TN,tn_4608_318_4096,Gemm_Hipblaslt_TN_148174,0.191628
GemmAndBiasTunableOp_Half_TN,tn_4608_348_4096,Default,0.195643
GemmAndBiasTunableOp_Half_TN,tn_4608_197_4096,Gemm_Hipblaslt_TN_148165,0.156439
GemmAndBiasTunableOp_Half_TN,tn_4608_467_4096,Gemm_Hipblaslt_TN_148169,0.259499
GemmAndBiasTunableOp_Half_TN,tn_4608_303_4096,Gemm_Hipblaslt_TN_148174,0.190915
GemmAndBiasTunableOp_Half_TN,tn_4608_27_4096,Gemm_Hipblaslt_TN_148139,0.0557348
GemmAndBiasTunableOp_Half_TN,tn_4608_394_4096,Gemm_Hipblaslt_TN_148169,0.259791
GemmAndBiasTunableOp_Half_TN,tn_4608_345_4096,Default,0.192611
GemmAndBiasTunableOp_Half_TN,tn_4608_416_4096,Gemm_Hipblaslt_TN_148169,0.257581
GemmAndBiasTunableOp_Half_TN,tn_4608_116_4096,Gemm_Hipblaslt_TN_148165,0.116678
GemmAndBiasTunableOp_Half_TN,tn_4608_381_4096,Default,0.192747
GemmAndBiasTunableOp_Half_TN,tn_4608_18_4096,Gemm_Hipblaslt_TN_148139,0.0516528
GemmAndBiasTunableOp_Half_TN,tn_4608_233_4096,Gemm_Hipblaslt_TN_148165,0.162786
GemmAndBiasTunableOp_Half_TN,tn_4608_477_4096,Gemm_Hipblaslt_TN_148169,0.281346
GemmAndBiasTunableOp_Half_TN,tn_4608_406_4096,Gemm_Hipblaslt_TN_148169,0.262734
GemmAndBiasTunableOp_Half_TN,tn_4608_418_4096,Gemm_Hipblaslt_TN_148169,0.263537
GemmAndBiasTunableOp_Half_TN,tn_4608_153_4096,Gemm_Hipblaslt_TN_148168,0.11717
GemmAndBiasTunableOp_Half_TN,tn_4608_546_4096,Gemm_Hipblaslt_TN_148168,0.288016
GemmAndBiasTunableOp_Half_TN,tn_4608_476_4096,Gemm_Hipblaslt_TN_148169,0.262569
GemmAndBiasTunableOp_Half_TN,tn_4608_445_4096,Gemm_Hipblaslt_TN_148169,0.259656
GemmAndBiasTunableOp_Half_TN,tn_4608_385_4096,Gemm_Hipblaslt_TN_148169,0.253548
GemmAndBiasTunableOp_Half_TN,tn_4608_370_4096,Default,0.190147
GemmAndBiasTunableOp_Half_TN,tn_4608_84_4096,Gemm_Hipblaslt_TN_148165,0.0838062
GemmAndBiasTunableOp_Half_TN,tn_4608_512_4096,Gemm_Hipblaslt_TN_148168,0.307384
GemmAndBiasTunableOp_Half_TN,tn_4608_395_4096,Gemm_Hipblaslt_TN_148169,0.266013
GemmAndBiasTunableOp_Half_TN,tn_4608_545_4096,Gemm_Hipblaslt_TN_148168,0.288693
GemmAndBiasTunableOp_Half_TN,tn_4608_75_4096,Gemm_Hipblaslt_TN_148169,0.0723584
GemmAndBiasTunableOp_Half_TN,tn_4608_148_4096,Gemm_Hipblaslt_TN_148168,0.11662
GemmAndBiasTunableOp_Half_TN,tn_4608_96_4096,Gemm_Hipblaslt_TN_148169,0.0713024
GemmAndBiasTunableOp_Half_TN,tn_4608_72_4096,Gemm_Hipblaslt_TN_148168,0.0833184
GemmAndBiasTunableOp_Half_TN,tn_4608_425_4096,Gemm_Hipblaslt_TN_148169,0.271536
GemmAndBiasTunableOp_Half_TN,tn_4608_28_4096,Gemm_Hipblaslt_TN_148139,0.0568348
GemmAndBiasTunableOp_Half_TN,tn_4608_343_4096,Gemm_Hipblaslt_TN_148165,0.200683
GemmAndBiasTunableOp_Half_TN,tn_4608_224_4096,Gemm_Hipblaslt_TN_148165,0.152387
GemmAndBiasTunableOp_Half_TN,tn_4608_399_4096,Gemm_Hipblaslt_TN_148169,0.262724
GemmAndBiasTunableOp_Half_TN,tn_4608_356_4096,Default,0.190795
GemmAndBiasTunableOp_Half_TN,tn_4608_457_4096,Gemm_Hipblaslt_TN_148169,0.258348
GemmAndBiasTunableOp_Half_TN,tn_4608_296_4096,Gemm_Hipblaslt_TN_148174,0.189631
GemmAndBiasTunableOp_Half_TN,tn_4608_429_4096,Gemm_Hipblaslt_TN_148169,0.26896
GemmAndBiasTunableOp_Half_TN,tn_4608_344_4096,Default,0.190312
GemmAndBiasTunableOp_Half_TN,tn_4608_372_4096,Default,0.190011
GemmAndBiasTunableOp_Half_TN,tn_4608_63_4096,Gemm_Hipblaslt_TN_148169,0.0737904
GemmAndBiasTunableOp_Half_TN,tn_4608_374_4096,Gemm_Hipblaslt_TN_148165,0.201145
GemmAndBiasTunableOp_Half_TN,tn_4608_112_4096,Gemm_Hipblaslt_TN_148169,0.115035
GemmAndBiasTunableOp_Half_TN,tn_4608_25_4096,Gemm_Hipblaslt_TN_148139,0.0546988
GemmAndBiasTunableOp_Half_TN,tn_4608_523_4096,Gemm_Hipblaslt_TN_148168,0.298127
GemmAndBiasTunableOp_Half_TN,tn_4608_491_4096,Gemm_Hipblaslt_TN_148168,0.302653
GemmAndBiasTunableOp_Half_TN,tn_4608_36_4096,Gemm_Hipblaslt_TN_148169,0.0707584
GemmAndBiasTunableOp_Half_TN,tn_4608_439_4096,Gemm_Hipblaslt_TN_148169,0.258941
GemmAndBiasTunableOp_Half_TN,tn_4608_6_4096,Gemm_Hipblaslt_TN_148139,0.0516948
GemmAndBiasTunableOp_Half_TN,tn_4608_1_4096,Gemm_Hipblaslt_TN_148139,0.0518548
GemmAndBiasTunableOp_Half_TN,tn_4608_456_4096,Gemm_Hipblaslt_TN_148169,0.26707
GemmAndBiasTunableOp_Half_TN,tn_4608_525_4096,Gemm_Hipblaslt_TN_148168,0.319174
GemmAndBiasTunableOp_Half_TN,tn_4608_414_4096,Gemm_Hipblaslt_TN_148169,0.265956
GemmAndBiasTunableOp_Half_TN,tn_4608_58_4096,Gemm_Hipblaslt_TN_148169,0.0731384
GemmAndBiasTunableOp_Half_TN,tn_4608_325_4096,Gemm_Hipblaslt_TN_148165,0.194405
GemmAndBiasTunableOp_Half_TN,tn_4608_55_4096,Gemm_Hipblaslt_TN_148137,0.0690384
GemmAndBiasTunableOp_Half_TN,tn_4608_54_4096,Gemm_Hipblaslt_TN_148137,0.0729584
GemmAndBiasTunableOp_Half_TN,tn_4608_119_4096,Gemm_Hipblaslt_TN_148165,0.111926
GemmAndBiasTunableOp_Half_TN,tn_4608_8_4096,Gemm_Hipblaslt_TN_148139,0.0527108
GemmAndBiasTunableOp_Half_TN,tn_4608_448_4096,Gemm_Hipblaslt_TN_148169,0.258826
GemmAndBiasTunableOp_Half_TN,tn_4608_365_4096,Default,0.190625
GemmAndBiasTunableOp_Half_TN,tn_4608_78_4096,Gemm_Hipblaslt_TN_148169,0.0694464
GemmAndBiasTunableOp_Half_TN,tn_4608_70_4096,Gemm_Hipblaslt_TN_148169,0.0689606
GemmAndBiasTunableOp_Half_TN,tn_4608_313_4096,Default,0.194032
GemmAndBiasTunableOp_Half_TN,tn_4608_57_4096,Gemm_Hipblaslt_TN_148169,0.0711784
GemmAndBiasTunableOp_Half_TN,tn_4608_89_4096,Gemm_Hipblaslt_TN_148169,0.0740344
GemmAndBiasTunableOp_Half_TN,tn_4608_310_4096,Gemm_Hipblaslt_TN_148174,0.190979
GemmAndBiasTunableOp_Half_TN,tn_4608_670_4096,Gemm_Hipblaslt_TN_148169,0.372268
GemmAndBiasTunableOp_Half_TN,tn_4608_69_4096,Gemm_Hipblaslt_TN_148169,0.0713304
GemmAndBiasTunableOp_Half_TN,tn_4608_42_4096,Gemm_Hipblaslt_TN_148169,0.0696084
GemmAndBiasTunableOp_Half_TN,tn_4608_334_4096,Gemm_Hipblaslt_TN_148165,0.19655
GemmAndBiasTunableOp_Half_TN,tn_4608_109_4096,Gemm_Hipblaslt_TN_148165,0.112718
GemmAndBiasTunableOp_Half_TN,tn_4608_13_4096,Gemm_Hipblaslt_TN_148139,0.0531848
GemmAndBiasTunableOp_Half_TN,tn_4608_15_4096,Gemm_Hipblaslt_TN_148139,0.0530308
GemmAndBiasTunableOp_Half_TN,tn_4608_298_4096,Default,0.191299
GemmAndBiasTunableOp_Half_TN,tn_4608_243_4096,Gemm_Hipblaslt_TN_148165,0.154298
GemmAndBiasTunableOp_Half_TN,tn_4608_104_4096,Gemm_Hipblaslt_TN_148165,0.104726
GemmAndBiasTunableOp_Half_TN,tn_4608_19_4096,Gemm_Hipblaslt_TN_148139,0.0532528
GemmAndBiasTunableOp_Half_TN,tn_4608_66_4096,Gemm_Hipblaslt_TN_148169,0.0709744
GemmAndBiasTunableOp_Half_TN,tn_4608_21_4096,Gemm_Hipblaslt_TN_148139,0.0534868
GemmAndBiasTunableOp_Half_TN,tn_4608_64_4096,Gemm_Hipblaslt_TN_148137,0.0771504
GemmAndBiasTunableOp_Half_TN,tn_4608_87_4096,Gemm_Hipblaslt_TN_148169,0.0713346
GemmAndBiasTunableOp_Half_TN,tn_4608_123_4096,Gemm_Hipblaslt_TN_148169,0.11383
GemmAndBiasTunableOp_Half_TN,tn_4608_22_4096,Gemm_Hipblaslt_TN_148139,0.0545908
GemmAndBiasTunableOp_Half_TN,tn_4608_516_4096,Gemm_Hipblaslt_TN_148168,0.298052
GemmAndBiasTunableOp_Half_TN,tn_4608_76_4096,Gemm_Hipblaslt_TN_148169,0.0702544
GemmAndBiasTunableOp_Half_TN,tn_4608_103_4096,Gemm_Hipblaslt_TN_148169,0.113158
GemmAndBiasTunableOp_Half_TN,tn_4608_10_4096,Gemm_Hipblaslt_TN_148139,0.049913
GemmAndBiasTunableOp_Half_TN,tn_4608_302_4096,Gemm_Hipblaslt_TN_148174,0.191438
GemmAndBiasTunableOp_Half_TN,tn_4608_34_4096,Gemm_Hipblaslt_TN_148168,0.0722142
GemmAndBiasTunableOp_Half_TN,tn_4608_382_4096,Default,0.193846
GemmAndBiasTunableOp_Half_TN,tn_4608_35_4096,Gemm_Hipblaslt_TN_148169,0.0701184
GemmAndBiasTunableOp_Half_TN,tn_4608_393_4096,Gemm_Hipblaslt_TN_148169,0.263486
GemmAndBiasTunableOp_Half_TN,tn_4608_225_4096,Gemm_Hipblaslt_TN_148165,0.15957
GemmAndBiasTunableOp_Half_TN,tn_4608_564_4096,Gemm_Hipblaslt_TN_148168,0.29539
GemmAndBiasTunableOp_Half_TN,tn_4608_30_4096,Gemm_Hipblaslt_TN_148139,0.0564466
GemmAndBiasTunableOp_Half_TN,tn_4608_338_4096,Gemm_Hipblaslt_TN_148165,0.193339
GemmAndBiasTunableOp_Half_TN,tn_4608_134_4096,Gemm_Hipblaslt_TN_148165,0.11563
GemmAndBiasTunableOp_Half_TN,tn_4608_410_4096,Gemm_Hipblaslt_TN_148169,0.266616
GemmAndBiasTunableOp_Half_TN,tn_4608_535_4096,Gemm_Hipblaslt_TN_148168,0.287349
GemmAndBiasTunableOp_Half_TN,tn_4608_189_4096,Gemm_Hipblaslt_TN_148168,0.120583
GemmAndBiasTunableOp_Half_TN,tn_4608_73_4096,Gemm_Hipblaslt_TN_148169,0.0711104
GemmAndBiasTunableOp_Half_TN,tn_4608_81_4096,Gemm_Hipblaslt_TN_148169,0.0711024
GemmAndBiasTunableOp_Half_TN,tn_4608_424_4096,Gemm_Hipblaslt_TN_148169,0.263112
GemmAndBiasTunableOp_Half_TN,tn_4608_614_4096,Default,0.378984
GemmAndBiasTunableOp_Half_TN,tn_4608_392_4096,Gemm_Hipblaslt_TN_148169,0.262863
GemmAndBiasTunableOp_Half_TN,tn_4608_51_4096,Gemm_Hipblaslt_TN_148169,0.0723664
GemmAndBiasTunableOp_Half_TN,tn_4608_331_4096,Gemm_Hipblaslt_TN_148165,0.195252
GemmAndBiasTunableOp_Half_TN,tn_4608_121_4096,Gemm_Hipblaslt_TN_148165,0.112054
GemmAndBiasTunableOp_Half_TN,tn_4608_77_4096,Gemm_Hipblaslt_TN_148169,0.0700306
GemmAndBiasTunableOp_Half_TN,tn_4608_433_4096,Gemm_Hipblaslt_TN_148169,0.277856
GemmAndBiasTunableOp_Half_TN,tn_4608_26_4096,Gemm_Hipblaslt_TN_148139,0.0558928
GemmAndBiasTunableOp_Half_TN,tn_4608_60_4096,Gemm_Hipblaslt_TN_148137,0.0754224
GemmAndBiasTunableOp_Half_TN,tn_4608_335_4096,Default,0.19189
GemmAndBiasTunableOp_Half_TN,tn_4608_85_4096,Gemm_Hipblaslt_TN_148169,0.0763064
GemmAndBiasTunableOp_Half_TN,tn_4608_451_4096,Gemm_Hipblaslt_TN_148169,0.260674
GemmAndBiasTunableOp_Half_TN,tn_4608_444_4096,Gemm_Hipblaslt_TN_148169,0.259099
GemmAndBiasTunableOp_Half_TN,tn_4608_367_4096,Default,0.192837
GemmAndBiasTunableOp_Half_TN,tn_4608_92_4096,Gemm_Hipblaslt_TN_148169,0.0707904
GemmAndBiasTunableOp_Half_TN,tn_4608_94_4096,Gemm_Hipblaslt_TN_148169,0.0714386
GemmAndBiasTunableOp_Half_TN,tn_4608_95_4096,Gemm_Hipblaslt_TN_148169,0.0737026
GemmAndBiasTunableOp_Half_TN,tn_4608_102_4096,Gemm_Hipblaslt_TN_148169,0.116374
GemmAndBiasTunableOp_Half_TN,tn_4608_403_4096,Gemm_Hipblaslt_TN_148169,0.266724
GemmAndBiasTunableOp_Half_TN,tn_4608_107_4096,Gemm_Hipblaslt_TN_148169,0.11423
GemmAndBiasTunableOp_Half_TN,tn_4608_59_4096,Gemm_Hipblaslt_TN_148169,0.0719024
GemmAndBiasTunableOp_Half_TN,tn_4608_45_4096,Gemm_Hipblaslt_TN_148169,0.0704144
GemmAndBiasTunableOp_Half_TN,tn_4608_14_4096,Gemm_Hipblaslt_TN_148139,0.0532948
GemmAndBiasTunableOp_Half_TN,tn_4608_339_4096,Default,0.193428
GemmAndBiasTunableOp_Half_TN,tn_4608_453_4096,Gemm_Hipblaslt_TN_148169,0.258442
GemmAndBiasTunableOp_Half_TN,tn_4608_49_4096,Gemm_Hipblaslt_TN_148169,0.0759104
GemmAndBiasTunableOp_Half_TN,tn_4608_341_4096,Default,0.192518
GemmAndBiasTunableOp_Half_TN,tn_4608_68_4096,Gemm_Hipblaslt_TN_148168,0.0817262
GemmAndBiasTunableOp_Half_TN,tn_4608_12_4096,Gemm_Hipblaslt_TN_148139,0.0509828
GemmAndBiasTunableOp_Half_TN,tn_4608_98_4096,Gemm_Hipblaslt_TN_148165,0.112166
GemmAndBiasTunableOp_Half_TN,tn_4608_101_4096,Gemm_Hipblaslt_TN_148169,0.116174
GemmAndBiasTunableOp_Half_TN,tn_4608_132_4096,Gemm_Hipblaslt_TN_148165,0.116022
GemmAndBiasTunableOp_Half_TN,tn_4608_443_4096,Gemm_Hipblaslt_TN_148169,0.263941
GemmAndBiasTunableOp_Half_TN,tn_4608_534_4096,Gemm_Hipblaslt_TN_148168,0.3232
GemmAndBiasTunableOp_Half_TN,tn_4608_363_4096,Gemm_Hipblaslt_TN_148165,0.19786
GemmAndBiasTunableOp_Half_TN,tn_4608_309_4096,Gemm_Hipblaslt_TN_148174,0.19158
GemmAndBiasTunableOp_Half_TN,tn_4608_486_4096,Gemm_Hipblaslt_TN_148168,0.292974
GemmAndBiasTunableOp_Half_TN,tn_4608_397_4096,Gemm_Hipblaslt_TN_148169,0.264036
GemmAndBiasTunableOp_Half_TN,tn_4608_404_4096,Gemm_Hipblaslt_TN_148169,0.265756
GemmAndBiasTunableOp_Half_TN,tn_4608_496_4096,Gemm_Hipblaslt_TN_148168,0.301408
GemmAndBiasTunableOp_Half_TN,tn_4608_378_4096,Default,0.192843
GemmAndBiasTunableOp_Half_TN,tn_4608_490_4096,Gemm_Hipblaslt_TN_148168,0.309292
GemmAndBiasTunableOp_Half_TN,tn_4608_128_4096,Gemm_Hipblaslt_TN_148165,0.113151
GemmAndBiasTunableOp_Half_TN,tn_4608_100_4096,Gemm_Hipblaslt_TN_148169,0.104254
GemmAndBiasTunableOp_Half_TN,tn_4608_200_4096,Gemm_Hipblaslt_TN_148165,0.155648
GemmAndBiasTunableOp_Half_TN,tn_4608_413_4096,Gemm_Hipblaslt_TN_148169,0.267927
GemmAndBiasTunableOp_Half_TN,tn_4608_323_4096,Gemm_Hipblaslt_TN_148165,0.193324
GemmAndBiasTunableOp_Half_TN,tn_4608_369_4096,Default,0.191747
GemmAndBiasTunableOp_Half_TN,tn_4608_683_4096,Default,0.356722
GemmAndBiasTunableOp_Half_TN,tn_4608_836_4096,Gemm_Hipblaslt_TN_148168,0.456421
GemmAndBiasTunableOp_Half_TN,tn_4608_46_4096,Gemm_Hipblaslt_TN_148169,0.0697504
GemmAndBiasTunableOp_Half_TN,tn_4608_349_4096,Default,0.191174
GemmAndBiasTunableOp_Half_TN,tn_4608_354_4096,Gemm_Hipblaslt_TN_148165,0.197418
GemmAndBiasTunableOp_Half_TN,tn_4608_350_4096,Default,0.190211
GemmAndBiasTunableOp_Half_TN,tn_4608_398_4096,Gemm_Hipblaslt_TN_148169,0.268505
GemmAndBiasTunableOp_Half_TN,tn_4608_366_4096,Gemm_Hipblaslt_TN_148165,0.194676
GemmAndBiasTunableOp_Half_TN,tn_4608_582_4096,Gemm_Hipblaslt_TN_148169,0.391948
GemmAndBiasTunableOp_Half_TN,tn_4608_377_4096,Gemm_Hipblaslt_TN_148165,0.197356
GemmAndBiasTunableOp_Half_TN,tn_4608_352_4096,Default,0.191091
GemmAndBiasTunableOp_Half_TN,tn_4608_472_4096,Gemm_Hipblaslt_TN_148169,0.268341
GemmAndBiasTunableOp_Half_TN,tn_4608_355_4096,Gemm_Hipblaslt_TN_148165,0.197669
GemmAndBiasTunableOp_Half_TN,tn_4608_152_4096,Gemm_Hipblaslt_TN_148168,0.116978
GemmAndBiasTunableOp_Half_TN,tn_4608_470_4096,Gemm_Hipblaslt_TN_148169,0.266245
GemmAndBiasTunableOp_Half_TN,tn_4608_400_4096,Gemm_Hipblaslt_TN_148169,0.265694
GemmAndBiasTunableOp_Half_TN,tn_4608_368_4096,Default,0.190302
GemmAndBiasTunableOp_Half_TN,tn_4608_384_4096,Gemm_Hipblaslt_TN_148165,0.186899
GemmAndBiasTunableOp_Half_TN,tn_4608_140_4096,Gemm_Hipblaslt_TN_148168,0.115478
GemmAndBiasTunableOp_Half_TN,tn_4608_351_4096,Default,0.190299
GemmAndBiasTunableOp_Half_TN,tn_4608_386_4096,Gemm_Hipblaslt_TN_148169,0.265549
GemmAndBiasTunableOp_Half_TN,tn_4608_174_4096,Gemm_Hipblaslt_TN_148168,0.118303
GemmAndBiasTunableOp_Half_TN,tn_4608_3_4096,Gemm_Hipblaslt_TN_148139,0.0518508
GemmAndBiasTunableOp_Half_TN,tn_4608_1635_4096,Default,0.99484
GemmAndBiasTunableOp_Half_TN,tn_4608_461_4096,Gemm_Hipblaslt_TN_148169,0.274899
GemmAndBiasTunableOp_Half_TN,tn_4608_333_4096,Default,0.191715
GemmAndBiasTunableOp_Half_TN,tn_4608_321_4096,Default,0.18919
GemmAndBiasTunableOp_Half_TN,tn_4608_328_4096,Default,0.190496
GemmAndBiasTunableOp_Half_TN,tn_4608_322_4096,Default,0.191843
GemmAndBiasTunableOp_Half_TN,tn_4608_31_4096,Gemm_Hipblaslt_TN_148137,0.0560308
GemmAndBiasTunableOp_Half_TN,tn_4608_330_4096,Default,0.190602
GemmAndBiasTunableOp_Half_TN,tn_4608_312_4096,Gemm_Hipblaslt_TN_148174,0.190832
GemmAndBiasTunableOp_Half_TN,tn_4608_478_4096,Gemm_Hipblaslt_TN_148169,0.270396
GemmAndBiasTunableOp_Half_TN,tn_4608_432_4096,Gemm_Hipblaslt_TN_148169,0.259507
GemmAndBiasTunableOp_Half_TN,tn_4608_179_4096,Gemm_Hipblaslt_TN_148168,0.119585
GemmAndBiasTunableOp_Half_TN,tn_4608_319_4096,Gemm_Hipblaslt_TN_148174,0.193961
GemmAndBiasTunableOp_Half_TN,tn_4608_212_4096,Gemm_Hipblaslt_TN_148165,0.161241
GemmAndBiasTunableOp_Half_TN,tn_4608_7_4096,Gemm_Hipblaslt_TN_148121,0.0516548
GemmAndBiasTunableOp_Half_TN,tn_4608_209_4096,Gemm_Hipblaslt_TN_148165,0.160521
GemmAndBiasTunableOp_Half_TN,tn_4608_317_4096,Gemm_Hipblaslt_TN_148174,0.189459
GemmAndBiasTunableOp_Half_TN,tn_4608_387_4096,Gemm_Hipblaslt_TN_148169,0.264373
GemmAndBiasTunableOp_Half_TN,tn_4608_358_4096,Default,0.196075
GemmAndBiasTunableOp_Half_TN,tn_4608_301_4096,Gemm_Hipblaslt_TN_148174,0.192363
GemmAndBiasTunableOp_Half_TN,tn_4608_537_4096,Gemm_Hipblaslt_TN_148168,0.320762
GemmAndBiasTunableOp_Half_TN,tn_4608_29_4096,Gemm_Hipblaslt_TN_148139,0.0534948
GemmAndBiasTunableOp_Half_TN,tn_4608_315_4096,Default,0.19062
GemmAndBiasTunableOp_Half_TN,tn_4608_33_4096,Gemm_Hipblaslt_TN_148169,0.0670904
GemmAndBiasTunableOp_Half_TN,tn_4608_383_4096,Default,0.192876
GemmAndBiasTunableOp_Half_TN,tn_4608_508_4096,Gemm_Hipblaslt_TN_148168,0.287936
GemmAndBiasTunableOp_Half_TN,tn_4608_308_4096,Default,0.187774
GemmAndBiasTunableOp_Half_TN,tn_4608_554_4096,Gemm_Hipblaslt_TN_148168,0.291001
GemmAndBiasTunableOp_Half_TN,tn_4608_460_4096,Gemm_Hipblaslt_TN_148169,0.264439
GemmAndBiasTunableOp_Half_TN,tn_4608_479_4096,Gemm_Hipblaslt_TN_148169,0.265429
GemmAndBiasTunableOp_Half_TN,tn_4608_326_4096,Default,0.191572
GemmAndBiasTunableOp_Half_TN,tn_4608_324_4096,Default,0.19028
GemmAndBiasTunableOp_Half_TN,tn_4608_82_4096,Gemm_Hipblaslt_TN_148169,0.0710066
GemmAndBiasTunableOp_Half_TN,tn_4608_316_4096,Default,0.189902
GemmAndBiasTunableOp_Half_TN,tn_4608_192_4096,Gemm_Hipblaslt_TN_148168,0.114929
GemmAndBiasTunableOp_Half_TN,tn_4608_206_4096,Gemm_Hipblaslt_TN_148165,0.157136
GemmAndBiasTunableOp_Half_TN,tn_4608_438_4096,Gemm_Hipblaslt_TN_148169,0.271933
GemmAndBiasTunableOp_Half_TN,tn_4608_417_4096,Gemm_Hipblaslt_TN_148169,0.26778
GemmAndBiasTunableOp_Half_TN,tn_4608_187_4096,Gemm_Hipblaslt_TN_148168,0.121821
GemmAndBiasTunableOp_Half_TN,tn_4608_138_4096,Gemm_Hipblaslt_TN_148168,0.117442
GemmAndBiasTunableOp_Half_TN,tn_4608_305_4096,Gemm_Hipblaslt_TN_148174,0.188219
GemmAndBiasTunableOp_Half_TN,tn_4608_327_4096,Default,0.189923
GemmAndBiasTunableOp_Half_TN,tn_4608_631_4096,Default,0.377244
GemmAndBiasTunableOp_Half_TN,tn_4608_357_4096,Default,0.192748
GemmAndBiasTunableOp_Half_TN,tn_4608_713_4096,Default,0.396038
GemmAndBiasTunableOp_Half_TN,tn_4608_223_4096,Gemm_Hipblaslt_TN_148165,0.162362
GemmAndBiasTunableOp_Half_TN,tn_4608_510_4096,Gemm_Hipblaslt_TN_148168,0.300693
GemmAndBiasTunableOp_Half_TN,tn_4608_332_4096,Default,0.187985
GemmAndBiasTunableOp_Half_TN,tn_4608_538_4096,Gemm_Hipblaslt_TN_148168,0.290375
GemmAndBiasTunableOp_Half_TN,tn_4608_111_4096,Gemm_Hipblaslt_TN_148169,0.114662
GemmAndBiasTunableOp_Half_TN,tn_4608_430_4096,Gemm_Hipblaslt_TN_148169,0.265636
GemmAndBiasTunableOp_Half_TN,tn_4608_580_4096,Default,0.352355
GemmAndBiasTunableOp_Half_TN,tn_4608_584_4096,Gemm_Hipblaslt_TN_148169,0.366902
GemmAndBiasTunableOp_Half_TN,tn_4608_340_4096,Default,0.189909
GemmAndBiasTunableOp_Half_TN,tn_4608_480_4096,Gemm_Hipblaslt_TN_148169,0.2599
GemmAndBiasTunableOp_Half_TN,tn_4608_254_4096,Gemm_Hipblaslt_TN_148165,0.158346
GemmAndBiasTunableOp_Half_TN,tn_4608_17_4096,Gemm_Hipblaslt_TN_148139,0.0533668
GemmAndBiasTunableOp_Half_TN,tn_4608_5_4096,Gemm_Hipblaslt_TN_148121,0.0517508
GemmAndBiasTunableOp_Half_TN,tn_4608_569_4096,Gemm_Hipblaslt_TN_148168,0.301215
GemmAndBiasTunableOp_Half_TN,tn_4608_411_4096,Gemm_Hipblaslt_TN_148169,0.264033
GemmAndBiasTunableOp_Half_TN,tn_4608_462_4096,Gemm_Hipblaslt_TN_148169,0.262449
GemmAndBiasTunableOp_Half_TN,tn_4608_337_4096,Default,0.195883
GemmAndBiasTunableOp_Half_TN,tn_4608_431_4096,Gemm_Hipblaslt_TN_148169,0.262935
GemmAndBiasTunableOp_Half_TN,tn_4608_488_4096,Gemm_Hipblaslt_TN_148168,0.305736
GemmAndBiasTunableOp_Half_TN,tn_4608_481_4096,Gemm_Hipblaslt_TN_148168,0.30915
GemmAndBiasTunableOp_Half_TN,tn_4608_329_4096,Gemm_Hipblaslt_TN_148165,0.195964
GemmAndBiasTunableOp_Half_TN,tn_4608_571_4096,Gemm_Hipblaslt_TN_148168,0.312718
GemmAndBiasTunableOp_Half_TN,tn_4608_527_4096,Gemm_Hipblaslt_TN_148168,0.297253
GemmAndBiasTunableOp_Half_TN,tn_4608_299_4096,Default,0.189178
GemmAndBiasTunableOp_Half_TN,tn_4608_376_4096,Default,0.19206
GemmAndBiasTunableOp_Half_TN,tn_4608_16_4096,Gemm_Hipblaslt_TN_148178,0.0552224
GemmAndBiasTunableOp_Half_TN,tn_4608_515_4096,Gemm_Hipblaslt_TN_148168,0.299467
GemmAndBiasTunableOp_Half_TN,tn_4608_130_4096,Gemm_Hipblaslt_TN_148165,0.11143
GemmAndBiasTunableOp_Half_TN,tn_4608_4_4096,Gemm_Hipblaslt_TN_148121,0.0514228
GemmAndBiasTunableOp_Half_TN,tn_4608_469_4096,Gemm_Hipblaslt_TN_148169,0.270579
GemmAndBiasTunableOp_Half_TN,tn_4608_622_4096,Default,0.361502
GemmAndBiasTunableOp_Half_TN,tn_4608_388_4096,Gemm_Hipblaslt_TN_148169,0.253386
GemmAndBiasTunableOp_Half_TN,tn_4608_244_4096,Gemm_Hipblaslt_TN_148165,0.152154
GemmAndBiasTunableOp_Half_TN,tn_4608_2_4096,Gemm_Hipblaslt_TN_148121,0.0503588
GemmAndBiasTunableOp_Half_TN,tn_4608_181_4096,Gemm_Hipblaslt_TN_148168,0.117567
GemmAndBiasTunableOp_Half_TN,tn_4608_522_4096,Gemm_Hipblaslt_TN_148168,0.296581
GemmAndBiasTunableOp_Half_TN,tn_4608_293_4096,Gemm_Hipblaslt_TN_148174,0.189739
GemmAndBiasTunableOp_Half_TN,tn_4608_501_4096,Gemm_Hipblaslt_TN_148168,0.291757
GemmAndBiasTunableOp_Half_TN,tn_4608_346_4096,Default,0.188041
GemmAndBiasTunableOp_Half_TN,tn_4608_518_4096,Gemm_Hipblaslt_TN_148168,0.304058
GemmAndBiasTunableOp_Half_TN,tn_4608_133_4096,Gemm_Hipblaslt_TN_148165,0.11491
GemmAndBiasTunableOp_Half_TN,tn_4608_11_4096,Gemm_Hipblaslt_TN_148139,0.050829
GemmAndBiasTunableOp_Half_TN,tn_4608_407_4096,Gemm_Hipblaslt_TN_148169,0.257256
GemmAndBiasTunableOp_Half_TN,tn_4608_419_4096,Gemm_Hipblaslt_TN_148169,0.257584
